produto,preco,desconto,link,marca
Chuteira Mizuno Morelia Classic AS Society Branca,449.9,0,https://www.futfanatics.com.br/chuteira-mizuno-morelia-classic-as-society-branca,Mizuno
Chuteira Kappa Washington Society Cinza e Verde,169.9,0,https://www.futfanatics.com.br/chuteira-kappa-washington-society-cinza-e-verde,Kappa
Chuteira Kappa Washington Campo Preta,169.9,0,https://www.futfanatics.com.br/chuteira-kappa-washington-campo-preta,Kappa
Chuteira Kappa Washington Campo Cinza e Verde,169.9,0,https://www.futfanatics.com.br/chuteira-kappa-washington-campo-cinza-e-verde,Kappa
Chuteira Kappa San Diego Society Cinza e Preta,169.9,0,https://www.futfanatics.com.br/chuteira-kappa-san-diego-society-cinza-e-preta,Kappa
Chuteira Kappa San Diego Futsal Vermelha e Preta,169.9,0,https://www.futfanatics.com.br/chuteira-kappa-san-diego-futsal-vermelha-e-preta,Kappa
Chuteira Penalty Garra Y-2 Campo Preta e Dourada,169.9,0,https://www.futfanatics.com.br/chuteira-penalty-garra-y-2-campo-preta-e-dourada,Penalty
Chuteira Penalty Garra Y-2 Society Preta e Dourada,169.9,0,https://www.futfanatics.com.br/chuteira-penalty-garra-y-2-society-preta-e-dourada,Penalty
Chuteira Penalty Garra Y-2 Futsal Branca,169.9,0,https://www.futfanatics.com.br/chuteira-penalty-garra-y-2-futsal-branca,Penalty
Chuteira Penalty Garra Y-2 Futsal Preta e Dourada,169.9,0,https://www.futfanatics.com.br/chuteira-penalty-garra-y-2-futsal-preta-e-dourada,Penalty
Chuteira Umbro Attak Futsal Preta,249.9,0,https://www.futfanatics.com.br/chuteira-umbro-attak-futsal-preta,Umbro
Chuteira Penalty Bravo Y-3 Campo Marinho,159.9,0,https://www.futfanatics.com.br/chuteira-penalty-bravo-y-3-campo-marinho,Penalty
Chuteira Penalty Bravo Y-3 Campo Preta,159.9,0,https://www.futfanatics.com.br/chuteira-penalty-bravo-y-3-campo-preta,Penalty
Chuteira Penalty Bravo Y-3 Futsal Branca,159.9,0,https://www.futfanatics.com.br/chuteira-penalty-bravo-y-3-futsal-branca,Penalty
Chuteira Penalty Bravo Y-3 Futsal Amarela,159.9,0,https://www.futfanatics.com.br/chuteira-penalty-bravo-y-3-futsal-amarela,Penalty
Chuteira Penalty Bravo Y-3 Futsal Verde,159.9,0,https://www.futfanatics.com.br/chuteira-penalty-bravo-y-3-futsal-verde,Penalty
Chuteira Penalty Bravo Y-3 Futsal Marinho,159.9,0,https://www.futfanatics.com.br/chuteira-penalty-bravo-y-3-futsal-marinho,Penalty
Chuteira Kappa Washington Futsal Preta,169.9,0,https://www.futfanatics.com.br/chuteira-kappa-washington-futsal-preta,Kappa
Chuteira Kappa Washington Society Preta,169.9,0,https://www.futfanatics.com.br/chuteira-kappa-washington-society-preta,Kappa
Chuteira Umbro Speciali Campo Preta e Branca,279.9,0,https://www.futfanatics.com.br/chuteira-umbro-speciali-campo-preta-e-branca,Umbro
Chuteira Kappa Phoenix Society Preta e Branca,199.9,0,https://www.futfanatics.com.br/chuteira-kappa-phoenix-society-preta-e-branca,Kappa
Chuteira Kappa Florida Society Verde Limão e Preta,179.9,0,https://www.futfanatics.com.br/chuteira-kappa-florida-society-verde-limao-e-preta,Kappa
Chuteira Kappa Florida Society Prata e Laranja,179.9,0,https://www.futfanatics.com.br/chuteira-kappa-florida-society-prata-e-laranja,Kappa
Chuteira Kappa Flórida Futsal Verde e Preta,179.9,0,https://www.futfanatics.com.br/chuteira-kappa-florida-futsal-verde-e-preta,Kappa
Chuteira Kappa Florida Futsal Preta e Azul,179.9,0,https://www.futfanatics.com.br/chuteira-kappa-florida-futsal-preta-e-azul,Kappa
Chuteira Kappa Flórida Futsal Prata e Laranja,179.9,0,https://www.futfanatics.com.br/chuteira-kappa-florida-futsal-prata-e-laranja,Kappa
Chuteira Adidas X Crazyfast Messi Elite FG Campo Azul,1799.9,0,https://www.futfanatics.com.br/chuteira-adidas-x-crazyfast-messi-elite-fg-campo-azul,Adidas
Chuteira Kappa Flórida Campo Prata e Laranja,179.9,0,https://www.futfanatics.com.br/chuteira-kappa-florida-campo-prata-e-laranja,Kappa
Chuteira Penalty Lider Y-4 Society Laranja,189.9,0,https://www.futfanatics.com.br/chuteira-penalty-lider-y-4-society-laranja,Penalty
Chuteira Penalty Líder Y-4 Society Branca,189.9,0,https://www.futfanatics.com.br/chuteira-penalty-lider-y-4-society-branca,Penalty
Chuteira Umbro Neo Striker Futsal Azul Royal,199.9,0,https://www.futfanatics.com.br/chuteira-umbro-neo-striker-futsal-azul-royal,Umbro
Chuteira Kappa Phoenix Campo Vermelha e Preta,199.9,0,https://www.futfanatics.com.br/chuteira-kappa-phoenix-campo-vermelha-e-preta,Kappa
Chuteira Kappa Phoenix Campo Preta e Branca,199.9,0,https://www.futfanatics.com.br/chuteira-kappa-phoenix-campo-preta-e-branca,Kappa
Chuteira Kappa Phoenix Futsal Azul e Preta,199.9,0,https://www.futfanatics.com.br/chuteira-kappa-phoenix-futsal-azul-e-preta,Kappa
Chuteira Kappa Phoenix Futsal Branca e Verde,199.9,0,https://www.futfanatics.com.br/chuteira-kappa-phoenix-futsal-branca-e-verde,Kappa
Chuteira Kappa Phoenix Society Vermelha e Preta,199.9,0,https://www.futfanatics.com.br/chuteira-kappa-phoenix-society-vermelha-e-preta,Kappa
Chuteira Penalty Bravo Y-3 Futsal Preta e Cinza,159.9,0,https://www.futfanatics.com.br/chuteira-penalty-bravo-y-3-futsal-preta-e-cinza,Penalty
Chuteira Umbro Speciali Classic Futsal Preto e Branco,279.9,0,https://www.futfanatics.com.br/chuteira-umbro-speciali-classic-futsal-preto-e-branco,Umbro
Chuteira Mizuno Morelia Classic MD Campo Preta,449.9,0,https://www.futfanatics.com.br/chuteira-mizuno-morelia-classic-md-campo-preta,Mizuno
Chuteira Adidas Copa Pure 23 Club TF Society Off White,379.9,0,https://www.futfanatics.com.br/chuteira-adidas-copa-pure-23-club-tf-society-off-white,Adidas
Chuteira Adidas X Crazyfast 23 Club TF Society Amarela,379.9,0,https://www.futfanatics.com.br/chuteira-adidas-x-crazyfast-23-club-tf-society-amarela,Adidas
Chuteira Adidas Predator 24 Club TF Society Preta,379.9,0,https://www.futfanatics.com.br/chuteira-adidas-predator-24-club-tf-society-preta,Adidas
Chuteira Adidas Predator 24 Club TF Society Preta e Vermelha,379.9,0,https://www.futfanatics.com.br/chuteira-adidas-predator-24-club-tf-society-preta-e-vermelha,Adidas
Chuteira Adidas X Crazyfast 23 Club FxG Campo Preta,379.9,0,https://www.futfanatics.com.br/chuteira-adidas-x-crazyfast-23-club-fxg-campo-preta,Adidas
Chuteira Adidas Copa Pure 23 Club FxG Campo Off White,379.9,0,https://www.futfanatics.com.br/chuteira-adidas-copa-pure-23-club-fxg-campo-off-white,Adidas
Chuteira Adidas Copa Pure 23 Club FxG Campo Preta,379.9,0,https://www.futfanatics.com.br/chuteira-adidas-copa-pure-23-club-fxg-campo-preta,Adidas
Chuteira Adidas Predator 24 Club FxG Campo Preta,379.9,0,https://www.futfanatics.com.br/chuteira-adidas-predator-24-club-fxg-campo-preta,Adidas
Chuteira Adidas Predator 24 Club FxG Campo Preta e Vermelha,379.9,0,https://www.futfanatics.com.br/chuteira-adidas-predator-24-club-fxg-campo-preta-e-laranja,Adidas
Chuteira Adidas Copa Pure 23 Club IN Futsal Off White,379.9,0,https://www.futfanatics.com.br/chuteira-adidas-copa-pure-23-club-in-futsal-off-white,Adidas
Chuteira Adidas X Crazy 23 Club IN Futsal Amarela,379.9,0,https://www.futfanatics.com.br/chuteira-adidas-x-crazy-23-club-in-futsal-amarela,Adidas
Chuteira Adidas Predator 24 Club IN Futsal Preta e Vermelha,379.9,0,https://www.futfanatics.com.br/chuteira-adidas-predator-24-club-in-futsal-preta-e-vermelha,Adidas
Chuteira Adidas Predator 24 Club IN Futsal Preta,379.9,0,https://www.futfanatics.com.br/chuteira-adidas-predator-24-club-in-futsal-preta,Adidas
Chuteira Adidas Predator 24 Club Sock TF Society Preta e Vermelha,399.9,0,https://www.futfanatics.com.br/chuteira-adidas-predator-24-club-sock-tf-society-preta-e-vermelha,Adidas
Chuteira Adidas Predator 24 Club Sock FxG Campo Preta e Vermelha,399.9,0,https://www.futfanatics.com.br/chuteira-adidas-predator-24-club-sock-fxg-campo-preta-e-vermelha,Adidas
Chuteira Umbro Pro 5 Bump Brfutsal Club Futsal Preta,449.9,0,https://www.futfanatics.com.br/chuteira-umbro-pro-5-bump-brfutsal-club-futsal-preta,Umbro
Chuteira Adidas Copa Pure 23 Club TF Society Preta,379.9,0,https://www.futfanatics.com.br/chuteira-adidas-copa-pure-23-club-tf-society-preta,Adidas
Chuteira Mizuno Morelia Club IN Futsal Branca e Dourada,349.9,0,https://www.futfanatics.com.br/chuteira-mizuno-morelia-club-in-futsal-branca-e-dourada,Mizuno
Chuteira Adidas Deportivo II IN Futsal Branca e Azul,299.9,0,https://www.futfanatics.com.br/chuteira-adidas-deportivo-ii-in-futsal-branca-e-azul,Adidas
Chuteira Mizuno Morelia Club IN Futsal Amarela e Vermelha,349.9,0,https://www.futfanatics.com.br/chuteira-mizuno-morelia-club-in-futsal-amarela-e-vermelha,Mizuno
Chuteira Kappa Florida Society Preta e Azul,179.9,0,https://www.futfanatics.com.br/chuteira-kappa-florida-society-preta-e-azul,Kappa
Chuteira Adidas Predator Artilheira 24 TF Society Preta e Vermelha,329.9,0,https://www.futfanatics.com.br/chuteira-adidas-predator-artilheira-24-tf-society-preta-e-vermelha,Adidas
Chuteira Adidas Predator Artilheira 24.5 FG Campo Preta e Vermelha,329.9,0,https://www.futfanatics.com.br/chuteira-adidas-predator-artilheira-24-5-fg-campo-preta-e-vermelha,Adidas
Chuteira Adidas Predator Essentials 24.5 IN Futsal Preta e Vermelha,329.9,0,https://www.futfanatics.com.br/chuteira-adidas-predator-essentials-24-5-in-futsal-preta-e-vermelha,Adidas
Chuteira Joma Dribling Futsal Branca e Marinho,349.9,0,https://www.futfanatics.com.br/chuteira-joma-dribling-futsal-branca-e-marinho,Joma
Chuteira Joma Dribling Society Branca e Marinho,349.9,0,https://www.futfanatics.com.br/chuteira-joma-dribling-society-branca-e-marinho,Joma
Chuteira Joma Dribling Society Preta e Laranja,349.9,0,https://www.futfanatics.com.br/chuteira-joma-dribling-society-preta-e-laranja,Joma
Chuteira Joma Dribling Futsal Preta e Laranja,349.9,0,https://www.futfanatics.com.br/chuteira-joma-dribling-futsal-preta-e-laranja,Joma
Chuteira Joma Dribling Futsal Marinho e Verde Limão,349.9,0,https://www.futfanatics.com.br/chuteira-joma-dribling-futsal-marinho-e-verde-limao,Joma
Chuteira Mizuno Morelia Club MD Campo Branca,349.9,0,https://www.futfanatics.com.br/chuteira-mizuno-morelia-club-md-campo-branca,Mizuno
Chuteira Mizuno Morelia Club MD Campo Preta e Branca,349.9,0,https://www.futfanatics.com.br/chuteira-mizuno-morelia-club-md-campo-preta-e-branca,Mizuno
Chuteira Mizuno Morelia Club AS Society Preta,349.9,0,https://www.futfanatics.com.br/chuteira-mizuno-morelia-club-as-society-preta,Mizuno
Chuteira Mizuno Morelia Club MD Campo Amarela,349.9,0,https://www.futfanatics.com.br/chuteira-mizuno-morelia-club-md-campo-amarela,Mizuno
Chuteira Mizuno Morelia Club MD Campo Laranja e Preta,349.9,0,https://www.futfanatics.com.br/chuteira-mizuno-morelia-club-md-campo-laranja-e-preta,Mizuno
Chuteira Mizuno Morelia Club IN Futsal Preta e Branca,349.9,0,https://www.futfanatics.com.br/chuteira-mizuno-morelia-club-in-futsal-preta-e-branca,Mizuno
Chuteira Kappa Florida Campo Preta e Azul,179.9,0,https://www.futfanatics.com.br/chuteira-kappa-florida-campo-preta-e-azul,Kappa
