marca;preco;desconto;link
Tênis Everlast Climber III Branco;289.9;17;https://www.futfanatics.com.br/tenis-everlast-climber-iii-branco
Bota Bradok Boulder Discovery Marrom;369.9;17;https://www.futfanatics.com.br/bota-bradok-boulder-discovery-marrom
Tênis Oakley Ev Zero Lite Preto;369.9;17;https://www.futfanatics.com.br/tenis-oakley-ev-zero-lite-preto
Tênis Oakley Fusion Preto;369.9;17;https://www.futfanatics.com.br/tenis-oakley-fusion-preto
Tênis Oakley Fusion Lifestyle Preto;369.9;17;https://www.futfanatics.com.br/tenis-oakley-fusion-lifestyle-preto
Bota Bradok Levy Sleeky Marrom;369.9;17;https://www.futfanatics.com.br/bota-bradok-levy-sleeky-marrom
Tênis Fila Iconic Preto;229.9;17;https://www.futfanatics.com.br/tenis-fila-iconic-preto
Tênis Cavalera Blockcolor Low Branco;379.9;17;https://www.futfanatics.com.br/tenis-cavalera-blockcolor-low-branco
Tênis Asics Gel-Shogun 4 Cinza e Preto;329.9;17;https://www.futfanatics.com.br/tenis-asics-gel-shogun-4-cinza-e-preto
Tênis Fila Activity Marinho e Branco;229.9;17;https://www.futfanatics.com.br/tenis-fila-activity-marinho-e-branco
Tênis Fila TR-Knit Marinho e Vermelho;229.9;17;https://www.futfanatics.com.br/tenis-fila-tr-knit-marinho-e-vermelho
Tênis Fila Iconic Grafite e Marinho;229.9;17;https://www.futfanatics.com.br/tenis-fila-iconic-grafite-e-marinho
Tenis Fila Racer T2 Branco e Laranja;499.9;16;https://www.futfanatics.com.br/tenis-fila-racer-t2-branco-e-laranja
Tênis Asics Gel-Kimera Preto e Vermelho;499.9;16;https://www.futfanatics.com.br/tenis-asics-gel-kimera-preto-e-vermelho
Tênis Adidas EQ21 Run Branco;499.9;16;https://www.futfanatics.com.br/tenis-adidas-eq21-run-branco
Tênis Adidas EQ21 Run Preto;499.9;16;https://www.futfanatics.com.br/tenis-adidas-eq21-run-preto
Tênis Fila Euro Jogger Sport Preto e Grafite;299.9;16;https://www.futfanatics.com.br/tenis-fila-euro-jogger-sport-preto-e-grafite
Tênis Reserva Hunter Marrom;499.9;16;https://www.futfanatics.com.br/tenis-reserva-hunter-marrom
Tênis Fila Transition Branco e Marinho;249.9;16;https://www.futfanatics.com.br/tenis-fila-transition-branco-e-marinho
Tênis Olympikus Index 2 Azul;149.9;16;https://www.futfanatics.com.br/tenis-olympikus-index-2-azul
Chinelo Oakley Banks Cinza;149.9;16;https://www.futfanatics.com.br/chinelo-oakley-banks-cinza
Tênis Under Armour Flow Velociti SE Preto;749.9;16;https://www.futfanatics.com.br/tenis-under-armour-flow-velociti-se-preto
Tênis Fila Racer T2 Laranja e Cinza;499.9;16;https://www.futfanatics.com.br/tenis-fila-racer-t2-laranja-e-cinza
Tênis Fila Euro Jogger Sport Marinho e Branco;299.9;16;https://www.futfanatics.com.br/tenis-fila-euro-jogger-sport-marinho-e-branco
Tênis Coca Cola Near Preto;199.9;16;https://www.futfanatics.com.br/tenis-coca-cola-near-preto
Tênis Fila Euro Jogger Sport Bege e Marinho;299.9;16;https://www.futfanatics.com.br/tenis-fila-euro-jogger-sport-bege-e-marinho
Tênis Everlast Cave Runner Vermelho e Preto;249.9;16;https://www.futfanatics.com.br/tenis-everlast-cave-runner-vermelho-e-preto
Tênis Olympikus Lusion Branco;249.9;16;https://www.futfanatics.com.br/tenis-olympikus-lusion-branco
Tênis Olympikus Corre Rastro Cinza e Preto;249.9;16;https://www.futfanatics.com.br/tenis-olympikus-corre-rastro-cinza-e-preto
Tênis Under Armour Charged Brezzy Preto;249.9;16;https://www.futfanatics.com.br/tenis-under-armour-charged-brezzy-preto
Tênis Everlast Cave Runner Preto e Cinza;249.9;16;https://www.futfanatics.com.br/tenis-everlast-cave-runner-preto-e-cinza
Tênis Adidas Lite Racer 3.0 Marinho;249.9;16;https://www.futfanatics.com.br/tenis-adidas-lite-racer-3-0-marinho
Tênis Asics Versablast 2 SE Preto e Vermelho;249.9;16;https://www.futfanatics.com.br/tenis-asics-versablast-2-se-preto-e-vermelho
Tenis Fila Athlon Azul;249.9;16;https://www.futfanatics.com.br/tenis-fila-athlon-azul
Tênis Fila Athlon Preto e Cinza;249.9;16;https://www.futfanatics.com.br/tenis-fila-athlon-preto-e-cinza
Tênis Adidas Ligra 7 Preto;419.9;16;https://www.futfanatics.com.br/tenis-adidas-ligra-7-preto
Tênis Reserva Hunter Off White;419.9;16;https://www.futfanatics.com.br/tenis-reserva-hunter-off-white
Tênis Fila Euro Jogger Sport Cinza e Marinho;299.9;16;https://www.futfanatics.com.br/tenis-fila-euro-jogger-sport-cinza-e-marinho
Tênis Under Armour FLOW Velociti Wind Branco e Verde;999.9;16;https://www.futfanatics.com.br/tenis-under-armour-flow-velociti-wind-branco-e-verde
Tênis Mizuno Wave Creation 23 Marinho;999.9;16;https://www.futfanatics.com.br/tenis-mizuno-wave-creation-23-marinho
Tênis Puma X-Ray Game BDP Marinho e Branco;359.9;16;https://www.futfanatics.com.br/tenis-puma-x-ray-game-bdp-marinho-e-branco
Tênis Fila Racer T2 Preto e Prata;499.9;16;https://www.futfanatics.com.br/tenis-fila-racer-t2-preto-e-prata
Tênis Fila Tractor Marinho e Vermelho;249.9;16;https://www.futfanatics.com.br/tenis-fila-tractor-marinho-e-vermelho
Chinelo Puma Leadcat 2.0 BDP Branco;149.9;16;https://www.futfanatics.com.br/chinelo-puma-leadcat-2-0-bdp-branco
Tênis Puma Mercedes AMG Petronas MAPF1 Drift Cat Delta Branco;459.9;16;https://www.futfanatics.com.br/tenis-puma-mercedes-amg-petronas-mapf1-drift-cat-delta-branco
Tênis Olympikus Diffuse 4 Preto e Dourado;249.9;16;https://www.futfanatics.com.br/tenis-olympikus-diffuse-4-preto-e-dourado
Tênis Olympikus Diffuse 4 Preto e Vermelho;249.9;16;https://www.futfanatics.com.br/tenis-olympikus-diffuse-4-preto-e-vermelho
Tênis Fila Transition Marinho e Cinza;249.9;16;https://www.futfanatics.com.br/tenis-fila-transition-marinho-e-cinza
Tênis Fila Start Preto e Azul;249.9;16;https://www.futfanatics.com.br/tenis-fila-start-preto-e-azul
Tênis Asics Versablast 2 SE Azul e Branco;249.9;16;https://www.futfanatics.com.br/tenis-asics-versablast-2-se-azul-e-branco
Tênis Adidas Lite Racer 3.0 Preto e Branco;249.9;16;https://www.futfanatics.com.br/tenis-adidas-lite-racer-3-0-preto-e-branco
Tênis Under Armour Charged Slight Preto;249.9;16;https://www.futfanatics.com.br/tenis-under-armour-charged-slight-preto
Tênis Asics Versablast 2 SE Preto e Laranja;249.9;16;https://www.futfanatics.com.br/tenis-asics-versablast-2-se-preto-e-laranja
Tênis Olympikus Vibração Vermelho;149.9;16;https://www.futfanatics.com.br/tenis-olympikus-vibracao-vermelho
Tênis Reserva Neopreme Grafite;459.9;16;https://www.futfanatics.com.br/tenis-reserva-neopreme-grafite
Tênis Under Armour HOVR Sonic 5 Laranja;749.9;16;https://www.futfanatics.com.br/tenis-under-armour-hovr-sonic-5-laranja
Tênis Olympikus Corre Rastro Cinza;249.9;16;https://www.futfanatics.com.br/tenis-olympikus-corre-rastro-cinza
Tênis Olympikus Corre Rastro Preto e Vermelho;249.9;16;https://www.futfanatics.com.br/tenis-olympikus-corre-rastro-preto-e-vermelho
Tênis Coca Cola Kick Summer Verde Anis;169.9;15;https://www.futfanatics.com.br/tenis-coca-cola-kick-summer-verde-anis
Tênis Qix Hills Low Preto;159.9;15;https://www.futfanatics.com.br/tenis-qix-hills-low-preto
Tênis Cavalera Color Line Preto e Prata;219.9;15;https://www.futfanatics.com.br/tenis-cavalera-color-line-preto-e-prata
Tênis Cavalera Running Stripes Preto e Cinza;219.9;15;https://www.futfanatics.com.br/tenis-cavalera-running-stripes-preto-e-cinza
Tênis Olympikus Mood Branco;169.9;15;https://www.futfanatics.com.br/tenis-olympikus-mood-branco
Tênis Cavalera Color Line Branco e Preto;219.9;15;https://www.futfanatics.com.br/tenis-cavalera-color-line-branco-e-preto
Tênis Cavalera Eagle Circle Branco e Verde;219.9;15;https://www.futfanatics.com.br/tenis-cavalera-eagle-circle-branco-e-verde
Tênis Oakley Bravos Marrom Claro;549.9;15;https://www.futfanatics.com.br/tenis-oakley-bravos-marrom-claro
Tênis Coca Cola Kick Summer Caqui;169.9;15;https://www.futfanatics.com.br/tenis-coca-cola-kick-summer-caqui
Tênis Cavalera Eagle Circle Preto e Prata;219.9;15;https://www.futfanatics.com.br/tenis-cavalera-eagle-circle-preto-e-prata
Tênis Oakley Split Preto e Marrom;279.9;15;https://www.futfanatics.com.br/tenis-oakley-split-preto-e-marrom
Tenis Fila Heating Preto e Azul;319.9;15;https://www.futfanatics.com.br/tenis-fila-heating-preto-e-azul
Tênis New Balance Ryval Azul e Preto;279.9;15;https://www.futfanatics.com.br/tenis-new-balance-ryval-azul-e-preto
Tênis Fila Heating Branco e Marinho;319.9;15;https://www.futfanatics.com.br/tenis-fila-heating-branco-e-marinho
Tênis Olympikus Cyan Preto;169.9;15;https://www.futfanatics.com.br/tenis-olympikus-cyan-preto
Tênis Cavalera Running Stripes Preto e Vermelho;219.9;15;https://www.futfanatics.com.br/tenis-cavalera-running-stripes-preto-e-vermelho
Tênis Fila Magnus Verde e Preto;279.9;15;https://www.futfanatics.com.br/tenis-fila-magnus-verde-e-preto
Tênis Olympikus Lap Preto;169.9;15;https://www.futfanatics.com.br/tenis-olympikus-lap-preto
Tênis Mizuno Wave Invictus 3 Preto;849.9;15;https://www.futfanatics.com.br/tenis-mizuno-wave-invictus-3-preto
Tênis Everlast Monster II EVA Preto;319.9;15;https://www.futfanatics.com.br/tenis-everlast-monster-ii-eva-preto
Tênis Fila Calzini Preto e Branco;279.9;15;https://www.futfanatics.com.br/tenis-fila-calzini-preto-e-branco
Tênis Mizuno Wave Invictus 3 Vermelho;849.9;15;https://www.futfanatics.com.br/tenis-mizuno-wave-invictus-3-vermelho
Tênis Olympikus Urano Preto e Cinza;169.9;15;https://www.futfanatics.com.br/tenis-olympikus-urano-preto-e-cinza
Tênis Olympikus Cyan Marinho;169.9;15;https://www.futfanatics.com.br/tenis-olympikus-cyan-marinho
Tênis Coca Cola Kick Summer Azul e Vermelho;169.9;15;https://www.futfanatics.com.br/tenis-coca-cola-kick-summer-azul-e-vermelho
Tênis Olympikus Urano Marinho;169.9;15;https://www.futfanatics.com.br/tenis-olympikus-urano-marinho
Tênis Fila Magnus Marinho;279.9;15;https://www.futfanatics.com.br/tenis-fila-magnus-marinho
Tênis Cavalera Color Line Preto e Vermelho;379.9;15;https://www.futfanatics.com.br/tenis-cavalera-color-line-preto-e-vermelho
Tênis Fila Arched Preto e Vermelho;279.89;15;https://www.futfanatics.com.br/tenis-fila-arched-preto-e-vermelho
Tênis Cavalera Running Stripes Branco e Azul;219.9;15;https://www.futfanatics.com.br/tenis-cavalera-running-stripes-branco-e-azul
Tênis Puma ST Runner V2 SN Preto e Branco;379.9;15;https://www.futfanatics.com.br/tenis-puma-st-runner-v2-sn-preto-e-branco
Tênis Reserva RSVGO Astral Marrom;479.9;15;https://www.futfanatics.com.br/tenis-reserva-rsvgo-astral-marrom
Tênis Mizuno Wave Vitality 4 Marinho;339.9;15;https://www.futfanatics.com.br/tenis-mizuno-wave-vitality-4-marinho
Tênis Under Armour Pacer Azul;379.9;15;https://www.futfanatics.com.br/tenis-under-armour-pacer-azul
Tênis Puma Shuffle Mid MDP Branco;339.9;15;https://www.futfanatics.com.br/tenis-puma-shuffle-mid-mdp-branco
Tênis Reserva Astral Preto;479.9;15;https://www.futfanatics.com.br/tenis-reserva-astral-preto
Tênis New Balance 880 V12 Azul Marinho;849.9;15;https://www.futfanatics.com.br/tenis-new-balance-880-v12-azul-marinho
Tênis Under Armour Buzzer Azul;379.9;15;https://www.futfanatics.com.br/tenis-under-armour-buzzer-azul
Tênis Reserva Lapa RE Preto;339.9;15;https://www.futfanatics.com.br/tenis-reserva-lapa-re-preto
Tênis Oakley Way Bege;339.9;15;https://www.futfanatics.com.br/tenis-oakley-way-bege
Tênis New Balance 461 Preto e Vermelho;379.9;15;https://www.futfanatics.com.br/tenis-new-balance-461-preto-e-vermelho
Tênis Adidas Response Runner Cinza;339.9;15;https://www.futfanatics.com.br/tenis-adidas-response-runner-cinza
Tênis New Balance 461 Azul e Amarelo;379.9;15;https://www.futfanatics.com.br/tenis-new-balance-461-azul-e-amarelo
Tênis Cavalera Color Line Branco e Cinza;379.9;15;https://www.futfanatics.com.br/tenis-cavalera-color-line-branco-e-cinza
Tênis Cavalera Running Stripes Branco;219.9;15;https://www.futfanatics.com.br/tenis-cavalera-running-stripes-branco
Tênis Fila Street Fit Preto e Vermelho;299.9;14;https://www.futfanatics.com.br/tenis-fila-street-fit-preto-e-vermelho
Tênis Fila Territory Branco e Preto;299.9;14;https://www.futfanatics.com.br/tenis-fila-territory-branco-e-preto
Tênis Reserva Flip Azul;299.9;14;https://www.futfanatics.com.br/tenis-reserva-flip-azul
Tênis Reserva Joy Lace Bordô;299.9;14;https://www.futfanatics.com.br/tenis-reserva-joy-lace-bordo
Tênis Adidas Vulcraider Verde;299.9;14;https://www.futfanatics.com.br/tenis-adidas-vulcraider-verde
Tênis Under Armour Charged Prompt SE Preto;299.9;14;https://www.futfanatics.com.br/tenis-under-armour-charged-prompt-se-preto
Tênis Everlast Climber III Cinza e Preto;299.9;14;https://www.futfanatics.com.br/tenis-everlast-climber-iii-cinza-e-preto
Tênis Olympikus Elo Preto e Marinho;299.9;14;https://www.futfanatics.com.br/tenis-olympikus-elo-preto-e-marinho
Tênis Olympikus Reverso Branco;299.9;14;https://www.futfanatics.com.br/tenis-olympikus-reverso-branco
Tênis Asics Versablast 2 Preto e Laranja;299.9;14;https://www.futfanatics.com.br/tenis-asics-versablast-2-preto-e-laranja
Tênis Reserva Joy RE Preto;299.9;14;https://www.futfanatics.com.br/tenis-reserva-joy-re-preto
Tênis Under Armour Charged Prompt SE Cinza;299.9;14;https://www.futfanatics.com.br/tenis-under-armour-charged-prompt-se-cinza
Tênis Reserva Joy Cinza;289.9;14;https://www.futfanatics.com.br/tenis-reserva-joy-cinza
Tênis Asics Raiden 3 Preto;299.9;14;https://www.futfanatics.com.br/tenis-asics-raiden-3-preto
Tênis Reserva Joy Verde;289.9;14;https://www.futfanatics.com.br/tenis-reserva-joy-verde
Tênis Everlast Climber III Preto e Cinza;299.9;14;https://www.futfanatics.com.br/tenis-everlast-climber-iii-preto-e-cinza
Tênis Oakley Socket II Preto;299.9;14;https://www.futfanatics.com.br/tenis-oakley-socket-ii-preto
Tênis Reserva Slip On Joy Branco;289.9;14;https://www.futfanatics.com.br/tenis-reserva-slip-on-joy-branco
Tênis Reserva Joy RE Marrom;299.9;14;https://www.futfanatics.com.br/tenis-reserva-joy-re-marrom
Tênis New Balance Hierro V6 Verde;899.9;14;https://www.futfanatics.com.br/tenis-new-balance-hierro-v6-verde
Tênis Under Armour HOVR Rise 3 Verde;599.9;14;https://www.futfanatics.com.br/tenis-under-armour-hovr-rise-3-verde
Tênis Oakley Confront Low Amarelo;599.9;14;https://www.futfanatics.com.br/tenis-oakley-confront-low-amarelo
Tênis Under Armour HOVR Rise 3 Branco e Azul;599.9;14;https://www.futfanatics.com.br/tenis-under-armour-hovr-rise-3-branco-e-azul
Tênis Coca Cola Daytona Branco;229.9;14;https://www.futfanatics.com.br/tenis-coca-cola-daytona-branco
Tênis Coca Cola Daytona All Black;229.9;14;https://www.futfanatics.com.br/tenis-coca-cola-daytona-all-black
Tênis Under Armour Tribase Cross Verde;429.9;14;https://www.futfanatics.com.br/tenis-under-armour-tribase-cross-verde
Tênis Adidas Tracefinder Trail Running Preto;429.9;14;https://www.futfanatics.com.br/tenis-adidas-tracefinder-trail-running-preto
Tênis Cavalera Smith Branco e Preto;229.9;14;https://www.futfanatics.com.br/tenis-cavalera-smith-branco-e-preto
Tênis Cavalera Vector Super Light Marinho;469.9;14;https://www.futfanatics.com.br/tenis-cavalera-vector-super-light-marinho
Tênis Oakley Domynion Cinza;469.9;14;https://www.futfanatics.com.br/tenis-oakley-domynion-cinza
Tênis Fila KR5 Vermelho;429.9;14;https://www.futfanatics.com.br/tenis-fila-kr5-vermelho
Tênis New Balance Evoz V2 Laranja;599.9;14;https://www.futfanatics.com.br/tenis-new-balance-evoz-v2-laranja
Tênis Oakley Huricane Marrom;479.9;14;https://www.futfanatics.com.br/tenis-oakley-huricane-marrom
Tênis Coca Cola Atlanta Knit Man Caramelo;239.9;14;https://www.futfanatics.com.br/tenis-coca-cola-atlanta-knit-man-caramelo
Tênis Reserva Type R Classic Branco e Bordô;599.9;14;https://www.futfanatics.com.br/tenis-reserva-type-r-classic-branco-e-bordo
Tênis Cavalera Street Stripes Branco;229.9;14;https://www.futfanatics.com.br/tenis-cavalera-street-stripes-branco
Tênis Cavalera Approval II Branco;229.9;14;https://www.futfanatics.com.br/tenis-cavalera-approval-ii-branco
Tênis Reserva Type R Preto;599.9;14;https://www.futfanatics.com.br/tenis-reserva-type-r-preto
Tênis Cavalera Eagle Slip Preto;229.9;14;https://www.futfanatics.com.br/tenis-cavalera-eagle-slip-preto
Tênis Cavalera Street Stripes Branco e Verde;229.9;14;https://www.futfanatics.com.br/tenis-cavalera-street-stripes-branco-e-verde
Tênis Coca Cola Daytona Classic Branco;199.9;13;https://www.futfanatics.com.br/tenis-coca-cola-daytona-classic-branco
Tênis Mizuno Wave Falcon 4 Preto;329.9;13;https://www.futfanatics.com.br/tenis-mizuno-wave-falcon-4-preto
Tênis Coca Cola Daytona Classic Canvas Marinho;199.9;13;https://www.futfanatics.com.br/tenis-coca-cola-daytona-classic-canvas-marinho
Tênis Coca Cola Daytona Classic Canvas Caramelo;199.9;13;https://www.futfanatics.com.br/tenis-coca-cola-daytona-classic-canvas-caramelo
Chinelo Oakley Break Preto e Vermelho;259.9;13;https://www.futfanatics.com.br/chinelo-oakley-break-preto-e-vermelho
Tênis Under Armour Charged First Marinho;259.9;13;https://www.futfanatics.com.br/tenis-under-armour-charged-first-marinho
Tênis Fila Recovery Marinho;329.9;13;https://www.futfanatics.com.br/tenis-fila-recovery-marinho
Tênis Fila Recovery Branco e Preto;329.9;13;https://www.futfanatics.com.br/tenis-fila-recovery-branco-e-preto
Tênis Olympikus Ultraleve 235G Vermelho;199.9;13;https://www.futfanatics.com.br/tenis-olympikus-ultraleve-235g-vermelho
Tênis Puma Anzarun Lite Slip On Preto;329.9;13;https://www.futfanatics.com.br/tenis-puma-anzarun-lite-slip-on-preto
Tênis Everlast Monster II EVA Cinza;329.9;13;https://www.futfanatics.com.br/tenis-everlast-monster-ii-eva-cinza
Tênis Fila Recovery Preto e Cinza;329.9;13;https://www.futfanatics.com.br/tenis-fila-recovery-preto-e-cinza
Tênis Fila Attech Branco e Marinho;329.9;13;https://www.futfanatics.com.br/tenis-fila-attech-branco-e-marinho
Tênis Coca Cola Daytona Classic All Black;199.9;13;https://www.futfanatics.com.br/tenis-coca-cola-daytona-classic-all-black
Tênis Reserva Lapa Caramelo;319.9;13;https://www.futfanatics.com.br/tenis-reserva-lapa-caramelo
Chinelo Fila Drifter Basic Branco;129.9;13;https://www.futfanatics.com.br/chinelo-fila-drifter-basic-branco
Chinelo Kenner Kivah Line U3 Preto;129.9;13;https://www.futfanatics.com.br/chinelo-kenner-kivah-line-u3-preto
Chinelo Kenner Kivah Preto;129.9;13;https://www.futfanatics.com.br/chinelo-kenner-kivah-preto
Tênis Under Armour HOVR Phantom 3S Preto;949.9;13;https://www.futfanatics.com.br/tenis-under-armour-hovr-phantom-3s-preto
Tênis Under Armour HOVR Phantom 3S Laranja;949.9;13;https://www.futfanatics.com.br/tenis-under-armour-hovr-phantom-3s-laranja
Tênis New Balance More V3 Marinho e Laranja;949.9;13;https://www.futfanatics.com.br/tenis-new-balance-more-v3-marinho-e-laranja
Tênis Reserva Clean;319.9;13;https://www.futfanatics.com.br/tenis-reserva-clean
Chinelo Kenner Kivah Line Preto e Laranja;129.9;13;https://www.futfanatics.com.br/chinelo-kenner-kivah-line-preto-e-laranja
Chinelo Fila Drifter Basic Preto e Branco;129.9;13;https://www.futfanatics.com.br/chinelo-fila-drifter-basic-preto-e-branco
Tênis Reserva Lapa Branco;319.9;13;https://www.futfanatics.com.br/tenis-reserva-lapa-branco
Tênis Cavalera Blockcolor Low Preto;399.9;13;https://www.futfanatics.com.br/tenis-cavalera-blockcolor-low-preto
Tênis Coca Cola Daytona Classic Preto e Branco;199.9;13;https://www.futfanatics.com.br/tenis-coca-cola-daytona-classic-preto-e-branco
Tênis Fila Recovery Cinza e Marinho;329.9;13;https://www.futfanatics.com.br/tenis-fila-recovery-cinza-e-marinho
Tênis Olympikus Ultraleve 232G Feminino Algodão;199.9;13;https://www.futfanatics.com.br/tenis-olympikus-ultraleve-232g-feminino-algodao
Tênis Qix Bird II Branco;199.9;13;https://www.futfanatics.com.br/tenis-qix-bird-ii-branco
Chinelo Oakley Break Marinho;199.9;13;https://www.futfanatics.com.br/chinelo-oakley-break-marinho
Tênis New Balance Roav V2 I Azul;559.9;13;https://www.futfanatics.com.br/tenis-new-balance-roav-v2-i-azul
Tênis Puma X-Ray Game BDP Branco;369.9;13;https://www.futfanatics.com.br/tenis-puma-x-ray-game-bdp-branco
Tênis New Balance Propel V3 Preto;649.9;13;https://www.futfanatics.com.br/tenis-new-balance-propel-v3-preto
Tênis Olympikus Wellness 2 Marinho;199.9;13;https://www.futfanatics.com.br/tenis-olympikus-wellness-2-marinho
Tênis New Balance Evoz 2 Preto;649.9;13;https://www.futfanatics.com.br/tenis-new-balance-evoz-2-preto
Tênis Adidas Fluidflow 2.0 Marinho;519.9;13;https://www.futfanatics.com.br/tenis-adidas-fluidflow-2-0-marinho
Tênis Fila Move On Marinho;219.9;12;https://www.futfanatics.com.br/tenis-fila-move-on-marinho
Tênis Cavalera Knit Type Preto;219.9;12;https://www.futfanatics.com.br/tenis-cavalera-knit-type-preto
Tênis Adidas Response Runner Azul e Preto;349.9;12;https://www.futfanatics.com.br/tenis-adidas-response-runner-azul-e-preto
Tênis Cavalera Knit Eagle Cinza;219.9;12;https://www.futfanatics.com.br/tenis-cavalera-knit-eagle-cinza
Tênis Reserva Lapa I Marrom;349.9;12;https://www.futfanatics.com.br/tenis-reserva-lapa-i-marrom
Tênis Adidas Galaxy 6 Preto e Lima;349.9;12;https://www.futfanatics.com.br/tenis-adidas-galaxy-6-preto-e-lima
Tênis Reserva Lapa II Preto;349.9;12;https://www.futfanatics.com.br/tenis-reserva-lapa-ii-preto
Tênis Reserva Lapa RE Verde;349.9;12;https://www.futfanatics.com.br/tenis-reserva-lapa-re-verde
Tênis Reserva Sunset Marrom;349.9;12;https://www.futfanatics.com.br/tenis-reserva-sunset-marrom
Chinelo Oakley Killer Point Preto e Branco;219.9;12;https://www.futfanatics.com.br/chinelo-oakley-killer-point-preto-e-branco
Tênis Coca Cola March All White;349.9;12;https://www.futfanatics.com.br/tenis-coca-cola-march-all-white
Tênis Adidas Response Runner Preto;349.9;12;https://www.futfanatics.com.br/tenis-adidas-response-runner-preto
Chinelo Oakley Zeal Preto;139.9;12;https://www.futfanatics.com.br/chinelo-oakley-zeal-preto
Chinelo Kenner Kivah Cush Preto e Cinza;139.9;12;https://www.futfanatics.com.br/chinelo-kenner-kivah-cush-preto-e-grafite
Tênis Everlast Cave 2 Branco e Preto;349.9;12;https://www.futfanatics.com.br/tenis-everlast-cave-2-branco-e-preto
Tênis Reserva Type R Suede Marinho;549.9;12;https://www.futfanatics.com.br/tenis-reserva-type-r-suede-marinho
Tênis Fila Progress Preto e Cinza;349.9;12;https://www.futfanatics.com.br/tenis-fila-progress-preto-e-cinza
Tênis Fila Arched Marinho e Coral;289.9;12;https://www.futfanatics.com.br/tenis-fila-arched-marinho-e-coral
Tênis Under Armour Charged Slight SE Marinho;289.9;12;https://www.futfanatics.com.br/tenis-under-armour-charged-slight-se-marinho
Tênis Reserva Sal Caramelo;289.9;12;https://www.futfanatics.com.br/tenis-reserva-sal-caramelo
Tênis Puma Electron 2.0 Preto;349.9;12;https://www.futfanatics.com.br/tenis-puma-electron-2-0-preto
Tênis New Balance 1080 V12 Laranja;1099.9;12;https://www.futfanatics.com.br/tenis-new-balance-1080-v12-laranja
Tênis Puma Smash V2 Preto e Branco;349.9;12;https://www.futfanatics.com.br/tenis-puma-smash-v2-preto-e-branco
Tênis Puma Smash V2 BDP Verde;349.9;12;https://www.futfanatics.com.br/tenis-puma-smash-v2-bdp-verde
Tênis Under Armour HOVR Synergy Vermelho;699.9;12;https://www.futfanatics.com.br/tenis-under-armour-hovr-synergy-vermelho
Chinelo Kenner Kivah Cushy Preto e Azul Royal;139.9;12;https://www.futfanatics.com.br/chinelo-kenner-kivah-cushy-preto-e-azul-royal
Tênis Cavalera Knit Run Chumbo;219.9;12;https://www.futfanatics.com.br/tenis-cavalera-knit-run-chumbo
Tênis Under Armour Charged Skyline 3 Preto;349.9;12;https://www.futfanatics.com.br/tenis-under-armour-charged-skyline-3-preto
Tênis Olympikus Corre Vento Branco e Preto;349.9;12;https://www.futfanatics.com.br/tenis-olympikus-corre-vento-branco-e-preto
Tênis Under Armour Charged Prorun Preto e Cinza;349.9;12;https://www.futfanatics.com.br/tenis-under-armour-charged-prorun-preto-e-cinza
Tênis Everlast Cave 2 Preto;349.9;12;https://www.futfanatics.com.br/tenis-everlast-cave-2-preto
Tênis Asics Gel Sparta Cinza e Vermelho;349.9;12;https://www.futfanatics.com.br/tenis-asics-gel-sparta-cinza-e-vermelho
Tênis Reserva Hero Preto;699.9;12;https://www.futfanatics.com.br/tenis-reserva-hero-preto
Tênis Reserva Astral Marinho;499.9;12;https://www.futfanatics.com.br/tenis-reserva-astral-marinho
Tênis Reserva Dock RE Verde;339.9;12;https://www.futfanatics.com.br/tenis-reserva-dock-re-verde
Tênis Reserva Dock RE Preto;339.9;12;https://www.futfanatics.com.br/tenis-reserva-dock-re-preto
Tênis Reserva Dock RE Bege;339.9;12;https://www.futfanatics.com.br/tenis-reserva-dock-re-bege
Tênis Under Armour HOVR Infinite 4 Laranja;699.9;12;https://www.futfanatics.com.br/tenis-under-armour-hovr-infinite-4-laranja
Chinelo Oakley Zeal Cinza;139.9;12;https://www.futfanatics.com.br/chinelo-oakley-zeal-cinza
Tênis Adidas Questar Preto II;479.9;12;https://www.futfanatics.com.br/tenis-adidas-questar-preto-ii
Tênis Reserva Astral Preto e Caramelo;499.9;12;https://www.futfanatics.com.br/tenis-reserva-astral-preto-e-caramelo
Tênis Reserva Classic Knit Preto;499.9;12;https://www.futfanatics.com.br/tenis-reserva-classic-knit-preto
Tênis Cavalera Knit Eagle Preto;219.9;12;https://www.futfanatics.com.br/tenis-cavalera-knit-eagle-preto
Tênis Reserva Type R Basic Azul;349.9;12;https://www.futfanatics.com.br/tenis-reserva-type-r-basic-azul
Tênis Coca Cola Kick Up Verde Musgo;219.9;12;https://www.futfanatics.com.br/tenis-coca-cola-kick-up-verde-musgo
Tênis Reserva Astral Marrom;499.9;12;https://www.futfanatics.com.br/tenis-reserva-astral-marrom
Tênis New Balance Fuelcell Propel V3 Preto;699.9;12;https://www.futfanatics.com.br/tenis-new-balance-fuelcell-propel-v3-preto
Tênis Olympikus Volt Preto;219.9;12;https://www.futfanatics.com.br/tenis-olympikus-volt-preto
Tênis Asics Gel-Cumulus 24 Azul;699.9;12;https://www.futfanatics.com.br/tenis-asics-gel-cumulus-24-azul
Tênis Fila Intruder Preto e Laranja;219.9;12;https://www.futfanatics.com.br/tenis-fila-intruder-preto-e-laranja
Tênis Under Armour Charged Levity Laranja e Cinza;219.9;12;https://www.futfanatics.com.br/tenis-under-armour-charged-levity-laranja-e-cinza
Chinelo Oakley Zeal Azul e Preto;139.9;12;https://www.futfanatics.com.br/chinelo-oakley-zeal-azul-e-preto
