marca;preco;desconto;link
Tênis Reserva Dock Preto;289.9;25;https://www.futfanatics.com.br/tenis-reserva-dock-preto
Tênis Cavalera Smith Preto e Branco;199.9;25;https://www.futfanatics.com.br/tenis-cavalera-smith-preto-e-branco
Tênis Cavalera Street Stripes Preto e Branco;199.9;25;https://www.futfanatics.com.br/tenis-cavalera-street-stripes-preto-e-branco
Tênis Cavalera Smith Preto e Verde;199.9;25;https://www.futfanatics.com.br/tenis-cavalera-smith-preto-e-verde
Tênis Reserva Simples Lace Verde;299.9;25;https://www.futfanatics.com.br/tenis-reserva-simples-lace-verde
Tênis Olympikus Urano Cinza e Verde;149.9;25;https://www.futfanatics.com.br/tenis-olympikus-urano-cinza-e-verde
Tênis Puma Mercedes AMG Petronas MAPF1 Neo Cat Branco e Verde;409.9;25;https://www.futfanatics.com.br/tenis-puma-mercedes-amg-petronas-mapf1-neo-cat-branco-e-verde
Tênis Olympikus Corre 1 Laranja;299.9;25;https://www.futfanatics.com.br/tenis-olympikus-corre-1-laranja
Tênis Puma Aviator Light Pro BDP Verde;319.9;25;https://www.futfanatics.com.br/tenis-puma-aviator-light-pro-bdp-verde
Tênis Under Armour HOVR Synergy Preto e Laranja;599.9;25;https://www.futfanatics.com.br/tenis-under-armour-hovr-synergy-preto-e-laranja
Tênis Puma Aviator Light Pro BDP Preto e Amarelo;319.9;25;https://www.futfanatics.com.br/tenis-puma-aviator-light-pro-bdp-preto-e-amarelo
Tênis Under Armour HOVR Synergy Preto;599.9;25;https://www.futfanatics.com.br/tenis-under-armour-hovr-synergy-preto
Tênis Fila Axilus Ace Clay Marinho e Vermelho;379.9;24;https://www.futfanatics.com.br/tenis-fila-axilus-ace-clay-marinho-e-vermelho
Tênis Fila Kr5 Coral;379.9;24;https://www.futfanatics.com.br/tenis-fila-kr5-coral
Tênis Puma Wired Rapid BDP Preto e Branco;249.9;24;https://www.futfanatics.com.br/tenis-puma-wired-rapid-bdp-preto-e-branco
Tênis Fila KR5 Lima e Preto;379.9;24;https://www.futfanatics.com.br/tenis-fila-kr5-lima-e-preto
Tênis Fila KR5 Preto e Grafite;379.9;24;https://www.futfanatics.com.br/tenis-fila-kr5-preto-e-grafite
Tênis Oakley Domynion Preto;379.9;24;https://www.futfanatics.com.br/tenis-oakley-domynion-preto
Tênis Olympikus Estilo Cinza;189.9;24;https://www.futfanatics.com.br/tenis-olympikus-estilo-cinza
Tênis Reserva Rubber Preto;279.9;24;https://www.futfanatics.com.br/tenis-reserva-rubber-preto
Tênis Olympikus Fusão Preto e Branco;189.9;24;https://www.futfanatics.com.br/tenis-olympikus-fusao-preto-e-branco
Tênis Under Armour Charged Advance Laranja e Preto;379.9;24;https://www.futfanatics.com.br/tenis-under-armour-charged-advance-laranja-e-preto
Tênis Everlast Dakar Preto;189.9;24;https://www.futfanatics.com.br/tenis-everlast-dakar-preto
Tênis Coca Cola Linea Marinho;189.9;24;https://www.futfanatics.com.br/tenis-coca-cola-linea-marinho
Tênis Fila Arched Prata e Preto;249.9;24;https://www.futfanatics.com.br/tenis-fila-arched-prata-e-preto
Tênis Coca Cola Kick Up Branco e Marrom;189.9;24;https://www.futfanatics.com.br/tenis-coca-cola-kick-up-branco-e-marrom
Tênis Coca Cola Kick Up Azul;189.9;24;https://www.futfanatics.com.br/tenis-coca-cola-kick-up-azul
Tênis Coca Cola Kick Up Orange;189.9;24;https://www.futfanatics.com.br/tenis-coca-cola-kick-up-orange
Tênis Olympikus Cyber 3 Marinho e Laranja;189.9;24;https://www.futfanatics.com.br/tenis-olympikus-cyber-3-marinho-e-laranja
Tênis Fila Shitter Preto e Vermelho;189.9;24;https://www.futfanatics.com.br/tenis-fila-shitter-preto-e-vermelho
Tênis Olympikus Estilo Marinho;189.9;24;https://www.futfanatics.com.br/tenis-olympikus-estilo-marinho
Tênis Puma Comet 2 Alt SR BDP Marinho;249.9;24;https://www.futfanatics.com.br/tenis-puma-comet-2-alt-sr-bdp-marinho
Tenis Fila Axilus Ace Clay Branco e Marinho;379.9;24;https://www.futfanatics.com.br/tenis-fila-axilus-ace-clay-branco-e-marinho
Tênis Reserva Lapa New Marinho;329.9;23;https://www.futfanatics.com.br/tenis-reserva-lapa-new-marinho
Tênis Under Armour Charged Slight Feminino Preto e Rosa;229.9;23;https://www.futfanatics.com.br/tenis-under-armour-charged-slight-feminino-preto-e-rosa
Tênis Under Armour Charged Prompt Preto e Chumbo;229.9;23;https://www.futfanatics.com.br/tenis-under-armour-charged-prompt-preto-e-chumbo
Tênis Cavalera Running Stripes Branco e Verde;199.9;23;https://www.futfanatics.com.br/tenis-cavalera-running-stripes-branco-e-verde
Tênis Cavalera Eagle Circle Branco e Cinza;199.9;23;https://www.futfanatics.com.br/tenis-cavalera-eagle-circle-branco-e-cinza
Tênis Olympikus Ação Verde e Cinza;229.9;23;https://www.futfanatics.com.br/tenis-olympikus-acao-verde-e-cinza
Tênis Reserva Dock II Verde;299.9;23;https://www.futfanatics.com.br/tenis-reserva-dock-ii-verde
Tênis Fila Racer T2 Azul e Verde;499.9;23;https://www.futfanatics.com.br/tenis-fila-racer-t2-azul-e-verde
Tênis Fila Racer T2 Vermelho e Prata;499.9;23;https://www.futfanatics.com.br/tenis-fila-racer-t2-vermelho-e-prata
Tênis Everlast Tempest II Grafite;199.9;23;https://www.futfanatics.com.br/tenis-everlast-tempest-ii-grafite
Tênis Puma Mercedes Team AMG Petronas MAPF1 Electron E Pro Branco;459.9;23;https://www.futfanatics.com.br/tenis-puma-mercedes-team-amg-petronas-mapf1-electron-e-pro-branco
Tênis Puma Anzarun Lite Slip On Preto e Branco;289.9;23;https://www.futfanatics.com.br/tenis-puma-anzarun-lite-slip-on-preto-e-branco
Chinelo Puma Popcat 20 BDP Verde;129.9;23;https://www.futfanatics.com.br/chinelo-puma-popcat-20-bdp-verde
Tênis Reserva Lapa All Black;299.9;23;https://www.futfanatics.com.br/tenis-reserva-lapa-all-black
Tênis Adidas Questar Azul e Branco;419.9;23;https://www.futfanatics.com.br/tenis-adidas-questar-azul-e-branco
Tênis Reserva Copa Branco e Verde;499.9;23;https://www.futfanatics.com.br/tenis-reserva-copa-branco-e-verde
Tênis Olympikus Lusion Preto;229.9;23;https://www.futfanatics.com.br/tenis-olympikus-lusion-preto
Tênis Cavalera Color Line Branco e Verde;199.9;23;https://www.futfanatics.com.br/tenis-cavalera-color-line-branco-e-verde
Tênis Puma Flyer Runner Speckless BDP Preto e Verde;229.9;23;https://www.futfanatics.com.br/tenis-puma-flyer-runner-speckless-bdp-preto-e-verde
Tênis Reserva Nappa Branco e Cinza;499.9;23;https://www.futfanatics.com.br/tenis-reserva-nappa-branco-e-cinza
Tênis Cavalera Eagle Circle Branco e Preto;199.9;23;https://www.futfanatics.com.br/tenis-cavalera-eagle-circle-branco-e-preto
Tênis Olympikus Perfect 3 Preto e Branco;199.9;23;https://www.futfanatics.com.br/tenis-olympikus-perfect-3-preto-e-branco
Tênis Olympikus Perfect 3 Preto e Laranja;199.9;23;https://www.futfanatics.com.br/tenis-olympikus-perfect-3-preto-e-laranja
Tênis Cavalera Running Stripes Branco e Preto;199.9;23;https://www.futfanatics.com.br/tenis-cavalera-running-stripes-branco-e-preto
Tênis Puma X-Cell Uprise Preto e Vermelho;539.9;22;https://www.futfanatics.com.br/tenis-puma-x-cell-uprise-preto-e-vermelho
Tênis Puma Viz Runner BDP Preto;349.9;22;https://www.futfanatics.com.br/tenis-puma-viz-runner-bdp-preto
Tênis Fila KR5 Marinho e Laranja;389.9;22;https://www.futfanatics.com.br/tenis-fila-kr5-marinho-e-laranja
Tênis Under Armour HOVR Revenant Cinza;699.9;22;https://www.futfanatics.com.br/tenis-under-armour-hovr-revenant-cinza
Tênis Puma Smash V2 BDP Vermelho;269.9;22;https://www.futfanatics.com.br/tenis-puma-smash-v2-bdp-vermelho
Tênis Fila Racer Carbon Preto e Branco;699.9;22;https://www.futfanatics.com.br/tenis-fila-racer-carbon-preto-e-branco
Tênis Fila Racer Carbon Marinho e Limão;699.9;22;https://www.futfanatics.com.br/tenis-fila-racer-carbon-marinho-e-limao
Tênis Fila Racer Carbon Coral e Branco;699.9;22;https://www.futfanatics.com.br/tenis-fila-racer-carbon-coral-e-branco
Tênis Puma Shuffle Mid BDP Preto;349.9;22;https://www.futfanatics.com.br/tenis-puma-shuffle-mid-bdp-preto
Tênis Adidas Response Super 3.0 Preto e Branco;539.9;22;https://www.futfanatics.com.br/tenis-adidas-response-super-3-0-preto-e-branco
Tênis Reserva Astral All Black;439.9;22;https://www.futfanatics.com.br/tenis-reserva-astral-all-black
Tênis Qix 90'S Preto e Branco;279.9;22;https://www.futfanatics.com.br/tenis-qix-90-s-preto-e-branco
Tênis Puma Aviator ENG Pro BDP Laranja;369.9;22;https://www.futfanatics.com.br/tenis-puma-aviator-eng-pro-bdp-laranja
Tênis Coca Cola Iate Summer Vip Marinho;169.9;22;https://www.futfanatics.com.br/tenis-coca-cola-iate-summer-vip-marinho
Tênis Under Armour Charged Prompt SE I Preto e Dourado;269.9;22;https://www.futfanatics.com.br/tenis-under-armour-charged-prompt-se-i-preto-e-dourado
Tênis Fila Split Preto e Laranja;269.9;22;https://www.futfanatics.com.br/tenis-fila-split-preto-e-laranja
Tênis Oakley Fusion Cinza Claro;349.9;22;https://www.futfanatics.com.br/tenis-oakley-fusion-cinza-claro
Tênis Reserva Hype Preto e Off White;329.9;21;https://www.futfanatics.com.br/tenis-reserva-hype-preto-e-branco
Tênis Fila Action Branco e Marinho;219.9;21;https://www.futfanatics.com.br/tenis-fila-action-branco-e-marinho
Tênis Fila Racer Marinho e Vermelho;219.9;21;https://www.futfanatics.com.br/tenis-fila-racer-marinho-e-vermelho
Tênis Fila Stay Cinza e Preto;219.9;21;https://www.futfanatics.com.br/tenis-fila-stay-cinza-e-preto
Tênis Fila Activity Preto e Cinza;219.9;21;https://www.futfanatics.com.br/tenis-fila-activity-preto-e-cinza
Tênis Fila Activity Cinza e Azul;219.9;21;https://www.futfanatics.com.br/tenis-fila-activity-cinza-e-azul
Tênis Puma Porsche Legacy Neo Cat Branco e Preto;429.9;21;https://www.futfanatics.com.br/tenis-puma-porsche-legacy-neo-cat-branco-e-preto
Tênis Adidas Dame Extply 2 M Branco e Cinza;549.9;21;https://www.futfanatics.com.br/tenis-adidas-dame-extply-2-m-branco-e-cinza
Tênis Olympikus 235G Preto;179.9;21;https://www.futfanatics.com.br/tenis-olympikus-235g-preto
Tênis Under Armour HOVR Way Vermelho;549.9;21;https://www.futfanatics.com.br/tenis-under-armour-hovr-way-vermelho
Tênis Adidas Runfalcon 2.0 Cinza e Amarelo;299.9;21;https://www.futfanatics.com.br/tenis-adidas-runfalcon-2-0-cinza-e-amarelo
Tênis Olympikus Garra Aul e Cinza;149.9;21;https://www.futfanatics.com.br/tenis-olympikus-garra-aul-e-cinza
Tênis Under Armour HOVR Rise 3 Azul e Preto;549.9;21;https://www.futfanatics.com.br/tenis-under-armour-hovr-rise-3-azul-e-preto
Tênis Olympikus Wellness 2 Preto;179.9;21;https://www.futfanatics.com.br/tenis-olympikus-wellness-2-preto
Tenis Fila Force Preto e Grafite;179.9;21;https://www.futfanatics.com.br/tenis-fila-force-preto-e-grafite
Tênis Reserva Hype Verde;329.9;21;https://www.futfanatics.com.br/tenis-reserva-hype-verde
Tênis Reserva Type R Branco e Cinza;549.9;21;https://www.futfanatics.com.br/tenis-reserva-type-r-branco-e-cinza
Tênis Fila Attech Marinho e Branco;299.9;21;https://www.futfanatics.com.br/tenis-fila-attech-marinho-e-branco
Tênis Puma Anzarun Lite Bold Preto e Branco;299.9;21;https://www.futfanatics.com.br/tenis-puma-anzarun-lite-bold-preto-e-branco
Tênis Puma Mercedes AMG Petronas MAPF1 Drift Cat Decima Preto e Verde;509.9;21;https://www.futfanatics.com.br/tenis-puma-mercedes-amg-petronas-mapf1-drift-cat-decima-preto-e-verde
Tênis Puma Anzarun Lite Slip On Marinho;299.9;21;https://www.futfanatics.com.br/tenis-puma-anzarun-lite-slip-on-marinho
Tênis Olympikus Solar Feminino Marinho;149.9;21;https://www.futfanatics.com.br/tenis-olympikus-solar-feminino-marinho
Tênis Olympikus Lume Marinho;149.9;21;https://www.futfanatics.com.br/tenis-olympikus-lume-marinho
Tênis Reserva Hype Cinza;329.9;21;https://www.futfanatics.com.br/tenis-reserva-hype-cinza
Tênis Adidas Supernova Boost All Black;549.9;21;https://www.futfanatics.com.br/tenis-adidas-supernova-boost-all-black
Tênis Fila Calzini Marinho e Branco;259.9;21;https://www.futfanatics.com.br/tenis-fila-calzini-marinho-e-branco
Tênis Puma Wired Run BDP Preto;259.9;21;https://www.futfanatics.com.br/tenis-puma-wired-run-bdp-preto
Tênis Coca Cola Kick Summer Verde Oliva;159.9;20;https://www.futfanatics.com.br/tenis-coca-cola-kick-summer-verde-oliva
Tênis Everlast Climber III Preto e Branco;279.9;20;https://www.futfanatics.com.br/tenis-everlast-climber-iii-preto-e-branco
Chinelo Oakley Rest II Preto e Branco;159.9;20;https://www.futfanatics.com.br/chinelo-oakley-rest-ii-preto-e-branco
Tênis Under Armour Charged Slight Grafite;239.9;20;https://www.futfanatics.com.br/tenis-under-armour-charged-slight-grafite
Chinelo Oakley Rest III Preto e Azul;159.9;20;https://www.futfanatics.com.br/chinelo-oakley-rest-iii-preto-e-azul
Chinelo Oakley Rest III Preto e Vermelho;159.9;20;https://www.futfanatics.com.br/chinelo-oakley-rest-iii-preto-e-vermelho
Chinelo Oakley Rest III Cinza e Amarelo;159.9;20;https://www.futfanatics.com.br/chinelo-oakley-rest-iii-cinza-e-amarelo
Tênis Olympikus Reverb Azul;199.9;20;https://www.futfanatics.com.br/tenis-olympikus-reverb-azul
Tênis Everlast Climber III Branco e Dourado;279.9;20;https://www.futfanatics.com.br/tenis-everlast-climber-iii-branco-e-dourado
Chinelo Oakley Rest III Preto;159.9;20;https://www.futfanatics.com.br/chinelo-oakley-rest-iii-preto
Tênis Adidas Ultimashow Marinho;279.9;20;https://www.futfanatics.com.br/tenis-adidas-ultimashow-marinho
Tênis Olympikus Ultraleve 215G Branco;199.9;20;https://www.futfanatics.com.br/tenis-olympikus-ultraleve-215g-branco
Tênis Everlast Legacy Verde e Preto;199.9;20;https://www.futfanatics.com.br/tenis-everlast-legacy-verde-e-preto
Tênis Reserva Joy Lace Marrom;279.9;20;https://www.futfanatics.com.br/tenis-reserva-joy-lace-marrom
Tênis Olympikus Reverb Preto e Vermelho;199.9;20;https://www.futfanatics.com.br/tenis-olympikus-reverb-preto-e-vermelho
Tênis Reserva Neopreme Marrom;439.9;20;https://www.futfanatics.com.br/tenis-reserva-neopreme-marrom
Tênis Olympikus Estilo Preto e Branco;199.9;20;https://www.futfanatics.com.br/tenis-olympikus-estilo-preto-e-branco
Tênis Reserva Joy Lace Marinho;279.9;20;https://www.futfanatics.com.br/tenis-reserva-joy-lace-marinho
Tênis Coca Cola Kick Summer Preto e Bege;159.9;20;https://www.futfanatics.com.br/tenis-coca-cola-kick-summer-preto-e-bege
Tênis Puma Electron 2.0 Preto e Vermelho;319.9;20;https://www.futfanatics.com.br/tenis-puma-electron-2-0-preto-e-vermelho
Tênis Reserva Joy Marrom;269.9;20;https://www.futfanatics.com.br/tenis-reserva-joy-marrom
Tênis Olympikus Challenger 3 Blue;199.9;20;https://www.futfanatics.com.br/tenis-olympikus-challenger-3-blue
Tênis Asics Versablast 2 SE Preto;239.9;20;https://www.futfanatics.com.br/tenis-asics-versablast-2-se-preto
Tênis Olympikus Ultraleve 237G Preto e Branco;199.9;20;https://www.futfanatics.com.br/tenis-olympikus-ultraleve-237g-preto-e-branco
Tênis Oakley Modoc Low Preto;559.9;20;https://www.futfanatics.com.br/tenis-oakley-modoc-low-preto
Tênis Cavalera Knit Run Branco;199.9;20;https://www.futfanatics.com.br/tenis-cavalera-knit-run-branco
Tênis Olympikus Elo Branco;279.9;20;https://www.futfanatics.com.br/tenis-olympikus-elo-branco
Tênis Cavalera Knit Eagle Marinho;199.9;20;https://www.futfanatics.com.br/tenis-cavalera-knit-eagle-marinho
Chinelo Kenner Kivah Preto e Azul;119.9;20;https://www.futfanatics.com.br/chinelo-kenner-kivah-preto-e-azul
Tênis Fila Tracer Cinza e Preto;319.9;20;https://www.futfanatics.com.br/tenis-fila-tracer-cinza-e-preto
Tênis Fila Euroflag Bege;239.9;20;https://www.futfanatics.com.br/tenis-fila-euroflag-bege
Chinelo Kenner Kivah Line Preto;119.9;20;https://www.futfanatics.com.br/chinelo-kenner-kivah-line-cinza
Tênis Fila Start Marinho e Bege;239.9;20;https://www.futfanatics.com.br/tenis-fila-start-marinho-e-bege
Tênis Fila Start Branco e Marinho;239.9;20;https://www.futfanatics.com.br/tenis-fila-start-branco-e-marinho
Chinelo Kenner Kivah Over Azul e Preto;119.9;20;https://www.futfanatics.com.br/chinelo-kenner-kivah-over-azul-e-preto
Tênis Fila Racer Marker Coral e Azul;319.9;20;https://www.futfanatics.com.br/tenis-fila-racer-marker-coral-e-azul
Tênis Reserva Joy Preto;269.9;20;https://www.futfanatics.com.br/tenis-reserva-joy-preto
Tênis Puma Shuffle Mid BDP Branco e Verde;359.9;20;https://www.futfanatics.com.br/tenis-puma-shuffle-mid-bdp-branco-e-verde
Tênis Puma Smash V2 Preto;319.9;20;https://www.futfanatics.com.br/tenis-puma-smash-v2-preto
Tênis Mizuno Cool Ride Azul Petróleo;279.9;20;https://www.futfanatics.com.br/tenis-mizuno-cool-ride-azul-petroleo
Tênis Fila Split Marinho e Cinza;279.9;20;https://www.futfanatics.com.br/tenis-fila-split-marinho-e-cinza
Tênis Reserva Neo Preto e Branco;439.9;20;https://www.futfanatics.com.br/tenis-reserva-neo-preto-e-branco
Tênis Olympikus Challenger 3 Laranja;199.9;20;https://www.futfanatics.com.br/tenis-olympikus-challenger-3-laranja
Tênis Coca Cola Kick Summer Off White e Caramelo;159.9;20;https://www.futfanatics.com.br/tenis-coca-cola-kick-summer-off-white-e-caramelo
Tênis Under Armour HOVR Phantom 2 Inkt Preto;639.9;20;https://www.futfanatics.com.br/tenis-under-armour-hovr-phantom-2-inkt-preto
Chinelo Oakley Rest II Preto e Rosa;159.9;20;https://www.futfanatics.com.br/chinelo-oakley-rest-ii-preto-e-rosa
Tênis Adidas Response Preto;399.9;20;https://www.futfanatics.com.br/tenis-adidas-response-preto
Tênis Coca Cola Kick Summer Preto e Marrom;159.9;20;https://www.futfanatics.com.br/tenis-coca-cola-kick-summer-preto-e-marrom
Chinelo Oakley Rest II Preto e Amarelo;159.9;20;https://www.futfanatics.com.br/chinelo-oakley-rest-ii-preto-e-amarelo
Tênis Olympikus Reverb Preto;199.9;20;https://www.futfanatics.com.br/tenis-olympikus-reverb-preto
Tênis Coca Cola Kick Summer All White;159.9;20;https://www.futfanatics.com.br/tenis-coca-cola-kick-summer-all-white
Tênis Puma NRGY Comet Preto e Branco;279.9;20;https://www.futfanatics.com.br/tenis-puma-nrgy-comet-preto-e-branco
Tênis Olympikus Mega Marinho;159.9;20;https://www.futfanatics.com.br/tenis-olympikus-mega-marinho
Tênis Coca Cola Kick Summer Preto;159.9;20;https://www.futfanatics.com.br/tenis-coca-cola-kick-summer-preto
Tênis Coca Cola Kick Summer Brown Marrom;159.9;20;https://www.futfanatics.com.br/tenis-coca-cola-kick-summer-brown-marrom
Tênis Fila Euro Jogger Sport All Black;279.9;20;https://www.futfanatics.com.br/tenis-fila-euro-jogger-sport-all-black
Tênis Olympikus Volt Cinza;199.9;20;https://www.futfanatics.com.br/tenis-olympikus-volt-cinza
Tênis Puma Flyer Beta BDP Preto e Vermelho;279.9;20;https://www.futfanatics.com.br/tenis-puma-flyer-beta-bdp-preto-e-vermelho
Tênis Olympikus Urano Branco e Laranja;159.9;20;https://www.futfanatics.com.br/tenis-olympikus-urano-branco-e-laranja
Tênis Coca Cola Kick Summer Branco;159.9;20;https://www.futfanatics.com.br/tenis-coca-cola-kick-summer-branco
Tênis Coca Cola Kick Summer Preto e Verde;159.9;20;https://www.futfanatics.com.br/tenis-coca-cola-kick-summer-preto-e-verde
Tênis Asics Fuzeblast SE Preto;279.9;20;https://www.futfanatics.com.br/tenis-asics-fuzeblast-se-preto
Tênis Puma Scuderia Ferrari Drift Cat Decima Preto e Vermelho;519.9;20;https://www.futfanatics.com.br/tenis-puma-scuderia-ferrari-drift-cat-decima-preto-e-vermelho
Tênis Under Armour Charged Pacer Vermelho;399.9;20;https://www.futfanatics.com.br/tenis-under-armour-charged-pacer-vermelho
Tênis Olympikus Reverb Bege;199.9;20;https://www.futfanatics.com.br/tenis-olympikus-reverb-bege
Tênis New Balance Propel RMX V2 Preto;599.9;20;https://www.futfanatics.com.br/tenis-new-balance-propel-rmx-v2-preto
Tenis Fila Kr5 Branco e Limão;399.9;20;https://www.futfanatics.com.br/tenis-fila-kr5-branco-e-limao
Tênis Olympikus Volt Marinho;199.9;20;https://www.futfanatics.com.br/tenis-olympikus-volt-marinho
Tênis Oakley Flak II Bege;599.9;20;https://www.futfanatics.com.br/tenis-oakley-flak-ii-bege
Tênis Fila Recovery Marinho e Verde;279.9;20;https://www.futfanatics.com.br/tenis-fila-recovery-marinho-e-verde
Tênis Olympikus Challenger 3 Feminino Tropicália;199.9;20;https://www.futfanatics.com.br/tenis-olympikus-challenger-3-feminino-tropicalia
Tênis Oakley Apolo Preto;399.9;20;https://www.futfanatics.com.br/tenis-oakley-apolo-preto
Tênis Reserva Classic Marrom;559.9;20;https://www.futfanatics.com.br/tenis-reserva-classic-marrom
Tênis Olympikus Reação Feminino Marinho;159.9;20;https://www.futfanatics.com.br/tenis-olympikus-reacao-feminino-marinho
Tênis Adidas Nebzed Preto e Branco;319.9;20;https://www.futfanatics.com.br/tenis-adidas-nebzed-preto-e-branco
Tênis Coca Cola Kick Summer Preto e Branco;159.9;20;https://www.futfanatics.com.br/tenis-coca-cola-kick-summer-preto-e-branco
Tênis Puma Wired Run Mercedes AMG Petronas MAPF1 Preto;399.9;20;https://www.futfanatics.com.br/tenis-puma-wired-run-mercedes-amg-petronas-mapf1-preto
Tênis Under Armour Charged Advance Preto;399.9;20;https://www.futfanatics.com.br/tenis-under-armour-charged-advance-preto
Tênis Cavalera Break Tune Up Branco e Preto;379.9;19;https://www.futfanatics.com.br/tenis-cavalera-break-tune-up-branco-e-preto
Tênis Cavalera Break Tune Up Cinza;379.9;19;https://www.futfanatics.com.br/tenis-cavalera-break-tune-up-cinza
Tênis Under Armour Micro G Valsetz Preto;969.9;19;https://www.futfanatics.com.br/tenis-under-armour-micro-g-valsetz-preto
Tênis Fila Street Fit Marrom e Preto;269.9;18;https://www.futfanatics.com.br/tenis-fila-street-fit-marrom-e-preto
Tênis Puma Comet 2 Alt SR BDP Preto e Vermelho;269.9;18;https://www.futfanatics.com.br/tenis-puma-comet-2-alt-sr-bdp-preto-e-vermelho
Tênis Fila Magnus Branco e Marinho;269.9;18;https://www.futfanatics.com.br/tenis-fila-magnus-branco-e-marinho
Tênis Qix Full Preto e Branco;259.9;18;https://www.futfanatics.com.br/tenis-qix-full-preto-e-branco
Tênis Everlast Monster II EVA Branco e Preto;349.9;18;https://www.futfanatics.com.br/tenis-everlast-monster-ii-eva-branco-e-preto
Tênis Everlast Range Cinza;269.9;18;https://www.futfanatics.com.br/tenis-everlast-range-cinza
Tênis Mizuno Furious 2 Chumbo e Preto;269.9;18;https://www.futfanatics.com.br/tenis-mizuno-furious-2-chumbo-e-preto
Tênis Cavalera Eagle Life Preto;219.9;18;https://www.futfanatics.com.br/tenis-cavalera-eagle-life-preto
Tênis Adidas X9000 L2 Preto e Azul;649.9;18;https://www.futfanatics.com.br/tenis-adidas-x9000-l2-preto-e-azul
Tênis Cavalera Approval Preto;219.9;18;https://www.futfanatics.com.br/tenis-cavalera-approval-preto
Tênis Reserva Neopreme All Black;449.9;18;https://www.futfanatics.com.br/tenis-reserva-neopreme-all-black
Tênis Cavalera Eagle Slip On Marrom;219.9;18;https://www.futfanatics.com.br/tenis-cavalera-eagle-slip-on-marrom
Tênis Cavalera Approval Marrom Escuro;219.9;18;https://www.futfanatics.com.br/tenis-cavalera-approval-marrom-escuro
Tênis Fila Trend 2.0 Cinza;219.9;18;https://www.futfanatics.com.br/tenis-fila-trend-2-0-cinza
Tênis Cavalera Eagle Life Branco;219.9;18;https://www.futfanatics.com.br/tenis-cavalera-eagle-life-branco
Tênis Cavalera Street Stripes II Branco e Verde;219.9;18;https://www.futfanatics.com.br/tenis-cavalera-street-stripes-ii-branco-e-verde
Tênis Cavalera Eagle Life Marrom;219.9;18;https://www.futfanatics.com.br/tenis-cavalera-eagle-life-marrom
Tênis Cavalera Smith Branco e Azul;219.9;18;https://www.futfanatics.com.br/tenis-cavalera-smith-branco-e-azul
Tênis Cavalera Street Stripes Branco e Preto;219.9;18;https://www.futfanatics.com.br/tenis-cavalera-street-stripes-branco-e-preto
Tênis Oakley String Preto;449.9;18;https://www.futfanatics.com.br/tenis-oakley-string-preto
Tênis Qix DB2 Preto e Branco;219.9;18;https://www.futfanatics.com.br/tenis-qix-db2-preto-e-branco
Tênis Asics Gel Quantum 360 Direction Preto;649.9;18;https://www.futfanatics.com.br/tenis-asics-gel-quantum-360-direction-preto
Tenis Fila Float Knit Preto e Prata;489.9;18;https://www.futfanatics.com.br/tenis-fila-float-knit-preto-e-prata
Tênis Reserva Neopreme Marinho;449.9;18;https://www.futfanatics.com.br/tenis-reserva-neopreme-marinho
Tênis Oakley Hades Preto e Vermelho;649.9;18;https://www.futfanatics.com.br/tenis-oakley-hades-preto-e-vermelho
Tênis Cavalera Stark Off White e Verde;399.9;18;https://www.futfanatics.com.br/tenis-cavalera-stark-off-white-e-verde
Tênis Reserva Typer R Branco;569.9;18;https://www.futfanatics.com.br/tenis-reserva-typer-r-branco
Chinelo Oakley Zeal Azul;129.9;18;https://www.futfanatics.com.br/chinelo-oakley-zeal-azul
Tênis New Balance Tempo Cinza;539.9;18;https://www.futfanatics.com.br/tenis-new-balance-tempo-cinza
Tênis Everlast Climber III Preto e Amarelo;289.9;17;https://www.futfanatics.com.br/tenis-everlast-climber-iii-preto-e-amarelo
Tênis Oakley Dry Azul;369.9;17;https://www.futfanatics.com.br/tenis-oakley-dry-azul
Tênis Puma X-Cell Uprise Preto;579.9;17;https://www.futfanatics.com.br/tenis-puma-x-cell-uprise-preto
Tênis Puma NRGY Comet II Preto e Cinza;289.9;17;https://www.futfanatics.com.br/tenis-puma-nrgy-comet-preto-e-cinza
Tênis Olympikus Ultraleve 232G Preto;189.9;17;https://www.futfanatics.com.br/tenis-olympikus-ultraleve-232g-preto
Tênis Olympikus 232G Ultraleve Preto;189.9;17;https://www.futfanatics.com.br/tenis-olympikus-232g-ultraleve-preto
Tênis Qix Bird III Marinho;189.9;17;https://www.futfanatics.com.br/tenis-qix-bird-iii-marinho
Tênis Asics Gel Shogun 4 Preto e Verde;369.9;17;https://www.futfanatics.com.br/tenis-asics-gel-shogun-4-preto-e-verde
Tênis Reserva Astral Cinza;469.9;17;https://www.futfanatics.com.br/tenis-reserva-astral-cinza
Tênis Asics Gel Shogun 4 Cinza e Azul;369.9;17;https://www.futfanatics.com.br/tenis-asics-gel-shogun-4-cinza-e-azul
Tênis Reserva Astral Verde Militar;469.9;17;https://www.futfanatics.com.br/tenis-reserva-astral-verde-militar
Tênis Asics Gel Shogun 4 Azul;369.9;17;https://www.futfanatics.com.br/tenis-asics-gel-shogun-4-azul
Tênis Oakley Dust Cinza;699.9;17;https://www.futfanatics.com.br/tenis-oakley-dust-cinza
Tênis Oakley Dust Preto;699.9;17;https://www.futfanatics.com.br/tenis-oakley-dust-preto
Tênis Oakley Dry Grafite;369.9;17;https://www.futfanatics.com.br/tenis-oakley-dry-grafite
Bota Bradok Tucson Sleeky Marrom;369.9;17;https://www.futfanatics.com.br/bota-bradok-tucson-sleeky-marrom
Bota Bradok Tucson Discovery Marrom;369.9;17;https://www.futfanatics.com.br/bota-bradok-tucson-discovery-marrom
