produto,preco,desconto,link,marca
Chuteira Dray Foorcy 328 Society Vermelha,99.9,16,https://www.futfanatics.com.br/chuteira-dray-foorcy-328-society-vermelha,Dray
Chuteira Adidas Predator Accuracy 23.3 Low FG/AG Campo Branca,499.9,16,https://www.futfanatics.com.br/chuteira-adidas-predator-accuracy-23-3-low-fg/ag-campo-branca,Adidas
Chuteira Penalty Fúria XXII Society Azul,149.9,16,https://www.futfanatics.com.br/chuteira-penalty-furia-xxii-society-azul,Penalty
Chuteira Dray Layt Futsal Preta e Verde,99.9,16,https://www.futfanatics.com.br/chuteira-dray-layt-futsal-preta-e-verde,Dray
Chuteira Puma Future Play Neymar NJr FG/AG BDP Campo Branca,419.9,16,https://www.futfanatics.com.br/chuteira-puma-future-play-neymar-njr-fg/ag-bdp-campo-branca,Puma
Chuteira Joma Top Flex Futsal Branca e Azul Marinho,499.9,16,https://www.futfanatics.com.br/chuteira-joma-top-flex-futsal-branca-e-azul-marinho,Joma
Chuteira Adidas X Crazyfast 23.3 IN Futsal Preta,499.9,16,https://www.futfanatics.com.br/chuteira-adidas-x-crazyfast-23-3-in-futsal-preta,Adidas
Chuteira Adidas Deportivo II IN Futsal Preta e Azul,249.9,16,https://www.futfanatics.com.br/chuteira-adidas-deportivo-ii-in-futsal-preta-e-azul,Adidas
Chuteira Dray Spedy Futsal Preta,99.9,16,https://www.futfanatics.com.br/chuteira-dray-spedy-futsal-preta,Dray
Chuteira Adidas Predator Accuracy 23.1 TF Society Preta e Pink,1259.9,16,https://www.futfanatics.com.br/chuteira-adidas-predator-accuracy-23-1-tf-society-preta-e-pink,Adidas
Chuteira Dray Spedy Futsal Preta e Verde,99.9,16,https://www.futfanatics.com.br/chuteira-dray-spedy-futsal-preta-e-verde,Dray
Chuteira Dray Layt Futsal Preta,99.9,16,https://www.futfanatics.com.br/chuteira-dray-layt-futsal-preta,Dray
Chuteira Dray Layt Society Preta,99.9,16,https://www.futfanatics.com.br/chuteira-dray-layt-society-preta,Dray
Chuteira Oxn Agilis 2 Society Preta e Verde,109.9,15,https://www.futfanatics.com.br/chuteira-oxn-agilis-2-society-preta-e-verde,Oxn
Chuteira Dray Foorcy 330 Society Verde Limão,109.9,15,https://www.futfanatics.com.br/chuteira-dray-foorcy-330-society-verde-limao,Dray
Chuteira Joma Liga 5 Futsal Marinho,379.9,15,https://www.futfanatics.com.br/chuteira-joma-liga-5-futsal-marinho,Joma
Chuteira Joma Dribling Society Branca e Azul,339.9,15,https://www.futfanatics.com.br/chuteira-joma-dribling-society-branca-e-azul,Joma
Chuteira Puma Ultra Match IT Futsal Rosa,589.9,15,https://www.futfanatics.com.br/chuteira-puma-ultra-match-it-futsal-rosa,Puma
Chuteira Joma Maxima Society Preta e Laranja,299.9,14,https://www.futfanatics.com.br/chuteira-joma-maxima-society-preta-e-laranja,Joma
Chuteira Joma Mundial Futsal Preta e Amarela,429.9,14,https://www.futfanatics.com.br/chuteira-joma-mundial-futsal-preta-e-amarela,Joma
Chuteira Joma Mundial Futsal Verde Limão,429.9,14,https://www.futfanatics.com.br/chuteira-joma-mundial-futsal-verde-limao,Joma
Chuteira Puma Future Play Neymar NJr TT BDP Society Branca,429.9,14,https://www.futfanatics.com.br/chuteira-puma-future-play-neymar-njr-tt-bdp-society-branca,Puma
Chuteira Joma Maxima Futsal Laranja e Preta,299.9,14,https://www.futfanatics.com.br/chuteira-joma-maxima-futsal-laranja-e-preta,Joma
Chuteira Oxn Vision Futsal Preta,119.9,14,https://www.futfanatics.com.br/chuteira-oxn-vision-futsal-preta,Oxn
Chuteira Joma Maxima Futsal Preta e Laranja,299.9,14,https://www.futfanatics.com.br/chuteira-joma-maxima-futsal-preta-e-laranja,Joma
Chuteira Joma Dribling Society Preta e Verde Limão,299.9,14,https://www.futfanatics.com.br/chuteira-joma-dribling-society-preta-e-verde-limao,Joma
Chuteira Joma Maxima Society Laranja,299.9,14,https://www.futfanatics.com.br/chuteira-joma-maxima-society-laranja,Joma
Chuteira Joma Maxima Society Azul Marinho,299.9,14,https://www.futfanatics.com.br/chuteira-joma-maxima-society-azul-marinho,Joma
Chuteira Joma Maxima Society Branca e Cinza,299.9,14,https://www.futfanatics.com.br/chuteira-joma-maxima-society-branca-e-cinza,Joma
Chuteira Oxn Gênio 3 Society Cinza a Roxo,119.9,14,https://www.futfanatics.com.br/chuteira-oxn-genio-3-society-cinza-a-roxo,Oxn
Chuteira Umbro Adamant Club Campo Coral e Branca,299.9,14,https://www.futfanatics.com.br/chuteira-umbro-adamant-club-campo-coral-e-branca,Umbro
Chuteira Joma Dribling Society Azul-Marinho e Verde,299.9,14,https://www.futfanatics.com.br/chuteira-joma-dribling-society-azul-marinho-e-verde,Joma
Chuteira Oxn Rio Society Branca e Cinza,119.9,14,https://www.futfanatics.com.br/chuteira-oxn-rio-society-branca-e-cinza,Oxn
Chuteira Dray 806 Futsal Azul,119.9,14,https://www.futfanatics.com.br/chuteira-dray-806-futsal-azul,Dray
Chuteira Oxn Rio Futsal Branca e Azul,119.9,14,https://www.futfanatics.com.br/chuteira-oxn-rio-futsal-branca-e-azul,Oxn
Chuteira Oxn Gênio 3 Society Rosa,119.9,14,https://www.futfanatics.com.br/chuteira-oxn-genio-3-society-rosa,Oxn
Chuteira Dray Topfly 390 Futsal Preta e Azul,119.9,14,https://www.futfanatics.com.br/chuteira-dray-topfly-390-futsal-preta-e-azul,Dray
Chuteira Dray 802 Futsal Prata,119.9,14,https://www.futfanatics.com.br/chuteira-dray-802-futsal-prata,Dray
Chuteira Oxn Rio Society Preta e Cinza,119.9,14,https://www.futfanatics.com.br/chuteira-oxn-rio-society-preta-e-cinza,Oxn
Chuteira Umbro Fast Society Marinho e Branca,119.9,14,https://www.futfanatics.com.br/chuteira-umbro-fast-society-marinho-e-branca,Umbro
Chuteira Oxn Avanti 3 Society Verde,119.9,14,https://www.futfanatics.com.br/chuteira-oxn-avanti-3-society-verde,Oxn
Chuteira Oxn Avanti 3 Futsal Verde,119.9,14,https://www.futfanatics.com.br/chuteira-oxn-avanti-3-futsal-verde,Oxn
Chuteira Mizuno Alfa Select AS Society Branca,519.9,13,https://www.futfanatics.com.br/chuteira-mizuno-alfa-select-as-society-branca,Mizuno
Chuteira Oxn Fusion Grip 3 Neo Hybrid Society Vermelha,129.9,13,https://www.futfanatics.com.br/chuteira-oxn-fusion-grip-3-neo-hybrid-society-vermelha,Oxn
Chuteira Oxn Fusion Grip 3 Neo Society Preta e Ver,129.9,13,https://www.futfanatics.com.br/chuteira-oxn-fusion-grip-3-neo-society-preta-e-verde,Oxn
Chuteira Oxn Fusion Grip 3 Neo Society Marinho,129.9,13,https://www.futfanatics.com.br/chuteira-oxn-fusion-grip-3-neo-society-marinho,Oxn
Chuteira Oxn Velox 4 Neo Society Laranja,129.9,13,https://www.futfanatics.com.br/chuteira-oxn-velox-4-neo-society-laranja,Oxn
Chuteira Penalty Bravo XXII Futsal Preta,129.9,13,https://www.futfanatics.com.br/chuteira-penalty-bravo-xxii-futsal-preta,Penalty
Chuteira Oxn Fusion Grip 4 Futsal Laranja,129.9,13,https://www.futfanatics.com.br/chuteira-oxn-fusion-grip-4-futsal-laranja,Oxn
Chuteira Umbro Pro 5 Bump Club Futsal Branca e Azul,329.9,13,https://www.futfanatics.com.br/chuteira-umbro-pro-5-bump-club-futsal-branca-e-azul,Umbro
Chuteira Kelme Flamenco Futsal Amarela e Cinza,329.9,13,https://www.futfanatics.com.br/chuteira-kelme-flamenco-futsal-amarela-e-cinza,Kelme
Chuteira Penalty Bravo XXII Futsal Preta e Vermelha,129.9,13,https://www.futfanatics.com.br/chuteira-penalty-bravo-xxii-futsal-preta-e-vermelha,Penalty
Chuteira Oxn Fusion Grip 4 Futsal Cinza,129.9,13,https://www.futfanatics.com.br/chuteira-oxn-fusion-grip-4-futsal-cinza,Oxn
Chuteira Oxn Fusion Grip 4 Futsal Rosa,129.9,13,https://www.futfanatics.com.br/chuteira-oxn-fusion-grip-4-futsal-rosa,Oxn
Chuteira Puma Future Play BDP FG/AG Campo Marinho,389.9,13,https://www.futfanatics.com.br/chuteira-puma-future-play-bdp-fg/ag-campo-marinho,Puma
Chuteira Puma Future Play IT BDP Futsal Marinho,389.9,13,https://www.futfanatics.com.br/chuteira-puma-future-play-it-bdp-futsal-marinho,Puma
Chuteira Adidas X Messi Crazyfast TF Society 23.4 Prata,389.9,13,https://www.futfanatics.com.br/chuteira-adidas-x-messi-crazyfast-tf-society-23-4-prata,Adidas
Chuteira Oxn Vision 2 Futsal Laranja,129.9,13,https://www.futfanatics.com.br/chuteira-oxn-vision-2-futsal-laranja,Oxn
Chuteira Oxn Fusion Grip 4 Society Laranja,129.9,13,https://www.futfanatics.com.br/chuteira-oxn-fusion-grip-4-society-laranja,Oxn
Chuteira Mizuno Alfa Select Society Preta,519.9,13,https://www.futfanatics.com.br/chuteira-mizuno-alfa-select-society-preta,Mizuno
Chuteira Penalty Bravo XXII Futsal Marinho,129.9,13,https://www.futfanatics.com.br/chuteira-penalty-bravo-xxii-futsal-marinho,Penalty
Chuteira Adidas X Speedportal Society Rosa,1299.9,13,https://www.futfanatics.com.br/chuteira-adidas-x-speedportal-society-rosa,Adidas
Chuteira Umbro Attak Eternal Society All Black,189.9,13,https://www.futfanatics.com.br/chuteira-umbro-attak-eternal-society-all-black,Umbro
Chuteira Kelme Squadra Society Preta e Verde,199.9,13,https://www.futfanatics.com.br/chuteira-kelme-squadra-society-preta-e-verde,Kelme
Chuteira Oxn Fusion Grip 4 Neo Society Azul,139.9,12,https://www.futfanatics.com.br/chuteira-oxn-fusion-grip-4-neo-society-azul,Oxn
Chuteira Joma Top Flex Rebound Futsal Amarela,659.9,12,https://www.futfanatics.com.br/chuteira-joma-top-flex-rebound-futsal-amarela,Joma
Chuteira Kelme Elite Futsal Azul,349.9,12,https://www.futfanatics.com.br/chuteira-kelme-elite-futsal-azul,Kelme
Chuteira Joma Dribling Futsal Preta e Verde Limão,349.9,12,https://www.futfanatics.com.br/chuteira-joma-dribling-futsal-preta-e-verde-limao,Joma
Chuteira Joma Dribling Futsal Branca e Azul,349.9,12,https://www.futfanatics.com.br/chuteira-joma-dribling-futsal-branca-e-azul,Joma
Chuteira Joma Aguila Campo Azul,349.9,12,https://www.futfanatics.com.br/chuteira-joma-aguila-campo-azul,Joma
Chuteira Penalty Brasil 70 Locker XXI Futsal Branca,289.9,12,https://www.futfanatics.com.br/chuteira-penalty-brasil-70-locker-xxi-futsal-branca,Penalty
Chuteira Oxn Fusion Grip 4 Neo Futsal Cinza,139.9,12,https://www.futfanatics.com.br/chuteira-oxn-fusion-grip-4-neo-futsal-cinza,Oxn
Chuteira Penalty Brasil 70 Locker XXI Futsal Preta,289.9,12,https://www.futfanatics.com.br/chuteira-penalty-brasil-70-locker-xxi-futsal-preta,Penalty
Chuteira Kelme Fuerza Society Azul,219.9,12,https://www.futfanatics.com.br/chuteira-kelme-fuerza-society-azul,Kelme
Chuteira Joma Top Flex Futsal Verde Limão,479.9,12,https://www.futfanatics.com.br/chuteira-joma-top-flex-futsal-verde-limao,Joma
Chuteira Umbro Pro 5 Bump Futsal Branca,479.9,12,https://www.futfanatics.com.br/chuteira-umbro-pro-5-bump-futsal-branca,Umbro
Chuteira Umbro Orbit Society Azul,139.9,12,https://www.futfanatics.com.br/chuteira-umbro-orbit-society-azul,Umbro
Chuteira Joma FS Reactive Society Preta e Amarela,699.9,12,https://www.futfanatics.com.br/chuteira-joma-fs-reactive-society-preta-e-amarela,Joma
Chuteira Joma FS Reactive Society Amarela e Preta,699.9,12,https://www.futfanatics.com.br/chuteira-joma-fs-reactive-society-amarela-e-preta,Joma
Chuteira Penalty Bravo Y-3 Society Amarela,139.9,12,https://www.futfanatics.com.br/chuteira-penalty-bravo-y-3-society-amarela,Penalty
Chuteira Penalty Bravo Y-3 Campo Amarela,139.9,12,https://www.futfanatics.com.br/chuteira-penalty-bravo-y-3-campo-amarela,Penalty
Chuteira Umbro Orbit Society Branca,139.9,12,https://www.futfanatics.com.br/chuteira-umbro-orbit-society-branca,Umbro
Chuteira Umbro Orbit Society Preta,139.9,12,https://www.futfanatics.com.br/chuteira-umbro-orbit-society-preta,Umbro
Chuteira Kelme Copa Futsal Preta,459.9,11,https://www.futfanatics.com.br/chuteira-kelme-copa-futsal-preta,Kelme
Chuteira Umbro Warskin Campo Branco,159.9,11,https://www.futfanatics.com.br/chuteira-umbro-warskin-campo-branco,Umbro
Chuteira Umbro Warskin Society Azul,159.9,11,https://www.futfanatics.com.br/chuteira-umbro-warskin-society-azul,Umbro
Chuteira Puma Future Play BDP FG/AG Campo Branca e Rosa,399.9,11,https://www.futfanatics.com.br/chuteira-puma-future-play-bdp-fg/ag-campo-branca-e-rosa,Puma
Chuteira Joma Liga 5 Society Verde Limão,399.9,11,https://www.futfanatics.com.br/chuteira-joma-liga-5-society-verde-limao,Joma
Chuteira Joma Liga 5 Futsal Preta e Amarela,399.9,11,https://www.futfanatics.com.br/chuteira-joma-liga-5-futsal-preta-e-amarela,Joma
Chuteira Penalty Líder Y-3 Society Bordô,159.9,11,https://www.futfanatics.com.br/chuteira-penalty-lider-y-3-society-bordo,Penalty
Chuteira Joma Top Flex II Society Preta e Laranja,529.9,11,https://www.futfanatics.com.br/chuteira-joma-top-flex-ii-society-preta-e-laranja,Joma
Chuteira Joma Top Flex Futsal Preta e Azul,529.9,11,https://www.futfanatics.com.br/chuteira-joma-top-flex-futsal-preta-e-azul,Joma
Chuteira Umbro Warskin Campo Azul,159.9,11,https://www.futfanatics.com.br/chuteira-umbro-warskin-campo-azul,Umbro
Chuteira Joma Top Flex Society Branca e Amarela,529.9,11,https://www.futfanatics.com.br/chuteira-joma-top-flex-society-branca-e-amarela,Joma
Chuteira Oxn X-Control 2 Futsal Cinza,149.9,11,https://www.futfanatics.com.br/chuteira-oxn-x-control-2-futsal-cinza,Oxn
Chuteira Penalty Líder Y-3 Society Vermelha,159.9,11,https://www.futfanatics.com.br/chuteira-penalty-lider-y-3-society-vermelha,Penalty
Chuteira Penalty Líder Y-3 Futsal Preta,159.9,11,https://www.futfanatics.com.br/chuteira-penalty-lider-y-3-futsal-preta,Penalty
Chuteira Penalty Líder Y-3 Futsal Vermelha,159.9,11,https://www.futfanatics.com.br/chuteira-penalty-lider-y-3-futsal-vermelha,Penalty
Chuteira Oxn X-Control 2 Society Cinza,149.9,11,https://www.futfanatics.com.br/chuteira-oxn-x-control-2-society-cinza,Oxn
Chuteira Oxn X-Control 2 Society Azul,149.9,11,https://www.futfanatics.com.br/chuteira-oxn-x-control-2-society-azul,Oxn
Chuteira Umbro Class Futsal Preta,149.9,11,https://www.futfanatics.com.br/chuteira-umbro-class-futsal-preta,Umbro
Chuteira Umbro Class Society Marinho e Cinza,149.9,11,https://www.futfanatics.com.br/chuteira-umbro-class-society-marinho-e-cinza,Umbro
Chuteira Adidas Deportivo II FxG Campo Branca e Azul,269.9,10,https://www.futfanatics.com.br/chuteira-adidas-deportivo-ii-fxg-campo-branca-e-azul,Adidas
Chuteira Umbro Chrome Campo Roxa,269.9,10,https://www.futfanatics.com.br/chuteira-umbro-chrome-campo-roxa,Umbro
Chuteira Penalty Líder Y-4 Futsal Preto,169.9,10,https://www.futfanatics.com.br/chuteira-penalty-lider-y-4-futsal-preto,Penalty
Chuteira Umbro Neo Striker Society Preta e Dourada,179.9,10,https://www.futfanatics.com.br/chuteira-umbro-neo-striker-society-preta-e-dourada,Umbro
Chuteira Puma Future 7 Play TT Society Branca,449.9,10,https://www.futfanatics.com.br/chuteira-puma-future-7-play-tt-society-branca,Puma
Chuteira Umbro Chrome Futsal Roxa,269.9,10,https://www.futfanatics.com.br/chuteira-umbro-chrome-futsal-roxa,Umbro
Chuteira Umbro Chrome Futsal Preto,269.9,10,https://www.futfanatics.com.br/chuteira-umbro-chrome-futsal-preto,Umbro
Chuteira Adidas Predator Accuracy 23.4 IN Futsal Azul,359.9,10,https://www.futfanatics.com.br/chuteira-adidas-predator-accuracy-23-4-in-futsal-azul,Adidas
Chuteira Umbro Chrome Society Azul Royal,269.9,10,https://www.futfanatics.com.br/chuteira-umbro-chrome-society-azul-royal,Umbro
Chuteira Umbro Neo Striker Futsal Preta e Dourada,179.9,10,https://www.futfanatics.com.br/chuteira-umbro-neo-futsal-preta-e-dourada,Umbro
Chuteira Umbro Neo Striker Society Azul Marinho,179.9,10,https://www.futfanatics.com.br/chuteira-umbro-neo-striker-society-azul-marinho,Umbro
Chuteira Puma Truco III Futsal Preta e Verde,449.9,10,https://www.futfanatics.com.br/chuteira-puma-truco-iii-futsal-preta-e-verde,Puma
Chuteira Umbro Chrome Society Roxa,269.9,10,https://www.futfanatics.com.br/chuteira-umbro-chrome-society-roxa,Umbro
Chuteira Joma Top Flex Society Preta e Amarela,539.9,10,https://www.futfanatics.com.br/chuteira-joma-top-flex-society-preta-e-amarela,Joma
Chuteira Puma Truco III Futsal Branca e Laranja,449.9,10,https://www.futfanatics.com.br/chuteira-puma-truco-iii-futsal-branca-e-laranja,Puma
Chuteira Joma Mundial Society Preta,449.9,10,https://www.futfanatics.com.br/chuteira-joma-mundial-society-preta,Joma
Chuteira Adidas X Crazy 23 Club FxG Campo Amarela,339.9,10,https://www.futfanatics.com.br/chuteira-adidas-x-crazy-23-club-fxg-campo-amarela,Adidas
Chuteira Adidas Predator Accuracy 23.3 TF Society Preta,539.9,10,https://www.futfanatics.com.br/chuteira-adidas-predator-accuracy-23-3-tf-society-preta,Adidas
Chuteira Adidas Predator Accuracy 23.3 IN Futsal Branca e Amarelo Fluorescente,539.9,10,https://www.futfanatics.com.br/chuteira-adidas-predator-accuracy-23-3-in-futsal-branca-e-amarelo-fluorescente,Adidas
Chuteira Kelme Copa Futsal Verde Limão,499.9,9,https://www.futfanatics.com.br/chuteira-kelme-copa-futsal-verde-limao,Kelme
Chuteira Puma Attacanto TT BDP Society Branca,319.9,8,https://www.futfanatics.com.br/chuteira-puma-attacanto-tt-bdp-society-branca,Puma
Chuteira Puma Attacanto IT BDP Futsal Marinho,319.9,8,https://www.futfanatics.com.br/chuteira-puma-attacanto-it-bdp-futsal-marinho,Puma
Chuteira Umbro Attak Eternal Campo Preto e Dourado,229.9,8,https://www.futfanatics.com.br/chuteira-umbro-attak-eternal-campo-preto-e-dourado,Umbro
Chuteira Adidas Predator Accuracy 23.3 IN Futsal Azul,549.9,8,https://www.futfanatics.com.br/chuteira-adidas-predator-accuracy-23-3-in-futsal-azul,Adidas
Chuteira Adidas X Crazyfast 23.3 IN Futsal Azul,549.9,8,https://www.futfanatics.com.br/chuteira-adidas-x-crazyfast-23-3-in-futsal-azul,Adidas
Chuteira Joma Top Flex Futsal Preta e Vermelha,549.9,8,https://www.futfanatics.com.br/chuteira-joma-top-flex-futsal-preta-e-vermelha,Joma
Chuteira Dray Topfly 390 Society Preta e Azul,119.9,7,https://www.futfanatics.com.br/chuteira-dray-topfly-390-society-preta-e-azul,Dray
Chuteira Penalty Bravo Y-3 Society Preta,129.9,7,https://www.futfanatics.com.br/chuteira-penalty-bravo-y-3-society-preta,Penalty
Chuteira Oxn Agilis 2 Society Marinho,119.9,7,https://www.futfanatics.com.br/chuteira-oxn-agilis-2-society-marinho,Oxn
Chuteira Kelme Precision Futsal Azul,479.9,7,https://www.futfanatics.com.br/chuteira-kelme-precision-futsal-azul,Kelme
Chuteira Umbro Pro 5 Bump Club Futsal Azul e Branca,349.9,7,https://www.futfanatics.com.br/chuteira-umbro-pro-5-bump-club-futsal-azul-e-branca,Umbro
Chuteira Kelme Precision Lite Futsal Branca e Rosa,599.9,7,https://www.futfanatics.com.br/chuteira-kelme-precision-lite-futsal-branca-e-rosa,Kelme
Chuteira Puma Future Z 4.4 NJr TT BDP Society Laranja,369.9,7,https://www.futfanatics.com.br/chuteira-puma-future-z-4-4-njr-tt-bdp-society-laranja,Puma
Chuteira Oxn Vision 2 Society Preta,139.9,6,https://www.futfanatics.com.br/chuteira-oxn-vision-2-society-preta,Oxn
Chuteira Oxn Fusion Grip 4 Neo Society Preta,149.9,6,https://www.futfanatics.com.br/chuteira-oxn-fusion-grip-4-neo-society-preta,Oxn
Chuteira Mizuno Morelia II Pro Campo Preta,749.9,6,https://www.futfanatics.com.br/chuteira-mizuno-morelia-ii-pro-campo-preta,Mizuno
Chuteira Oxn Fusion Grip 4 Society Preta,139.9,6,https://www.futfanatics.com.br/chuteira-oxn-fusion-grip-4-society-preta,Oxn
Chuteira Joma Top Flex Rebound Futsal Preta,699.9,6,https://www.futfanatics.com.br/chuteira-joma-top-flex-rebound-futsal-preta,Joma
Chuteira Mizuno Morelia II Pro Society Preta,749.9,6,https://www.futfanatics.com.br/chuteira-mizuno-morelia-ii-pro-society-preta,Mizuno
Chuteira Mizuno Morelia Neo Campo Preta e Preta,1399.9,6,https://www.futfanatics.com.br/chuteira-mizuno-morelia-neo-campo-preta-e-preta,Mizuno
Chuteira Oxn Vision 2 Futsal Cinza,139.9,6,https://www.futfanatics.com.br/chuteira-oxn-vision-2-futsal-cinza,Oxn
Chuteira Oxn Vision 2 Society Cinza,139.9,6,https://www.futfanatics.com.br/chuteira-oxn-vision-2-society-cinza,Oxn
Chuteira Umbro Pro Challenge Futsal Preta e Branca,419.9,6,https://www.futfanatics.com.br/chuteira-umbro-pro-challenge-futsal-preta-e-branca,Umbro
Chuteira Umbro Pro Challenge Futsal Azul,419.9,6,https://www.futfanatics.com.br/chuteira-umbro-pro-challenge-futsal-azul,Umbro
Chuteira Oxn Vision 2 Society Laranja,139.9,6,https://www.futfanatics.com.br/chuteira-oxn-vision-2-society-laranja,Oxn
Chuteira Adidas Artilheira VI TF Society Branca,279.9,6,https://www.futfanatics.com.br/chuteira-adidas-artilheira-vi-tf-society-branca,Adidas
Chuteira Penalty Bravo Y-3 Society Verde,149.9,6,https://www.futfanatics.com.br/chuteira-penalty-bravo-y-3-society-verde,Penalty
Chuteira Adidas Deportivo II IN Futsal Preta e Vermelha,279.9,6,https://www.futfanatics.com.br/chuteira-adidas-deportivo-ii-in-futsal-preta-e-vermelha,Adidas
Chuteira Adidas Deportivo II TF Society Preta,279.9,6,https://www.futfanatics.com.br/chuteira-adidas-deportivo-ii-tf-society-preta,Adidas
Chuteira Kelme Copa Futsal Marinho e Branca,569.9,5,https://www.futfanatics.com.br/chuteira-kelme-copa-futsal-marinho-e-branca,Kelme
Chuteira Penalty Lider Y-4 Campo Preta,179.9,5,https://www.futfanatics.com.br/chuteira-penalty-lider-y-4-campo-preta,Penalty
Chuteira Penalty Garra Y-2 Society Preta e Azul,159.9,5,https://www.futfanatics.com.br/chuteira-penalty-garra-y-2-society-preta-e-azul,Penalty
Chuteira Kelme Precision Futsal Vermelha,569.9,5,https://www.futfanatics.com.br/chuteira-kelme-precision-futsal-vermelha,Kelme
Chuteira Adidas X Crazyfast 23.4 FG/AG Campo Verde Limão e Branca,379.9,5,https://www.futfanatics.com.br/chuteira-adidas-x-crazyfast-23-4-fg/ag-campo-verde-limao-e-branca,Adidas
Chuteira Mizuno Morelia Club IN Futsal Laranja e Preta,329.9,5,https://www.futfanatics.com.br/chuteira-mizuno-morelia-club-in-futsal-laranja-e-preta,Mizuno
Chuteira Joma Maxima Society Branca e Preta,329.9,5,https://www.futfanatics.com.br/chuteira-joma-maxima-society-branca-e-preta,Joma
Chuteira Penalty Garra Y-2 Futsal Preta e Azul,159.9,5,https://www.futfanatics.com.br/chuteira-penalty-garra-y-2-futsal-preta-e-azul,Penalty
Chuteira Oxn X-Control 2 Futsal Amarela,159.9,5,https://www.futfanatics.com.br/chuteira-oxn-x-control-2-futsal-amarela,Oxn
Chuteira Mizuno Morelia Club MD Campo Azul e Branca,329.9,5,https://www.futfanatics.com.br/chuteira-mizuno-morelia-club-md-campo-azul-e-branca,Mizuno
Chuteira Oxn X-Control 2 Futsal Azul,159.9,5,https://www.futfanatics.com.br/chuteira-oxn-x-control-2-futsal-azul,Oxn
Chuteira Mizuno Morelia Classic AS Society Azul,429.9,4,https://www.futfanatics.com.br/chuteira-mizuno-morelia-classic-as-society-azul,Mizuno
Chuteira Mizuno Morelia Classic AS Society Preta,429.9,4,https://www.futfanatics.com.br/chuteira-mizuno-morelia-classic-as-society-preta,Mizuno
Chuteira Mizuno Morelia II Pro Campo Branca,799.9,0,https://www.futfanatics.com.br/chuteira-mizuno-morelia-ii-pro-campo-branca,Mizuno
Chuteira Under Armour Clone Magnético PRM 3.0 FG Campo Preta,1299.9,0,https://www.futfanatics.com.br/chuteira-under-armour-clone-magnetico-prm-3-0-fg-campo-preta,Under
Chuteira Umbro Pro 5 Bump Futsal Preta,549.9,0,https://www.futfanatics.com.br/chuteira-umbro-pro-5-bump-futsal-preta,Umbro
Chuteira Mizuno Morelia Classic MD Campo Branca e Dourada,449.9,0,https://www.futfanatics.com.br/chuteira-mizuno-morelia-classic-md-campo-branca-e-dourada,Mizuno
Chuteira Mizuno Morelia Classic MD Campo Amarela e Vermelha,449.9,0,https://www.futfanatics.com.br/chuteira-mizuno-morelia-classic-md-campo-amarela-e-vermelha,Mizuno
Chuteira Adidas Copa Pure 23 Academy TF Society Off White,549.9,0,https://www.futfanatics.com.br/chuteira-adidas-copa-pure-23-academy-tf-society-off-white,Adidas
Chuteira Adidas X Crazyfast Messi 23 Club TF Society Azul,479.9,0,https://www.futfanatics.com.br/chuteira-adidas-x-crazyfast-messi-23-club-tf-society-azul,Adidas
Chuteira Adidas X Crazyfast League 23 Academy TF Society Amarela,549.9,0,https://www.futfanatics.com.br/chuteira-adidas-x-crazyfast-league-23-academy-tf-society-amarela,Adidas
Chuteira Adidas X Crazyfast League 23 Academy FG Campo Amarela,549.9,0,https://www.futfanatics.com.br/chuteira-adidas-x-crazyfast-league-23-academy-fg-campo-amarela,Adidas
Chuteira Umbro Pro 5 Bump Dragon Year Futsal Vermelha,649.9,0,https://www.futfanatics.com.br/chuteira-umbro-pro-5-bump-dragon-year-futsal-vermelha,Umbro
Chuteira Mizuno Morelia Classic MD Campo Laranja e Preto,449.9,0,https://www.futfanatics.com.br/chuteira-mizuno-morelia-classic-md-campo-laranja-e-preto,Mizuno
Chuteira Mizuno Morelia Classic AS Society Amarela e Vermelha,449.9,0,https://www.futfanatics.com.br/chuteira-mizuno-morelia-classic-as-society-amarela-e-vermelha,Mizuno
Chuteira New Balance Furon Dispatch FG 7+ Campo Azul,699.9,0,https://www.futfanatics.com.br/chuteira-new-balance-furon-dispatch-fg-7-campo-azul,New
Chuteira Adidas Copa Pure 23 Academy FG Campo Off White,549.9,0,https://www.futfanatics.com.br/chuteira-adidas-copa-pure-23-academy-fg-campo-off-white,Adidas
Chuteira Adidas X Crazyfast League Messi 23 Academy FG Campo Azul,699.9,0,https://www.futfanatics.com.br/chuteira-adidas-x-crazyfast-league-messi-23-academy-fg-campo-azul,Adidas
Chuteira Adidas Predator League 24 Academy Low FG Campo Preta e Laranja,549.9,0,https://www.futfanatics.com.br/chuteira-adidas-predator-league-24-academy-low-fg-campo-preta-e-laranja,Adidas
Chuteira Adidas X Crazyfast League 23 Academy IN Futsal Amarela,549.9,0,https://www.futfanatics.com.br/chuteira-adidas-x-crazyfast-league-23-academy-in-futsal-amarela,Adidas
Chuteira Adidas X Crazyfast League Messi 23 Academy TF Society Azul,699.9,0,https://www.futfanatics.com.br/chuteira-adidas-x-crazyfast-league-messi-23-academy-tf-society-azul,Adidas
Chuteira Adidas Predator League 24 Academy Low IN Futsal Preta e Vermelha,549.9,0,https://www.futfanatics.com.br/chuteira-adidas-predator-league-24-academy-low-in-futsal-preta-e-vermelha,Adidas
Chuteira Mizuno Morelia Classic AS Society Branca e Dourada,449.9,0,https://www.futfanatics.com.br/chuteira-mizuno-morelia-classic-as-society-branca-e-dourada,Mizuno
Chuteira New Balance 442 V2 Team TF Society Preta,599.9,0,https://www.futfanatics.com.br/chuteira-new-balance-442-v2-team-tf-society-preta,New
Chuteira Adidas X Crazyfast Messi 23 Club FxG Campo Azul,479.9,0,https://www.futfanatics.com.br/chuteira-adidas-x-crazyfast-messi-23-club-fxg-campo-azul,Adidas
Chuteira Adidas Predator League 24 Academy Low TF Society Preta e Vermelha,549.9,0,https://www.futfanatics.com.br/chuteira-adidas-predator-league-24-academy-low-tf-society-preta-e-vermelha,Adidas
Chuteira Kappa Florida Campo Vermelha e Preta,179.9,0,https://www.futfanatics.com.br/chuteira-kappa-florida-campo-vermelha-e-preta,Kappa
