marca;preco;desconto;link
Tênis Coca Cola Loud Elite Preto e Branco;159.9;50;https://www.futfanatics.com.br/tenis-coca-cola-loud-elite-preto-e-branco
Tênis Fila Attrek Marinho e Vermelho;199.9;47;https://www.futfanatics.com.br/tenis-fila-attrek-marinho-e-vermelho
Tênis Coca Cola X-Fly Cage Grafite;149.9;46;https://www.futfanatics.com.br/tenis-coca-cola-x-fly-cage-grafite
Tênis Puma Wired Run Speckles BDP Marinho;219.9;45;https://www.futfanatics.com.br/tenis-puma-wired-run-speckles-bdp-marinho
Tênis Reserva Ultra Basic Azul;249.9;44;https://www.futfanatics.com.br/tenis-reserva-ultra-basic-azul
Tênis Under Armour HOVR Infinite 2 Coral e Preto;499.9;44;https://www.futfanatics.com.br/tenis-under-armour-hovr-infinite-2-coral-e-preto
Tênis Olympikus Orion Preto e Vermelho;129.9;43;https://www.futfanatics.com.br/tenis-olympikus-orion-preto-e-vermelho
Tênis Redley Originals Explore Cano Médio Bege;199.9;42;https://www.futfanatics.com.br/tenis-redley-originals-explore-cano-medio-bege
Tênis Puma Wired Run BDP Azul Marinho;219.9;42;https://www.futfanatics.com.br/tenis-puma-wired-run-bdp-azul-marinho
Tênis Puma Wired Run Speckles BDP Cinza;219.9;42;https://www.futfanatics.com.br/tenis-puma-wired-run-speckles-bdp-cinza
Tênis Fila Racer One Marinho;229.9;42;https://www.futfanatics.com.br/tenis-fila-racer-one-marinho
Tênis Redley Originals Explore Cano Médio Branco;199.9;42;https://www.futfanatics.com.br/tenis-redley-originals-explore-cano-medio-branco
Tênis Under Armour HOVR Summit 2 Vermelho;399.9;42;https://www.futfanatics.com.br/tenis-under-armour-hovr-summit-2-vermelho
Tênis Puma Wired Run Speckles BDP Verde;229.9;42;https://www.futfanatics.com.br/tenis-puma-wired-run-speckles-bdp-verde
Tênis Redley Originals II Cano Médio Preto;199.9;42;https://www.futfanatics.com.br/tenis-redley-originals-ii-cano-medio-preto
Tênis Puma Aviator ENG Pro BDP Azul;279.9;41;https://www.futfanatics.com.br/tenis-puma-aviator-eng-pro-bdp-azul
Chinelo Puma Popcat 20 BDP Marinho;99.9;41;https://www.futfanatics.com.br/chinelo-puma-popcat-20-bdp-marinho
Tênis Coca Cola Kick Laguna Vermelho;129.9;40;https://www.futfanatics.com.br/tenis-coca-cola-kick-laguna-vermelho
Tênis Puma Ferrari R-Cat Vermelho;269.9;40;https://www.futfanatics.com.br/tenis-puma-ferrari-r-cat-vermelho
Tênis Puma Flyer Runner Speckless BDP Marinho;269.9;40;https://www.futfanatics.com.br/tenis-puma-flyer-runner-speckless-bdp-marinho
Tênis Redley Originals Candy Verde;129.9;40;https://www.futfanatics.com.br/tenis-redley-originals-candy-verde
Tênis Coca Cola Kick Laguna Azul;129.9;40;https://www.futfanatics.com.br/tenis-coca-cola-kick-laguna-azul
Chinelo Puma Leadcat 2.0 Neymar NJR BDP Branco;129.9;40;https://www.futfanatics.com.br/chinelo-puma-leadcat-2-0-neymar-njr-bdp-branco
Chinelo Puma Leadcat 2.0 Neymar NJR BDP Preto;129.9;40;https://www.futfanatics.com.br/chinelo-puma-leadcat-2-0-neymar-njr-bdp-preto
Tênis Olympikus Metrópole Marinho e Cinza;179.9;40;https://www.futfanatics.com.br/tenis-olympikus-metropole-marinho-e-cinza
Chinelo Puma Popcat 20 Logo Power BDP Branco;119.9;40;https://www.futfanatics.com.br/chinelo-puma-popcat-20-logo-power-bdp-branco
Chinelo Puma Popcat 20 Logo Power BDP Preto;119.9;40;https://www.futfanatics.com.br/chinelo-puma-popcat-20-logo-power-bdp-preto
Tênis Puma Wired Run Speckles BDP Preto;239.9;40;https://www.futfanatics.com.br/tenis-puma-wired-run-speckles-bdp-preto
Tênis Redley Originals Candy Azul;129.9;40;https://www.futfanatics.com.br/tenis-redley-originals-candy-azul
Tênis Puma Scuderia Ferrari Neo Cat Vermelho;269.9;40;https://www.futfanatics.com.br/tenis-puma-scuderia-ferrari-neo-cat-vermelho
Tênis Redley Originals Neon Branco;169.9;39;https://www.futfanatics.com.br/tenis-redley-originals-neon-branco
Tênis Redley Originals Neon Marrom;169.9;39;https://www.futfanatics.com.br/tenis-redley-originals-neon-marrom
Tênis Redley Originals Neon Preto;169.9;39;https://www.futfanatics.com.br/tenis-redley-originals-neon-preto
Tênis Puma Aviator ENG Pro BDP Preto e Laranja;289.9;39;https://www.futfanatics.com.br/tenis-puma-aviator-eng-pro-bdp-preto-e-laranja
Tênis Redley Originals Neon Azul;169.9;39;https://www.futfanatics.com.br/tenis-redley-originals-neon-azul
Tênis Puma Flyer Runner BDP Preto;229.9;39;https://www.futfanatics.com.br/tenis-puma-flyer-runner-bdp-preto
Tênis Puma Accent NXT BDP Marinho e Amarelo;229.9;39;https://www.futfanatics.com.br/tenis-puma-accent-nxt-bdp-marinho-e-amarelo
Tênis Puma Mercedes AMG Petronas MAPF1 Drift Cat Decima Preto;399.9;38;https://www.futfanatics.com.br/tenis-puma-mercedes-amg-petronas-mapf1-drift-cat-decima-preto
Tênis Puma Mercedes AMG Petronas MAPF1 Neo Cat Branco;339.9;38;https://www.futfanatics.com.br/tenis-puma-mercedes-amg-petronas-mapf1-neo-cat-branco
Tênis Reserva Joy Lace Verde;219.9;37;https://www.futfanatics.com.br/tenis-reserva-joy-lace-verde
Tênis Reserva Simples Lace Cinza;249.9;37;https://www.futfanatics.com.br/tenis-reserva-simples-lace-cinza
Tênis Reserva Simples Lace II Azul;249.9;37;https://www.futfanatics.com.br/tenis-reserva-simples-lace-ii-azul
Tênis Puma Flyer Runner Speckless BDP Preto e Branco;249.9;37;https://www.futfanatics.com.br/tenis-puma-flyer-runner-speckless-bdp-preto-e-branco
Tênis Puma Flyer Beta BDP Cinza;219.9;37;https://www.futfanatics.com.br/tenis-puma-flyer-beta-bdp-cinza
Tênis Redley Originals Cano Médio Azul e Marrom;149.9;37;https://www.futfanatics.com.br/tenis-redley-originals-cano-medio-azul-e-marrom
Tênis Fila Trend 2.0 Marinho;169.9;37;https://www.futfanatics.com.br/tenis-fila-trend-2-0-marinho
Tênis Reserva Rubber Marinho;229.9;37;https://www.futfanatics.com.br/tenis-reserva-rubber-marinho
Tênis Fila Trend 2.0 Marinho e Vermelho;169.9;37;https://www.futfanatics.com.br/tenis-fila-trend-2-0-marinho-e-vermelho
Tênis Joma Forloz Preto;169.9;37;https://www.futfanatics.com.br/tenis-joma-forloz-preto
Tênis Puma Wired Run BDP All Black;239.9;36;https://www.futfanatics.com.br/tenis-puma-wired-run-bdp-all-black
Tênis Fila Athlon Marinho;189.9;36;https://www.futfanatics.com.br/tenis-fila-athlon-marinho
Tênis Puma Porsche Legacy Neo Cat Preto e Branco;349.9;36;https://www.futfanatics.com.br/tenis-puma-porsche-legacy-neo-cat-preto-e-branco
Bota Bradok Zion Marrom;279.9;36;https://www.futfanatics.com.br/bota-bradok-zion-marrom
Tênis Cavalera Knit Eagle Cinza Escuro;159.9;36;https://www.futfanatics.com.br/tenis-cavalera-knit-eagle-cinza-escuro
Tênis Puma Accent NXT BDP Preto e Branco;259.9;35;https://www.futfanatics.com.br/tenis-puma-accent-nxt-bdp-preto-e-branco
Tênis Under Armour Charged Focus Print Cinza e Preto;449.9;35;https://www.futfanatics.com.br/tenis-under-armour-charged-focus-print-cinza-e-preto
Tênis Puma Ferrari Electron E Pro II Branco;389.9;35;https://www.futfanatics.com.br/tenis-puma-ferrari-electron-e-pro-branco
Tênis Puma Aviator Light Pro BDP Preto e Laranja;289.9;35;https://www.futfanatics.com.br/tenis-puma-aviator-light-pro-bdp-preto-e-laranja
Tênis Qix Vulcan Vinho;129.9;35;https://www.futfanatics.com.br/tenis-qix-vulcan-vinho
Tênis Puma BMW Motorsport Drift Cat Decima Branco;419.9;35;https://www.futfanatics.com.br/tenis-puma-bmw-motorsport-drift-cat-decima-branco
Tênis Puma Flyer Runner BDP Marinho;249.9;34;https://www.futfanatics.com.br/tenis-puma-flyer-runner-bdp-marinho
Tênis Puma Wired Rapid BDP Verde;249.9;34;https://www.futfanatics.com.br/tenis-puma-wired-rapid-bdp-verde
Tênis Olympikus Ultraleve 155G Cinza;149.9;34;https://www.futfanatics.com.br/tenis-olympikus-ultraleve-155g-cinza
Tênis Reserva Flip Preto;229.9;34;https://www.futfanatics.com.br/tenis-reserva-flip-preto
Tênis Fila Split Branco e Marinho;229.9;34;https://www.futfanatics.com.br/tenis-fila-split-branco-e-marinho
Tênis Asics Fuzeblast SE Preto e Verde;329.9;34;https://www.futfanatics.com.br/tenis-asics-fuzeblast-se-preto-e-verde
Tênis Everlast Range Preto e Dourado;229.9;34;https://www.futfanatics.com.br/tenis-everlast-range-preto-e-dourado
Tênis Puma Aviator ENG Pro BDP Verde;319.9;33;https://www.futfanatics.com.br/tenis-puma-aviator-eng-pro-bdp-verde
Tênis Fila Super Flip Branco e Vermelho;199.9;33;https://www.futfanatics.com.br/tenis-fila-super-flip-branco-e-vermelho
Tênis Fila Super Flip Marinho e Branco;199.9;33;https://www.futfanatics.com.br/tenis-fila-super-flip-marinho-e-branco
Tenis Fila Euroflag Marinho e Branco;199.9;33;https://www.futfanatics.com.br/tenis-fila-euroflag-marinho-e-branco
Tênis Puma Respin SL Branco e Vermelho;299.9;33;https://www.futfanatics.com.br/tenis-puma-respin-sl-branco-e-vermelho
Tênis Fila Trend 2.0 Preto;179.9;33;https://www.futfanatics.com.br/tenis-fila-trend-2-0-preto
Chinelo Puma Popcat 20 BDP Branco;119.9;33;https://www.futfanatics.com.br/chinelo-puma-popcat-20-bdp-branco
Tênis Puma ST Runner v2 SN BDP Cinza;299.9;33;https://www.futfanatics.com.br/tenis-puma-st-runner-v2-sn-bdp-cinza
Tênis Olympikus Vibração Cinza e Verde;119.9;33;https://www.futfanatics.com.br/tenis-olympikus-vibracao-cinza-e-verde
Chinelo Kenner Kivah Over Marinho e Verde;99.9;33;https://www.futfanatics.com.br/chinelo-kenner-kivah-over-marinho-e-verde
Tênis Puma Viz Runner BDP Branco;299.9;33;https://www.futfanatics.com.br/tenis-puma-viz-runner-bdp-branco
Chinelo Kenner Kivah Preto e Cinza;99.9;33;https://www.futfanatics.com.br/chinelo-kenner-kivah-preto-e-cinza
Tênis Puma Aviator Light Pro BDP Azul;299.9;33;https://www.futfanatics.com.br/tenis-puma-aviator-light-pro-bdp-azul
Tênis Olympikus Fusão Marinho;169.9;32;https://www.futfanatics.com.br/tenis-olympikus-fusao-marinho
Tênis Fila Nest Prata e Marinho;189.9;32;https://www.futfanatics.com.br/tenis-fila-nest-prata-e-marinho
Tênis Olympikus Barra Marinho;189.9;32;https://www.futfanatics.com.br/tenis-olympikus-barra-marinho
Tênis Adidas Response Super 3.0 Preto;469.9;32;https://www.futfanatics.com.br/tenis-adidas-response-super-3-0-preto
Tênis Puma BMW Motorsport Neo Cat Preto;369.9;32;https://www.futfanatics.com.br/tenis-puma-bmw-motorsport-neo-cat-preto
Tênis Olympikus Barra Preto;189.9;32;https://www.futfanatics.com.br/tenis-olympikus-barra-preto
Tênis Coca Cola Rockey Branco e Vermelho;269.9;32;https://www.futfanatics.com.br/tenis-coca-cola-rockey-branco-e-vermelho
Tênis Fila Split Preto e Grafite;239.9;31;https://www.futfanatics.com.br/tenis-fila-split-preto-e-grafite
Tênis Olympikus Anyway 2 Feminino Preto;129.9;31;https://www.futfanatics.com.br/tenis-olympikus-anyway-2-feminino-preto
Tênis Puma Flyer Runner BDP Cinza e Preto;259.9;31;https://www.futfanatics.com.br/tenis-puma-flyer-runner-bdp-cinza-e-preto
Tênis Redley Originals Candy Lilás;149.9;31;https://www.futfanatics.com.br/tenis-redley-originals-candy-lilas
Tênis Under Armour HOVR Way Preto;479.9;31;https://www.futfanatics.com.br/tenis-under-armour-hovr-way-preto
Tênis Puma BMW Motorsport Electron e Pro Preto e Azul;409.9;31;https://www.futfanatics.com.br/tenis-puma-bmw-motorsport-electron-e-pro-preto-e-azul
Tênis Redley Originals Verde Menta;149.9;31;https://www.futfanatics.com.br/tenis-redley-originals-verde-menta
Tênis Redley Originals Colors Vinho;149.9;31;https://www.futfanatics.com.br/tenis-redley-originals-colors-vinho
Tênis Redley Originals Azul Claro;149.9;31;https://www.futfanatics.com.br/tenis-redley-originals-azul-claro
Tênis Redley Originals Special Verde;149.9;31;https://www.futfanatics.com.br/tenis-redley-originals-special-verde
Tênis Redley Originals Colors III Amarelo;149.9;31;https://www.futfanatics.com.br/tenis-redley-originals-colors-iii-amarelo
Tênis Redley Originals Colors II Rosa;149.9;31;https://www.futfanatics.com.br/tenis-redley-originals-colors-ii-rosa
Tênis Redley Originals Colors II Verde;149.9;31;https://www.futfanatics.com.br/tenis-redley-originals-colors-ii-verde
Tênis Redley Originals Colors II Azul;149.9;31;https://www.futfanatics.com.br/tenis-redley-originals-colors-ii-azul
Tênis Redley Originals Candy Laranja e Branco;149.9;31;https://www.futfanatics.com.br/tenis-redley-originals-candy-laranja-e-branco
Tênis Puma Cell Divide SL BPD Preto e Prata;349.9;30;https://www.futfanatics.com.br/tenis-puma-cell-divide-sl-bpd-preto-e-prata
Tênis Olympikus Lev Feminino Preto;139.9;30;https://www.futfanatics.com.br/tenis-olympikus-lev-feminino-preto
Tênis Asics Gel-Shinobi Azul;299.9;30;https://www.futfanatics.com.br/tenis-asics-gel-shinobi-azul
Tênis Adidas Questar Marinho e Laranja;349.9;30;https://www.futfanatics.com.br/tenis-adidas-questar-marinho-e-laranja
Tênis Reserva Lapa New Preto;299.9;30;https://www.futfanatics.com.br/tenis-reserva-rsv007-new-preto
Tênis Puma BMW Motorsport Wired Cage Branco e Azul;349.9;30;https://www.futfanatics.com.br/tenis-puma-bmw-motorsport-wired-cage-branco-e-azul
Tênis Olympikus Mood Marinho;139.9;30;https://www.futfanatics.com.br/tenis-olympikus-mood-marinho-futfanatics
Tênis Puma BMW Motorsport Neo Cat Branco e Preto;379.9;30;https://www.futfanatics.com.br/tenis-puma-bmw-motorsport-neo-cat-branco-e-preto
Tênis Puma Scuderia Ferrari Electron E Pro Cinza;379.9;30;https://www.futfanatics.com.br/tenis-puma-scuderia-ferrari-electron-e-pro-cinza
Tênis Fila Racer One Preto e Cinza;279.9;30;https://www.futfanatics.com.br/tenis-fila-racer-one-preto-e-azul
Tênis Puma LQDCell Method Branco;449.9;30;https://www.futfanatics.com.br/tenis-puma-lqdcell-method-branco
Tênis Fila Racer Marker Marinho;279.9;30;https://www.futfanatics.com.br/tenis-fila-racer-marker-marinho
Tênis Joma Vitaly Preto;229.9;30;https://www.futfanatics.com.br/tenis-joma-vitaly-preto
Tênis Olympikus Saturno Marinho e Verde;179.9;30;https://www.futfanatics.com.br/tenis-olympikus-saturno-marinho-e-verde
Tênis Cavalera Eagle Circle II Branco e Verde;179.9;30;https://www.futfanatics.com.br/tenis-cavalera-eagle-circle-ii-branco-e-verde
Tênis Fila Racer One Preto e Grafite;279.9;30;https://www.futfanatics.com.br/tenis-fila-racer-one-preto-e-grafite
Tênis Olympikus Ultraleve 130G Feminino Verde;159.9;30;https://www.futfanatics.com.br/tenis-olympikus-ultraleve-130g-feminino-verde
Tênis Puma LQDCell Method Preto e Branco;449.9;30;https://www.futfanatics.com.br/tenis-puma-lqdcell-method-preto-e-branco
Tênis Puma BMW Motorsport Drift Cat Decima Preto e Branco;449.9;30;https://www.futfanatics.com.br/tenis-puma-bmw-motorsport-drift-cat-decima-preto-e-branco
Tênis Oakley Ozone II Preto;349.9;30;https://www.futfanatics.com.br/tenis-oakley-ozone-ii-preto
Tênis Olympikus Saturno Cinza e Amarelo;179.9;30;https://www.futfanatics.com.br/tenis-olympikus-saturno-cinza-e-amarelo
Tênis Olympikus Orion Marinho e Dourado;159.9;30;https://www.futfanatics.com.br/tenis-olympikus-orion-marinho-e-dourado
Tênis Olympikus Ultraleve 155G Marinho;159.9;30;https://www.futfanatics.com.br/tenis-olympikus-ultraleve-155g-marinho
Tênis Olympikus Orion Preto e Verde;159.9;30;https://www.futfanatics.com.br/tenis-olympikus-orion-preto-e-verde
Tênis Reserva Joy Marinho e Vermelho;239.9;29;https://www.futfanatics.com.br/tenis-reserva-joy-marinho-e-vermelho
Tênis Coca Cola X-Fly Happy All Black;189.9;29;https://www.futfanatics.com.br/tenis-coca-cola-x-fly-happy-all-black
Tênis Puma BMW Motorsport Wired Cage Preto e Azul;389.9;29;https://www.futfanatics.com.br/tenis-puma-bmw-motorsport-wired-cage-preto-e-azul
Tênis Oakley Dry II Preto;389.9;29;https://www.futfanatics.com.br/tenis-oakley-dry-ii-preto
Tênis Redley Originals Colab Circo Branco;169.9;29;https://www.futfanatics.com.br/tenis-redley-originals-colab-circo-branco
Tênis Redley Originals Colors Cano Médio Off White;169.9;29;https://www.futfanatics.com.br/tenis-redley-originals-colors-cano-medio-bege
Tênis Redley Originals Cano Médio Amarelo;169.9;29;https://www.futfanatics.com.br/tenis-redley-originals-cano-medio-amarelo
Tênis Redley Originals Cano Médio Bege;169.9;29;https://www.futfanatics.com.br/tenis-redley-originals-cano-medio-bege
Tênis Redley Originals Cano Médio II Vinho;169.9;29;https://www.futfanatics.com.br/tenis-redley-originals-cano-medio-ii-vinho
Tênis Puma Scuderia Ferrari Drift Cat Delta Vermelho;389.9;29;https://www.futfanatics.com.br/tenis-puma-scuderia-ferrari-drift-cat-delta-vermelho
Tênis Under Armour HOVR Infinite 2 Marinho;599.9;29;https://www.futfanatics.com.br/tenis-under-armour-hovr-infinite-2-marinho
Tênis Asics Raiden 3 Preto e Cinza;259.9;29;https://www.futfanatics.com.br/tenis-asics-raiden-3-preto-e-cinza
Tênis Puma Mercedes AMG Petronas MAPF1 Drift Cat Decima Branco;459.9;29;https://www.futfanatics.com.br/tenis-puma-mercedes-amg-petronas-mapf1-drift-cat-decima-branco
Tênis Puma Mercedes AMG Petronas MAPF1 Drift Cat Decima Branco e Azul;459.9;29;https://www.futfanatics.com.br/tenis-puma-mercedes-amg-petronas-mapf1-drift-cat-decima-branco-e-azul
Tênis Reserva Flip Off White;249.9;28;https://www.futfanatics.com.br/tenis-reserva-flip-off-white
Tênis Fila Lancer Preto e Cinza;199.9;28;https://www.futfanatics.com.br/tenis-fila-lancer-preto-e-cinza
Tênis Joma Titanium Cinza;429.9;28;https://www.futfanatics.com.br/tenis-joma-titanium-cinza
Tênis Puma Flyer Runner BDP I Cinza;269.9;28;https://www.futfanatics.com.br/tenis-puma-flyer-runner-bdp-i-cinza
Tênis Puma Scuderia Ferrari Electron E Pro Preto e Vermelho;429.9;28;https://www.futfanatics.com.br/tenis-puma-scuderia-ferrari-electron-e-pro-preto-e-vermelho
Tênis Puma Electron 2.0 Cinza e Laranja;319.9;28;https://www.futfanatics.com.br/tenis-puma-electron-2-0-cinza-e-laranja
Tênis Reserva Pier Azul e Branco;249.9;28;https://www.futfanatics.com.br/tenis-reserva-pier-azul-e-branco
Tênis Fila D-Formation Marinho;249.9;28;https://www.futfanatics.com.br/tenis-fila-d-formation-marinho
Tênis Puma Cell Divide SL BPD Branco;359.9;28;https://www.futfanatics.com.br/tenis-puma-cell-divide-sl-bpd-branco
Tênis Puma BMW Motorsport Electron E Branco;429.9;28;https://www.futfanatics.com.br/tenis-puma-bmw-motorsport-electron-e-branco
Tênis Olympikus Dinamo Petróleo;179.9;28;https://www.futfanatics.com.br/tenis-olympikus-dinamo-petroleo
Tênis Olympikus Ultraleve 177G Feminino Azul;179.9;28;https://www.futfanatics.com.br/tenis-olympikus-ultraleve-177g-feminino-azul
Tênis Olympikus Estilo Azul;179.9;28;https://www.futfanatics.com.br/tenis-olympikus-estilo-azul
Tênis Under Armour Charged Fleet Royal;199.9;28;https://www.futfanatics.com.br/tenis-under-armour-charged-fleet-royal
Tênis Olympikus Estilo Feminino Preto e Roxo;179.9;28;https://www.futfanatics.com.br/tenis-olympikus-estilo-feminino-preto
Tênis Fila Stay Bege e Preto;199.9;28;https://www.futfanatics.com.br/tenis-fila-stay-bege-e-preto
Tênis Fila Nest Marinho e Grafite;199.9;28;https://www.futfanatics.com.br/tenis-fila-nest-marinho-e-grafite
Tênis Puma Viz Runner BDP Azul Marinho;319.9;28;https://www.futfanatics.com.br/tenis-puma-viz-runner-bdp-azul-marinho
Tênis Cavalera Break Low Branco e Verde;229.9;28;https://www.futfanatics.com.br/tenis-cavalera-break-low-branco-e-verde
Tênis Puma Pacer Future Preto;319.9;28;https://www.futfanatics.com.br/tenis-puma-pacer-future-preto
Chinelo Oakley Killer Point Camo Verde Militar;199.9;28;https://www.futfanatics.com.br/chinelo-oakley-killer-point-camo-verde-militar
Tênis Reserva Typer R Branco e Preto;499.9;28;https://www.futfanatics.com.br/tenis-reserva-typer-r-branco-e-preto
Tênis Adidas Response Super 3.0 Preto e Azul;499.9;28;https://www.futfanatics.com.br/tenis-adidas-response-super-3-0-preto-e-azul
Tênis Joma Super Cross Marinho;499.9;28;https://www.futfanatics.com.br/tenis-joma-super-cross-marinho
Tênis Puma X-Cell Uprise Soft Focus Preto;499.9;28;https://www.futfanatics.com.br/tenis-puma-x-cell-uprise-soft-focus-preto
Tênis Fila KR5 Night Verde Lima;399.9;27;https://www.futfanatics.com.br/tenis-fila-kr5-night-verde-lima
Tênis Puma BMW Motorsport Electron E Preto;399.9;27;https://www.futfanatics.com.br/tenis-puma-bmw-motorsport-electron-e-preto
Tênis Puma BMW Motorsport MMS Neo Cat Preto e Branco;399.9;27;https://www.futfanatics.com.br/tenis-puma-bmw-motorsport-mms-neo-cat-preto-e-branco
Tênis Puma Mercedes AMG Petronas MAPF1 Electron E Pro Preto e Verde;399.9;27;https://www.futfanatics.com.br/tenis-puma-mercedes-amg-petronas-mapf1-electron-e-pro-preto-e-verde
Tênis Puma Mercedes AMG Petronas MAPF1 Electron E Pro Branco e Verde;399.9;27;https://www.futfanatics.com.br/tenis-puma-mercedes-amg-petronas-mapf1-electron-e-pro-branco-e-verde
Tênis Puma BMW Motorsport Neo Cat Branco;399.9;27;https://www.futfanatics.com.br/tenis-puma-bmw-motorsport-neo-cat-branco
Tênis Puma Scuderia Ferrari Neo Cat Branco e Vermelho;399.9;27;https://www.futfanatics.com.br/tenis-puma-scuderia-ferrari-neo-cat-branco-e-vermelho
Tênis Puma Porsche Turbo Legacy Neo Cat Branco;399.9;27;https://www.futfanatics.com.br/tenis-puma-porsche-turbo-legacy-neo-cat-branco
Tênis Puma Mercedes AMG Petronas MAPF1 Neo Cat I Preto e Verde;399.9;27;https://www.futfanatics.com.br/tenis-puma-mercedes-amg-petronas-mapf1-neo-cat-i-preto-e-verde
Tênis Coca Cola Hoop Branco e Vermelho;259.9;27;https://www.futfanatics.com.br/tenis-coca-cola-hoop-branco-e-vermelho
Tênis Coca Cola Iate Summer Vip Preto;159.9;27;https://www.futfanatics.com.br/tenis-coca-cola-iate-summer-vip-preto
Tenis Fila Kr5 Night Preto e Coral;399.9;27;https://www.futfanatics.com.br/tenis-fila-kr5-night-preto-e-coral
Tênis Olympikus Index 2 Cinza e Verde;129.9;27;https://www.futfanatics.com.br/tenis-olympikus-index-2-cinza-e-verde
Tênis Under Armour HOVR Sonic 5 Preto;649.9;27;https://www.futfanatics.com.br/tenis-under-armour-hovr-sonic-5-preto
Tênis Puma Mercedes AMG Petronas MAPF1 Neo Cat Preto e Verde;399.9;27;https://www.futfanatics.com.br/tenis-puma-mercedes-amg-petronas-mapf1-neo-cat-preto-e-verde
Tênis Puma Scuderia Ferrari Drift Cat Decima Vermelho e preto;469.9;27;https://www.futfanatics.com.br/tenis-puma-scuderia-ferrari-drift-cat-decima-vermelho-e-preto
Tênis Adidas Nebzed Preto e Vermelho;289.9;27;https://www.futfanatics.com.br/tenis-adidas-nebzed-preto-e-vermelho
Tênis Olympikus Vibração Preto e Marinho;129.9;27;https://www.futfanatics.com.br/tenis-olympikus-vibracao-preto-e-marinho
Tênis Coca Cola Court Midnight Caramelo;219.9;26;https://www.futfanatics.com.br/tenis-coca-cola-court-midnight-caramelo
Tênis Adidas EQ21 Cinza;439.9;26;https://www.futfanatics.com.br/tenis-adidas-eq21-cinza
Tênis Mizuno Wave Fujin Cinza;439.9;26;https://www.futfanatics.com.br/tenis-mizuno-wave-fujin-cinza
Tênis Fila Athlon Branco e Preto;219.9;26;https://www.futfanatics.com.br/tenis-fila-athlon-branco-e-preto
Tênis Under Armour Charged Prompt Preto;219.9;26;https://www.futfanatics.com.br/tenis-under-armour-charged-prompt-preto
Tênis Reserva Dock Jeans;249.9;26;https://www.futfanatics.com.br/tenis-reserva-dock-jeans
Tênis Coca Cola Court Midnight Cinza;219.9;26;https://www.futfanatics.com.br/tenis-coca-cola-court-midnight-cinza
Tênis Puma BMW Motorsport Drift Cat Decima Preto;479.9;26;https://www.futfanatics.com.br/tenis-puma-bmw-motorsport-drift-cat-decima-preto
Tênis Olympikus Saturno Marinho e Branco;189.9;26;https://www.futfanatics.com.br/tenis-olympikus-saturno-marinho-e-branco
Tênis Fila Force Cinza e Vermelho;169.9;26;https://www.futfanatics.com.br/tenis-fila-force-cinza-e-vermelho
Tênis Qix Hills Low Branco;139.9;26;https://www.futfanatics.com.br/tenis-qix-hills-low-branco
Tênis Olympikus Ultraleve 232G Azul;169.9;26;https://www.futfanatics.com.br/tenis-olympikus-ultraleve-232g-azul
Tênis Puma BMW Motorsport Wired Cage Preto e Marinho;369.9;26;https://www.futfanatics.com.br/tenis-puma-bmw-motorsport-wired-cage-preto-e-marinho
Tênis Olympikus Rushy Cinza;169.9;26;https://www.futfanatics.com.br/tenis-olympikus-rushy-cinza
Tênis Puma Flyer Runner BDP Preto e Branco;279.9;26;https://www.futfanatics.com.br/tenis-puma-flyer-runner-bdp-preto-e-branco
Chinelo New Era Slide Ne Preto;139.9;26;https://www.futfanatics.com.br/chinelo-new-era-slide-ne-preto
Tênis Puma Cell Divide SL BDP Preto e Verde;329.9;26;https://www.futfanatics.com.br/tenis-puma-cell-divide-sl-bdp-preto-e-verde
Tênis Everlast Bunker Classic Cinza e Vermelho;139.9;26;https://www.futfanatics.com.br/tenis-everlast-bunker-classic-cinza-e-vermelho
Tênis Olympikus Rushy Preto e Vermelho;169.9;26;https://www.futfanatics.com.br/tenis-olympikus-rushy-preto-e-vermelho
Tênis Olympikus Rushy Marinho;169.9;26;https://www.futfanatics.com.br/tenis-olympikus-rushy-marinho
Tênis Puma Wired Rapid BDP;279.9;26;https://www.futfanatics.com.br/tenis-puma-wired-rapid-bdp
Tênis Puma Wired Run BDP Preto e Branco;279.9;26;https://www.futfanatics.com.br/tenis-puma-wired-run-bdp-preto-e-branco
Tênis Olympikus Orion Preto e Amarelo;169.9;26;https://www.futfanatics.com.br/tenis-olympikus-orion-preto-e-amarelo
Tênis Everlast Bunker Classic Preto e Marrom;139.9;26;https://www.futfanatics.com.br/tenis-everlast-bunker-classic-preto-e-marrom
Tênis Puma Flyer Beta BDP Preto;259.9;25;https://www.futfanatics.com.br/tenis-puma-flyer-beta-bdp-preto
Tênis Fila Racer Marker Branco e Grafite;299.9;25;https://www.futfanatics.com.br/tenis-fila-racer-marker-branco-e-grafite
Tênis Coca Cola Rockey Cinza e Marinho;299.9;25;https://www.futfanatics.com.br/tenis-coca-cola-rockey-cinza-e-marinho
Tênis Olympikus Mood Preto;149.9;25;https://www.futfanatics.com.br/tenis-olympikus-mood-preto
Tênis Olympikus Zex Marinho;149.9;25;https://www.futfanatics.com.br/tenis-olympikus-zex-marinho
Tênis Adidas Nebzed Cinza;299.9;25;https://www.futfanatics.com.br/tenis-adidas-nebzed-cinza
Tênis Puma X-Cell Action Preto;599.9;25;https://www.futfanatics.com.br/tenis-puma-x-cell-action-preto
Tênis Fila Racer Marker Preto e Vermelho;299.9;25;https://www.futfanatics.com.br/tenis-fila-racer-marker-preto-e-vermelho
Tênis Coca Cola Rockey Branco;299.9;25;https://www.futfanatics.com.br/tenis-coca-cola-rockey-branco
Tênis Puma Smash V2 BDP II Verde;299.9;25;https://www.futfanatics.com.br/tenis-puma-smash-v2-bdp-ii-verde
Tênis Adidas Runfalcon 3.0 Marinho;299.9;25;https://www.futfanatics.com.br/tenis-adidas-runfalcon-3-0-marinho
