produto,preco,desconto,link,marca
Chuteira Umbro Warskin Society Preta,129.9,27,https://www.futfanatics.com.br/chuteira-umbro-warskin-society-preta,Umbro
Chuteira Adidas Predator Accuracy 23.4 TF Society Azul,289.9,27,https://www.futfanatics.com.br/chuteira-adidas-predator-accuracy-23-4-tf-society-azul,Adidas
Chuteira Umbro Warskin Society Branca,129.9,27,https://www.futfanatics.com.br/chuteira-umbro-warskin-society-branca,Umbro
Chuteira Umbro Warskin Campo Preta,129.9,27,https://www.futfanatics.com.br/chuteira-umbro-warskin-campo-preta,Umbro
Chuteira Umbro Warskin Campo Vermelha,129.9,27,https://www.futfanatics.com.br/chuteira-umbro-warskin-campo-vermelha,Umbro
Chuteira Umbro Tocco II Club Campo Preto,169.9,26,https://www.futfanatics.com.br/chuteira-umbro-tocco-ii-club-campo-preto,Umbro
Chuteira Puma Future Play TT BDP Society Azul Marinho,329.9,26,https://www.futfanatics.com.br/chuteira-puma-future-play-tt-bdp-society-azul-marinho,Puma
Chuteira Joma Liga 5 Futsal Verde,329.9,26,https://www.futfanatics.com.br/chuteira-joma-liga-5-futsal-verde,Joma
Chuteira Oxn Fusion Grip 3 Neo Campo Rosa,109.9,26,https://www.futfanatics.com.br/chuteira-oxn-fusion-grip-3-neo-campo-rosa,Oxn
Chuteira Oxn Fusion Grip 3 Neo Campo Preta,109.9,26,https://www.futfanatics.com.br/chuteira-oxn-fusion-grip-3-neo-campo-preta,Oxn
Chuteira Oxn Velox 4 Neo Campo Laranja,109.9,26,https://www.futfanatics.com.br/chuteira-oxn-velox-4-neo-campo-laranja,Oxn
Chuteira Penalty Brasil 70 Neo Y-2 Society Azul,219.9,26,https://www.futfanatics.com.br/chuteira-penalty-brasil-70-neo-y-2-society-azul,Penalty
Chuteira Oxn Fusion Grip 3 Neo Campo Azul,109.9,26,https://www.futfanatics.com.br/chuteira-oxn-fusion-grip-3-neo-campo-azul,Oxn
Chuteira Umbro Pro 5 Bump Futsal Laranja,439.9,26,https://www.futfanatics.com.br/chuteira-umbro-pro-5-bump-futsal-laranja,Umbro
Chuteira Dray Foorcy 328 Futsal Laranja,89.9,25,https://www.futfanatics.com.br/chuteira-dray-foorcy-328-futsal-laranja,Dray
Chuteira Dray Spedy Society Preta e Verde,89.9,25,https://www.futfanatics.com.br/chuteira-dray-spedy-society-preta-e-verde,Dray
Chuteira Penalty Brasil 70 Neo Futsal Preta,199.9,25,https://www.futfanatics.com.br/chuteira-penalty-brasil-70-neo-futsal-preta,Penalty
Chuteira Umbro Techno Society Branca,179.9,25,https://www.futfanatics.com.br/chuteira-umbro-techno-society-branca,Umbro
Chuteira Oxn Velox 4 Neo Futsal Azul,119.9,25,https://www.futfanatics.com.br/chuteira-oxn-velox-4-neo-futsal-azul,Oxn
Chuteira Umbro Cosmic Society Verde e Preta,119.9,25,https://www.futfanatics.com.br/chuteira-umbro-cosmic-society-verde-e-preta,Umbro
Chuteira Umbro Techno Futsal Preta e Laranja,179.9,25,https://www.futfanatics.com.br/chuteira-umbro-techno-futsal-preta-e-laranja,Umbro
Chuteira Umbro Techno Futsal Verde,179.9,25,https://www.futfanatics.com.br/chuteira-umbro-techno-futsal-verde,Umbro
Chuteira Umbro Techno Futsal Branca,179.9,25,https://www.futfanatics.com.br/chuteira-umbro-techno-futsal-branca,Umbro
Chuteira Umbro Class Campo Marinho e Branca,119.9,25,https://www.futfanatics.com.br/chuteira-umbro-class-campo-marinho-e-branca,Umbro
Chuteira Adidas Artilheira VI IN Futsal Preta,199.9,25,https://www.futfanatics.com.br/chuteira-adidas-artilheira-vi-in-futsal-preta,Adidas
Chuteira Joma Top Flex Society Branca,449.9,25,https://www.futfanatics.com.br/chuteira-joma-top-flex-society-branca,Joma
Chuteira Joma Top Flex Futsal Preta e Amarela,449.9,25,https://www.futfanatics.com.br/chuteira-joma-top-flex-futsal-preta-e-amarela,Joma
Chuteira Puma Ultra Match IT BDPS Futsal Azul,519.9,25,https://www.futfanatics.com.br/chuteira-puma-ultra-match-it-bdps-futsal-azul,Puma
Chuteira Umbro Cosmic Campo Branca,119.9,25,https://www.futfanatics.com.br/chuteira-umbro-cosmic-campo-branca,Umbro
Chuteira Umbro Z League Society Marinho,119.9,25,https://www.futfanatics.com.br/chuteira-umbro-z-league-society-marinho,Umbro
Chuteira Umbro Cosmic Campo Preta E Cinza,119.9,25,https://www.futfanatics.com.br/chuteira-umbro-cosmic-campo-preta-e-cinza,Umbro
Chuteira Puma King Match F/AG Campo Preta,519.9,25,https://www.futfanatics.com.br/chuteira-puma-king-match-f/ag-campo-preta,Puma
Chuteira Oxn Velox 4 Neo Society Azul,119.9,25,https://www.futfanatics.com.br/chuteira-oxn-velox-4-neo-society-azul,Oxn
Chuteira Oxn Spartak 4 Neo Futsal Amarela,119.9,25,https://www.futfanatics.com.br/chuteira-oxn-spartak-4-neo-futsal-amarela,Oxn
Chuteira Umbro Cosmic Society Branca,119.9,25,https://www.futfanatics.com.br/chuteira-umbro-cosmic-society-branca,Umbro
Chuteira Umbro Neo Striker Futsal Vermelha,149.9,25,https://www.futfanatics.com.br/chuteira-umbro-neo-striker-futsal-vermelha,Umbro
Chuteira Umbro Adamant League Campo Preta e Branca,149.9,25,https://www.futfanatics.com.br/chuteira-umbro-adamant-league-campo-preta-e-branca,Umbro
Chuteira Oxn Fusion Grip 4 Neo Society Laranja,119.9,25,https://www.futfanatics.com.br/chuteira-oxn-fusion-grip-4-neo-society-laranja-futfanatics,Oxn
Chuteira Adidas Predator Accuracy 23.4 IN Futsal Preta e Pink,299.9,25,https://www.futfanatics.com.br/chuteira-adidas-predator-accuracy-23-4-in-futsal-preta-e-pink,Adidas
Chuteira Adidas Copa Pure 23.4 TF Society Preta,299.9,25,https://www.futfanatics.com.br/chuteira-adidas-copa-pure-23-4-tf-society-preta,Adidas
Chuteira Oxn Velox 4 Neo Futsal Amarela,119.9,25,https://www.futfanatics.com.br/chuteira-oxn-velox-4-neo-futsal-amarela,Oxn
Chuteira Oxn Velox 4 Neo Society Amarela,119.9,25,https://www.futfanatics.com.br/chuteira-oxn-velox-4-neo-society-amarela,Oxn
Chuteira Penalty Max 1000 Ecoknit Futsal Laranja,299.9,25,https://www.futfanatics.com.br/chuteira-penalty-max-1000-ecoknit-futsal-laranja,Penalty
Chuteira Umbro Velocita Alchemist Premier Campo Preta e Cinza,299.9,25,https://www.futfanatics.com.br/chuteira-umbro-velocita-alchemist-premier-campo-preta-e-cinza,Umbro
Chuteira Oxn Velox 4 Neo Campo Amarela,119.9,25,https://www.futfanatics.com.br/chuteira-oxn-velox-4-neo-campo-amarela,Oxn
Chuteira Adidas X Crazyfast 23.4 IN Futsal Verde Limão e Branca,299.9,25,https://www.futfanatics.com.br/chuteira-adidas-x-crazyfast-23-4-in-futsal-verde-limao-e-branca,Adidas
Chuteira Umbro Orbit Campo Azul,119.9,25,https://www.futfanatics.com.br/chuteira-umbro-orbit-campo-azul,Umbro
Chuteira Penalty Se7e Pro Ecoknit Society Preta,319.9,25,https://www.futfanatics.com.br/chuteira-penalty-se7e-pro-ecoknit-society-preta,Penalty
Chuteira Umbro Orbit Futsal Branca,119.9,25,https://www.futfanatics.com.br/chuteira-umbro-orbit-futsal-branca,Umbro
Chuteira Oxn Velox 4 Neo Futsal Preta e Azul,119.9,25,https://www.futfanatics.com.br/chuteira-oxn-velox-4-neo-futsal-preta-e-azul,Oxn
Chuteira Umbro Orbit Futsal Verde,119.9,25,https://www.futfanatics.com.br/chuteira-umbro-orbit-futsal-verde,Umbro
Chuteira Umbro Orbit Futsal Azul,119.9,25,https://www.futfanatics.com.br/chuteira-umbro-orbit-futsal-azul,Umbro
Chuteira Umbro Pro 5 Bump Club Society Preta,299.9,25,https://www.futfanatics.com.br/chuteira-umbro-pro-5-bump-club-society-preta,Umbro
Chuteira Umbro Orbit Futsal Preta,119.9,25,https://www.futfanatics.com.br/chuteira-umbro-orbit-futsal-preta,Umbro
Chuteira Umbro Orbit Society Verde,119.9,25,https://www.futfanatics.com.br/chuteira-umbro-orbit-society-verde,Umbro
Chuteira Umbro Prisma+ Society Marinho,119.9,25,https://www.futfanatics.com.br/chuteira-umbro-prisma-society-marinho,Umbro
Chuteira Umbro Prisma + Society Laranja,119.9,25,https://www.futfanatics.com.br/chuteira-umbro-prisma-society-laranja,Umbro
Chuteira Oxn Velox 4 Neo Campo Preta e Laranja,119.9,25,https://www.futfanatics.com.br/chuteira-oxn-velox-4-neo-campo-preta-e-laranja,Oxn
Chuteira Oxn Velox 4 Neo Futsal Preta e Laranja,119.9,25,https://www.futfanatics.com.br/chuteira-oxn-velox-4-neo-futsal-preta-e-laranja,Oxn
Chuteira Oxn Velox 4 Neo Futsal Grafite,119.9,25,https://www.futfanatics.com.br/chuteira-oxn-velox-4-neo-futsal-grafite,Oxn
Chuteira Umbro Cosmic Futsal Branca,119.9,25,https://www.futfanatics.com.br/chuteira-umbro-cosmic-futsal-branca,Umbro
Chuteira Oxn Velox 4 Neo Campo Grafite,119.9,25,https://www.futfanatics.com.br/chuteira-oxn-velox-4-neo-campo-grafite,Oxn
Chuteira Oxn Velox 4 Neo Society Grafite,119.9,25,https://www.futfanatics.com.br/chuteira-oxn-velox-4-neo-society-grafite,Oxn
Chuteira Penalty Speed XX Futsal Marinho,149.9,25,https://www.futfanatics.com.br/chuteira-penalty-speed-xx-futsal-marinho,Penalty
Chuteira Kelme Fuerza Society Vermelha,189.9,24,https://www.futfanatics.com.br/chuteira-kelme-fuerza-society-vermelha,Kelme
Chuteira Dray Topfly 390 Futsal Azul,99.9,23,https://www.futfanatics.com.br/chuteira-dray-topfly-390-futsal-azul,Dray
Chuteira Umbro Chrome Futsal Cinza,229.9,23,https://www.futfanatics.com.br/chuteira-umbro-chrome-futsal-cinza,Umbro
Chuteira Umbro Class Society Preta,129.9,23,https://www.futfanatics.com.br/chuteira-umbro-class-society-preta,Umbro
Chuteira Penalty Max 500 Ecoknit XXI Futsal Vermelha,299.9,23,https://www.futfanatics.com.br/chuteira-penalty-max-500-ecoknit-xxi-futsal-vermelha,Penalty
Chuteira Penalty Brasil 70 Neo Y-2 Futsal Branca,229.9,23,https://www.futfanatics.com.br/chuteira-penalty-brasil-70-neo-y-2-futsal-branca,Penalty
Chuteira Penalty Brasil 70 Neo Y-2 Society Preta,229.9,23,https://www.futfanatics.com.br/chuteira-penalty-brasil-70-neo-y-2-society-preta,Penalty
Chuteira Penalty Garra Futsal Branca,129.9,23,https://www.futfanatics.com.br/chuteira-penalty-garra-futsal-branca,Penalty
Chuteira Oxn Agilis I Society Preta e Amarela,99.9,23,https://www.futfanatics.com.br/chuteira-oxn-agilis-i-society-preta-e-amarela,Oxn
Chuteira Dray Foorcy 330 Futsal Verde Limão,99.9,23,https://www.futfanatics.com.br/chuteira-dray-foorcy-330-futsal-verde-limao,Dray
Chuteira Oxn Agilis 2 Campo Preta,99.9,23,https://www.futfanatics.com.br/chuteira-oxn-agilis-2-campo-preta,Oxn
Chuteira Penalty Max 500 Ecoknit XXI Futsal Azul,299.9,23,https://www.futfanatics.com.br/chuteira-penalty-max-500-ecoknit-xxi-futsal-azul,Penalty
Chuteira Umbro Class Society Preta e Branca,129.9,23,https://www.futfanatics.com.br/chuteira-umbro-society-class-preta-e-branca,Umbro
Chuteira Penalty Americas XXI Futsal Marinho,169.9,22,https://www.futfanatics.com.br/chuteira-penalty-americas-xxi-futsal-marinho,Penalty
Chuteira Puma Ultra Play TT BDP Society Azul,349.9,22,https://www.futfanatics.com.br/chuteira-puma-ultra-play-tt-bdp-society-azul,Puma
Chuteira Puma Ultra Play IT BDP Futsal Azul,349.9,22,https://www.futfanatics.com.br/chuteira-puma-ultra-play-it-bdp-futsal-azul,Puma
Chuteira Umbro Attak Eternal Campo Preta,169.9,22,https://www.futfanatics.com.br/chuteira-umbro-attak-eternal-campo-preta,Umbro
Chuteira Puma Future Ultimate FG/AG Campo Azul Marinho,1169.9,22,https://www.futfanatics.com.br/chuteira-puma-future-ultimate-fg/ag-campo-azul-marinho,Puma
Chuteira Penalty Americas XXI Futsal Preta,169.9,22,https://www.futfanatics.com.br/chuteira-penalty-americas-xxi-futsal-preta,Penalty
Chuteira Puma Attacanto TT BDP Society Preta e Branca,269.9,22,https://www.futfanatics.com.br/chuteira-puma-attacanto-tt-bdp-society-preta-e-branca,Puma
Chuteira Umbro Adamant Club Society Preta,269.9,22,https://www.futfanatics.com.br/chuteira-umbro-adamant-club-society-preta,Umbro
Chuteira Puma Future Play IT BDP Futsal Branca,349.9,22,https://www.futfanatics.com.br/chuteira-puma-future-play-it-bdp-futsal-branca,Puma
Chuteira Penalty Americas XXI Futsal Rose,169.9,22,https://www.futfanatics.com.br/chuteira-penalty-americas-xxi-futsal-rose,Penalty
Chuteira Penalty Americas XXI Futsal Vermelha,169.9,22,https://www.futfanatics.com.br/chuteira-penalty-americas-xxi-futsal-vermelha,Penalty
Chuteira Penalty Americas XXI Futsal Azul,169.9,22,https://www.futfanatics.com.br/chuteira-penalty-americas-xxi-futsal-azul,Penalty
Chuteira Oxn Vision Society Grafite e Laranja,109.9,21,https://www.futfanatics.com.br/chuteira-oxn-vision-society-grafite-e-laranja,Oxn
Chuteira Puma Ultra Match+ LL TT BDP Society Azul,629.9,21,https://www.futfanatics.com.br/chuteira-puma-ultra-match-ll-tt-bdp-society-azul,Puma
Chuteira Penalty Líder Y-4 Society Preta,149.9,21,https://www.futfanatics.com.br/chuteira-penalty-lider-y-4-society-preta,Penalty
Chuteira Oxn Vision Futsal Amarela,109.9,21,https://www.futfanatics.com.br/chuteira-oxn-vision-futsal-amarela,Oxn
Chuteira Oxn Rio Society Preta e Branca,109.9,21,https://www.futfanatics.com.br/chuteira-oxn-rio-society-preta-e-branca,Oxn
Chuteira Umbro Pro 5 Bump Club Futsal Preta,299.9,21,https://www.futfanatics.com.br/chuteira-umbro-pro-5-bump-club-futsal-preta,Umbro
Chuteira Oxn Vision Society Preta,109.9,21,https://www.futfanatics.com.br/chuteira-oxn-vision-society-preta,Oxn
Chuteira Oxn Speed 4 Society Azul,109.9,21,https://www.futfanatics.com.br/chuteira-oxn-speed-4-society-azul,Oxn
Chuteira Oxn Agilis 2 Society Hybrid Verde,109.9,21,https://www.futfanatics.com.br/chuteira-oxn-agilis-2-society-hybrid-verde,Oxn
Chuteira Umbro Velocita Elixir Club Society Preta,259.9,21,https://www.futfanatics.com.br/chuteira-umbro-velocita-elixir-club-society-preta,Umbro
Chuteira Dray 806 Futsal Preta,109.9,21,https://www.futfanatics.com.br/chuteira-dray-806-futsal-preta,Dray
Chuteira Oxn Avanti 2 Society Preta,109.9,21,https://www.futfanatics.com.br/chuteira-oxn-avanti-2-society-preta,Oxn
Chuteira Oxn Spartak 3 Neo Society Amarela,119.9,20,https://www.futfanatics.com.br/chuteira-oxn-spartak-neo-3-society-amarela,Oxn
Chuteira Oxn Fusion Grip 3 Neo Futsal Preta e Azul,119.9,20,https://www.futfanatics.com.br/chuteira-oxn-fusion-grip-3-neo-futsal-preta-e-azul,Oxn
Chuteira Oxn Fusion Grip 3 Neo Futsal Preta e Verd,119.9,20,https://www.futfanatics.com.br/chuteira-oxn-fusion-grip-3-neo-futsal-preta-e-verde,Oxn
Chuteira Oxn Fusion Grip 3 Neo Society Preta e Azul,119.9,20,https://www.futfanatics.com.br/chuteira-oxn-fusion-grip-3-neo-society-preta-e-azul,Oxn
Chuteira Oxn Velox 4 Society Preta e Azul,119.9,20,https://www.futfanatics.com.br/chuteira-oxn-velox-4-society-preta-e-azul,Oxn
Chuteira Dray 806 Futsal Azul e Laranja,119.9,20,https://www.futfanatics.com.br/chuteira-dray-806-futsal-azul-e-laranja,Dray
Chuteira Umbro Neo Striker Society Marinho e Dourada,159.9,20,https://www.futfanatics.com.br/chuteira-umbro-neo-striker-society-marinho-e-dourada,Umbro
Chuteira Umbro Prisma+ Society Preta,119.9,20,https://www.futfanatics.com.br/chuteira-umbro-prisma-society-preta,Umbro
Chuteira Oxn Vision 2 Futsal Verde,119.9,20,https://www.futfanatics.com.br/chuteira-oxn-vision-2-futsal-verde,Oxn
Chuteira Oxn Fusion Grip 4 Futsal Preta,119.9,20,https://www.futfanatics.com.br/chuteira-oxn-fusion-grip-4-futsal-preta,Oxn
Chuteira Oxn Player 3 Futsal Preta,119.9,20,https://www.futfanatics.com.br/chuteira-oxn-player-3-futsal-preta,Oxn
Chuteira Oxn Fusion Grip 3 Neo Society Vermelha e,119.9,20,https://www.futfanatics.com.br/chuteira-oxn-fusion-grip-3-neo-society-vermelha-e-preta,Oxn
Chuteira Penalty Bravo XXII Society Amarela,119.9,20,https://www.futfanatics.com.br/chuteira-penalty-bravo-xxii-society-amarela,Penalty
Chuteira Oxn Velox 4 Society Azul,119.9,20,https://www.futfanatics.com.br/chuteira-oxn-velox-4-society-azul,Oxn
Chuteira Oxn Fusion Grip 3 Neo Society Preta,119.9,20,https://www.futfanatics.com.br/chuteira-oxn-fusion-grip-3-neo-society-preta,Oxn
Chuteira Dray Styfel 466 Society Preta e Verde,119.9,20,https://www.futfanatics.com.br/chuteira-dray-styfel-466-society-preta-e-verde,Dray
Chuteira Umbro Neo Striker Society Azul,159.9,20,https://www.futfanatics.com.br/chuteira-umbro-neo-striker-society-azul,Umbro
Chuteira Penalty Matis Y-2 Society Marinho,159.9,20,https://www.futfanatics.com.br/chuteira-penalty-matis-y-2-society-marinho,Penalty
Chuteira Penalty Matis Y-2 Futsal Marinho,159.9,20,https://www.futfanatics.com.br/chuteira-penalty-matis-y-2-futsal-marinho,Penalty
Chuteira Penalty Bravo XXII Futsal Amarela,119.9,20,https://www.futfanatics.com.br/chuteira-penalty-bravo-xxii-futsal-amarela,Penalty
Chuteira Umbro Beat Campo Azul,119.9,20,https://www.futfanatics.com.br/chuteira-umbro-beat-campo-azul,Umbro
Chuteira Penalty Bravo XXII Society Verde,119.9,20,https://www.futfanatics.com.br/chuteira-penalty-bravo-xxii-society-verde,Penalty
Chuteira Mizuno Morelia Neo IV Beta Japan Campo Preta,1999.9,20,https://www.futfanatics.com.br/chuteira-mizuno-morelia-neo-iv-beta-japan-campo-preta,Mizuno
Chuteira Adidas Predator Accuracy 23.4 FxG Campo B,319.9,20,https://www.futfanatics.com.br/chuteira-adidas-predator-accuracy-23-4-fxg-campo-branca-e-verde,Adidas
Chuteira Puma Future 7 Play FG/AG Campo Branca,399.9,20,https://www.futfanatics.com.br/chuteira-puma-future-7-play-fg/ag-campo-branca,Puma
Chuteira Umbro Pro 5 Bump Club Futsal Laranja,319.9,20,https://www.futfanatics.com.br/chuteira-umbro-pro-5-bump-club-futsal-laranja,Umbro
Chuteira Joma Top Flex Society Verde Limão,479.9,20,https://www.futfanatics.com.br/chuteira-joma-top-flex-society-verde-limao,Joma
Chuteira Joma Top Flex Rebound Futsal Laranja,599.9,20,https://www.futfanatics.com.br/chuteira-joma-top-flex-rebound-futsal-laranja,Joma
Chuteira Adidas Predator Accuracy 23.4 IN Futsal Branca e Verde Limão,319.9,20,https://www.futfanatics.com.br/chuteira-adidas-predator-accuracy-23-4-in-futsal-branca-e-verde-limao,Adidas
Chuteira Umbro Adamant Club Campo Preta e Branca,279.9,20,https://www.futfanatics.com.br/chuteira-umbro-adamant-club-campo-preta-e-branca,Umbro
Chuteira Puma Future Match Neymar NJr TT BDP Society Branca,599.9,20,https://www.futfanatics.com.br/chuteira-puma-future-match-neymar-njr-tt-bdp-society-branca,Puma
Chuteira Adidas X Crazyfast 23.4 TF Society Azul,319.9,20,https://www.futfanatics.com.br/chuteira-adidas-x-crazyfast-23-4-tf-society-azul,Adidas
Chuteira Kelme Fuerza Society Preta,199.9,20,https://www.futfanatics.com.br/chuteira-kelme-fuerza-society-preta,Kelme
Chuteira Kelme Fuerza Futsal Vermelha,199.9,20,https://www.futfanatics.com.br/chuteira-kelme-fuerza-futsal-vermelha,Kelme
Chuteira Kelme Fuerza Futsal Azul,199.9,20,https://www.futfanatics.com.br/chuteira-kelme-fuerza-futsal-azul,Kelme
Chuteira Kelme Fuerza Futsal Amarela,199.9,20,https://www.futfanatics.com.br/chuteira-kelme-fuerza-futsal-amarela,Kelme
Chuteira Penalty RX Locker XXI Society Amarela,189.9,20,https://www.futfanatics.com.br/chuteira-penalty-rx-locker-xxi-society-amarela,Penalty
Chuteira Penalty Max 1000 Ecoknit Futsal Branca,319.9,20,https://www.futfanatics.com.br/chuteira-penalty-max-1000-ecoknit-futsal-branca,Penalty
Chuteira Penalty RX Locker XXI Society Laranja,189.9,20,https://www.futfanatics.com.br/chuteira-penalty-rx-locker-xxi-society-laranja,Penalty
Chuteira Penalty Se7e XXI Society Preta,279.9,20,https://www.futfanatics.com.br/chuteira-penalty-se7e-xxi-society-preta,Penalty
Chuteira Penalty Max 1000 Ecoknit Futsal Preta,319.9,20,https://www.futfanatics.com.br/chuteira-penalty-max-1000-ecoknit-futsal-preta,Penalty
Chuteira Penalty Se7e XXI Society Branca,279.9,20,https://www.futfanatics.com.br/chuteira-penalty-se7e-xxi-society-branca,Penalty
Chuteira Puma Future Play FG/AG BPD Campo Verde,359.9,20,https://www.futfanatics.com.br/chuteira-puma-future-play-fg/ag-bpd-campo-verde,Puma
Chuteira Joma Dribling Society Coral,279.9,20,https://www.futfanatics.com.br/chuteira-joma-dribling-society-coral,Joma
Chuteira Penalty Se7e XXI Society Bordô,279.9,20,https://www.futfanatics.com.br/chuteira-penalty-se7e-xxi-society-bordo,Penalty
Chuteira Puma Attacanto IT BDP Futsal Branca,279.9,20,https://www.futfanatics.com.br/chuteira-puma-attacanto-it-bdp-futsal-branca,Puma
Chuteira Penalty RX Locker XXI Campo Amarela,199.9,20,https://www.futfanatics.com.br/chuteira-penalty-rx-locker-xxi-campo-amarela,Penalty
Chuteira Penalty Max 1000 Ecoknit Futsal Marinho,319.9,20,https://www.futfanatics.com.br/chuteira-penalty-max-1000-ecoknit-futsal-marinho,Penalty
Chuteira Puma Ultra Play TT Society Rosa,399.9,20,https://www.futfanatics.com.br/chuteira-puma-ultra-play-tt-society-rosa,Puma
Chuteira Puma Ultra Play IT Futsal Rosa,399.9,20,https://www.futfanatics.com.br/chuteira-puma-ultra-play-it-futsal-rosa,Puma
Chuteira Puma Future 7 Play IT Futsal Branca,399.9,20,https://www.futfanatics.com.br/chuteira-puma-future-7-play-it-futsal-branca,Puma
Chuteira Puma Ultra Play FG/AG Campo Rosa,399.9,20,https://www.futfanatics.com.br/chuteira-puma-ultra-play-fg/ag-campo-rosa,Puma
Chuteira Joma Top Flex Society Branca e Azul,489.9,18,https://www.futfanatics.com.br/chuteira-joma-top-flex-society-branca-e-azul,Joma
Chuteira Oxn Fusion Grip 4 Neo Futsal Rosa,129.9,18,https://www.futfanatics.com.br/chuteira-oxn-fusion-grip-4-neo-futsal-rosa,Oxn
Chuteira Oxn Fusion Grip 4 Neo Society Bordô,129.9,18,https://www.futfanatics.com.br/schuteira-oxn-fusion-grip-4-neo-society-bordo,Oxn
Chuteira Oxn Fusion Grip 4 Neo Futsal Preta,129.9,18,https://www.futfanatics.com.br/chuteira-oxn-fusion-grip-4-neo-futsal-preta,Oxn
Chuteira Oxn Fusion Grip 4 Neo Futsal Azul,129.9,18,https://www.futfanatics.com.br/chuteira-oxn-fusion-grip-4-neo-futsal-azul,Oxn
Chuteira Penalty Brasil 70 Locker XXI Futsal Marinho,269.9,18,https://www.futfanatics.com.br/chuteira-penalty-brasil-70-locker-xxi-futsal-marinho,Penalty
Chuteira Umbro Astro Polar Magma Society Prata e Laranja,389.9,18,https://www.futfanatics.com.br/chuteira-umbro-astro-polar-magma-society-prata-e-laranja,Umbro
Chuteira Oxn Velox 4 Neo Campo Preta e Azul,129.9,18,https://www.futfanatics.com.br/chuteira-oxn-velox-4-neo-campo-preta-e-azul,Oxn
Chuteira Penalty Americas XXI Futsal Bordô,179.9,18,https://www.futfanatics.com.br/chuteira-penalty-americas-xxi-futsal-bordo,Penalty
Chuteira Penalty Americas XXI Futsal Preta e Dourada,179.9,18,https://www.futfanatics.com.br/chuteira-penalty-americas-xxi-futsal-preta-e-dourada,Penalty
Chuteira Penalty Bravo Y-3 Campo Verde,129.9,18,https://www.futfanatics.com.br/chuteira-penalty-bravo-y-3-campo-verde,Penalty
Chuteira Penalty Bravo Y-3 Society Marinho,129.9,18,https://www.futfanatics.com.br/chuteira-penalty-bravo-y-3-society-marinho,Penalty
Chuteira Penalty Garra Y-1 Society Dourada,139.9,17,https://www.futfanatics.com.br/chuteira-penalty-garra-y-1-society-dourada,Penalty
Chuteira Adidas X Crazyfast 23.4 TF Society Preta,329.9,17,https://www.futfanatics.com.br/chuteira-adidas-x-crazyfast-23-4-tf-society-preta,Adidas
Chuteira Penalty Max 1000 Ecoknit Futsal Bordô,329.9,17,https://www.futfanatics.com.br/chuteira-penalty-max-1000-ecoknit-futsal-bordo,Penalty
Chuteira Penalty Garra Y-1 Futsal Dourada,139.9,17,https://www.futfanatics.com.br/chuteira-penalty-garra-y-1-futsal-dourada,Penalty
Chuteira Oxn X-Control 2 Society Amarela,139.9,17,https://www.futfanatics.com.br/chuteira-oxn-x-control-2-society-amarela,Oxn
Chuteira Umbro Class Campo Azul-Marinho.,139.9,17,https://www.futfanatics.com.br/chuteira-umbro-class-campo-azul-marinho,Umbro
Chuteira Penalty Max 500 Ecoknit XXI Futsal Preta,319.9,17,https://www.futfanatics.com.br/chuteira-penalty-max-500-ecoknit-xxi-futsal-preta,Penalty
Chuteira Umbro Adamant Club Campo Branca,289.9,17,https://www.futfanatics.com.br/chuteira-umbro-adamant-club-campo-branca,Umbro
Chuteira Penalty Se7e XXI Society Vermelha,289.9,17,https://www.futfanatics.com.br/chuteira-penalty-se7e-xxi-society-vermelha,Penalty
Chuteira Umbro Adamant Club Society Prata e Branca,289.9,17,https://www.futfanatics.com.br/chuteira-umbro-adamant-club-society-prata-e-branca,Umbro
Chuteira Penalty Garra Society Royal,139.9,17,https://www.futfanatics.com.br/chuteira-penalty-garra-society-royal,Penalty
Chuteira Umbro Class II Society Azul,139.9,17,https://www.futfanatics.com.br/chuteira-umbro-class-ii-society-azul,Umbro
Chuteira Mizuno Alfa Japan Campo Vermelha,1649.9,17,https://www.futfanatics.com.br/chuteira-mizuno-alfa-japan-campo-vermelha,Mizuno
Chuteira Puma Ultra Match TT Society Rosa,579.9,17,https://www.futfanatics.com.br/chuteira-puma-ultra-match-tt-society-rosa,Puma
Chuteira Kelme Subito Futsal Azul,189.9,17,https://www.futfanatics.com.br/chuteira-kelme-subito-society-azul,Kelme
Chuteira Penalty Digital Pro Y-2 Society Preta e Laranja,229.9,17,https://www.futfanatics.com.br/chuteira-penalty-digital-pro-y-2-society-preta-e-laranja,Penalty
Chuteira Dray Layt Society Azul,99.9,16,https://www.futfanatics.com.br/chuteira-dray-layt-society-azul,Dray
Chuteira Penalty Fúria XXII Futsal Preta,149.9,16,https://www.futfanatics.com.br/chuteira-penalty-furia-xxii-futsal-preta,Penalty
Chuteira Penalty Líder Y-3 Society Preta,149.9,16,https://www.futfanatics.com.br/chuteira-penalty-lider-y-3-society-preta,Penalty
Chuteira Joma Top Flex Futsal Azul e Vermelha,499.9,16,https://www.futfanatics.com.br/chuteira-joma-top-flex-futsal-azul-e-vermelha,Joma
Chuteira Joma Top Flex II Futsal Preta e Laranja,499.9,16,https://www.futfanatics.com.br/chuteira-joma-top-flex-ii-futsal-preta-e-laranja,Joma
Chuteira Mizuno Alfa Select AS Society Preta,499.9,16,https://www.futfanatics.com.br/chuteira-mizuno-alfa-select-as-society-preta,Mizuno
Chuteira Penalty Fúria XXII Futsal Amarela,149.9,16,https://www.futfanatics.com.br/chuteira-penalty-furia-xxii-futsal-amarela,Penalty
Chuteira Penalty Fúria XXII Society Amarela,149.9,16,https://www.futfanatics.com.br/chuteira-penalty-furia-xxii-society-amarela,Penalty
Chuteira Penalty Fúria XXII Futsal Azul,149.9,16,https://www.futfanatics.com.br/chuteira-penalty-furia-xxii-futsal-azul,Penalty
Chuteira Penalty Fúria XXII Society Marinho,149.9,16,https://www.futfanatics.com.br/chuteira-penalty-furia-xxii-society-marinho,Penalty
Chuteira Penalty Fúria XXII Society Preta,149.9,16,https://www.futfanatics.com.br/chuteira-penalty-furia-xxii-society-preta,Penalty
Chuteira Oxn Agilis Campo Preta e Amarela,99.9,16,https://www.futfanatics.com.br/chuteira-oxn-agilis-campo-preta-e-amarela,Oxn
Chuteira Penalty Líder Y-3 Futsal Branca,149.9,16,https://www.futfanatics.com.br/chuteira-penalty-lider-y-3-futsal-branca,Penalty
Chuteira Penalty Fúria XXII Futsal Marinho,149.9,16,https://www.futfanatics.com.br/chuteira-penalty-furia-xxii-futsal-marinho,Penalty
