marca;preco;desconto;link
Tênis Olympikus Poseidon Branco;189.9;5;https://www.futfanatics.com.br/tenis-olympikus-poseidon-branco
Tênis Everlast Maverik Chumbo;159.9;5;https://www.futfanatics.com.br/tenis-everlast-maverik-chumbo
Tênis Mizuno Wave Vitality 4 Preto e Verde;379.9;5;https://www.futfanatics.com.br/tenis-mizuno-wave-vitality-4-preto-e-verde
Tênis Everlast Cave Trail Hi Low Preto;379.9;5;https://www.futfanatics.com.br/tenis-everlast-cave-trail-hi-low-preto
Tênis Asics Gel Excite 8 Verde e Preto;379.9;5;https://www.futfanatics.com.br/tenis-asics-gel-excite-8-verde-e-preto
Tênis Everlast Azteca Preto;379.9;5;https://www.futfanatics.com.br/tenis-everlast-azteca-preto
Tênis Reserva Square Marrom;379.9;5;https://www.futfanatics.com.br/tenis-reserva-square-marrom
Tênis Reserva Square Preto;379.9;5;https://www.futfanatics.com.br/tenis-reserva-square-preto
Tênis Under Armour Spawn 3 Preto;379.9;5;https://www.futfanatics.com.br/tenis-under-armour-spawn-3-preto
Tênis Reserva Square Cinza;379.9;5;https://www.futfanatics.com.br/tenis-reserva-square-cinza
Tênis Under Armour Spawn 3 Cinza;379.9;5;https://www.futfanatics.com.br/tenis-under-armour-spawn-3-cinza
Tênis Puma Scuderia Ferrari Neo Cat Branco e Preto;519.9;5;https://www.futfanatics.com.br/tenis-puma-scuderia-ferrari-neo-cat-branco-e-preto
Tênis Puma Scuderia Ferrari Neo Cat Preto;519.9;5;https://www.futfanatics.com.br/tenis-puma-scuderia-ferrari-neo-cat-preto
Tênis Puma Scuderia Ferrari Neo Cat I Vermelho;519.9;5;https://www.futfanatics.com.br/tenis-puma-scuderia-ferrari-neo-cat-i-vermelho
Tênis Olympikus Reverso Saffron;329.9;5;https://www.futfanatics.com.br/tenis-olympikus-reverso-saffron
Tênis Adidas Grand Court 2.0 Branco e Preto;379.9;5;https://www.futfanatics.com.br/tenis-adidas-grand-court-2-0-branco-e-preto
Tênis Puma Porsche Legacy Neo Cat Preto;519.9;5;https://www.futfanatics.com.br/tenis-puma-porsche-legacy-neo-cat-preto
Tênis Mizuno Wave Vitality 4 Vermelho;379.9;5;https://www.futfanatics.com.br/tenis-mizuno-wave-vitality-4-vermelho
Tênis Adidas Duramo 10 Azul Escuro;379.9;5;https://www.futfanatics.com.br/tenis-adidas-duramo-10-azul-escuro
Tênis Adidas Galaxy 6 Preto e Branco;379.9;5;https://www.futfanatics.com.br/tenis-adidas-galaxy-6-preto-e-branco
Tênis Puma Runner V2 Marinho;429.9;4;https://www.futfanatics.com.br/tenis-puma-runner-v2-marinho
Tênis Asics Streetwise Cinza e Marinho;239.9;4;https://www.futfanatics.com.br/tenis-asics-streetwise-cinza-e-marinho
Tênis Oakley Halftrack Low II Verde e Cinza;669.9;4;https://www.futfanatics.com.br/tenis-oakley-halftrack-low-ii-verde-e-cinza
Tênis Oakley Modoc Low Marinho;669.9;4;https://www.futfanatics.com.br/tenis-oakley-modoc-low-marinho
Tênis Adidas Swift Run 22 Branco;669.9;4;https://www.futfanatics.com.br/tenis-adidas-swift-run-22-branco
Tênis Everlast Tempest II Preto;219.9;4;https://www.futfanatics.com.br/tenis-everlast-tempest-ii-preto
Tênis Asics Gel-Rebound Preto;439.9;4;https://www.futfanatics.com.br/tenis-asics-gel-rebound-preto
Tênis Puma X Ray 2 Square BDP II Branco;479.9;4;https://www.futfanatics.com.br/tenis-puma-x-ray-2-square-bdp-ii-branco
Tênis Everlast Atacama Cinza e Preto;479.9;4;https://www.futfanatics.com.br/tenis-everlast-atacama-cinza-e-preto
Tênis Puma Porsche Legacy RDG Cat 2.0 Preto;619.9;4;https://www.futfanatics.com.br/tenis-puma-porsche-legacy-rdg-cat-2-0-preto
Tênis Adidas Own The Game 2.0 Preto e Azul;479.9;4;https://www.futfanatics.com.br/tenis-adidas-own-the-game-2-0-preto-e-azul
Tênis Reserva Type R Classic Off White;599.9;4;https://www.futfanatics.com.br/tenis-reserva-type-r-classic-off-white
Tênis New Balance Roav V2 Cinza e Branco;559.9;3;https://www.futfanatics.com.br/tenis-new-balance-roav-v2-cinza-e-branco
Tênis Mizuno Space 3 Azul e Verde;319.9;3;https://www.futfanatics.com.br/tenis-mizuno-space-3-azul-e-verde
Tênis Asics Gel-Spectrum Preto;529.9;3;https://www.futfanatics.com.br/tenis-asics-gel-spectrum-preto
Tênis Under Armour Charged First Vermelho;289.9;3;https://www.futfanatics.com.br/tenis-under-armour-charged-first-vermelho
Tênis Asics Gel-Excite 8 Azul e Amarelo;349.9;2;https://www.futfanatics.com.br/tenis-asics-gel-excite-8-azul-e-amarelo
Tênis Mizuno Dynasty 3 Preto e Vermelho;349.9;2;https://www.futfanatics.com.br/tenis-mizuno-dynasty-3-preto-e-vermelho
Tênis Mizuno Cool Ride Preto;339.9;2;https://www.futfanatics.com.br/tenis-mizuno-cool-ride-preto
Tênis Olympikus Urbex Preto;199.9;0;https://www.futfanatics.com.br/tenis-olympikus-urbex-feminino-preto-
Tênis Reserva Spriz Branco;899.9;0;https://www.futfanatics.com.br/tenis-reserva-spriz-branco
Tênis New Balance Rebel V3 Preto;1099.9;0;https://www.futfanatics.com.br/tenis-new-balance-rebel-v3-preto
Tênis Olympikus Poseidon Marinho;199.9;0;https://www.futfanatics.com.br/tenis-olympikus-poseidon-marinho
Tênis Mormaii Urban Pulse Marrom;179.9;0;https://www.futfanatics.com.br/tenis-mormaii-urban-pulse-marrom
Tênis Olympikus Eros Preto;199.9;0;https://www.futfanatics.com.br/tenis-olympikus-eros-preto
Tênis Under Armour Project Rock BSR 3 Preto;899.9;0;https://www.futfanatics.com.br/tenis-under-armour-project-rock-bsr-3-preto
Tênis New Balance Fresh Foam X 1080 Unlaced Preto;1299.9;0;https://www.futfanatics.com.br/tenis-new-balance-fresh-foam-x-1080-unlaced-preto
Tênis Asics Gel-Backhand Preto e Azul;499.9;0;https://www.futfanatics.com.br/tenis-asics-gel-backhand-preto-e-azul
Tênis New Balance Fresh Foam Arishi V4 I Azul;499.9;0;https://www.futfanatics.com.br/tenis-new-balance-fresh-foam-arishi-v4-i-azul
Chinelo Kenner RED Preto e Azul;99.9;0;https://www.futfanatics.com.br/chinelo-kenner-red-preto-e-azul
Tênis New Balance 237v1 Marinho e Branco;499.9;0;https://www.futfanatics.com.br/tenis-new-balance-237v1-marinho-e-branco
Chinelo Kenner Flamengo Slide Go Branco e Verde;189.9;0;https://www.futfanatics.com.br/chinelo-kenner-flamengo-slide-go-branco-e-verde
Tênis Mormaii Urban Maui Preto;179.9;0;https://www.futfanatics.com.br/tenis-mormaii-urban-maui-preto
Tênis Reserva Spriz Militar Verde;899.9;0;https://www.futfanatics.com.br/tenis-reserva-spriz-militar
Tênis Mizuno Wave Creation 23 WK Preto e Laranja;1199.9;0;https://www.futfanatics.com.br/tenis-mizuno-wave-creation-23-wk-preto-e-laranja
Chinelo Kenner Rakka All White;179.9;0;https://www.futfanatics.com.br/chinelo-kenner-rakka-all-white
Tênis Olympikus Proof 3 Preto;199.9;0;https://www.futfanatics.com.br/tenis-olympikus-proof-3-preto
Tênis Reserva Spriz All Black;899.9;0;https://www.futfanatics.com.br/tenis-reserva-spriz-all-black
Tênis Fila Renno Vintage Cinza;499.9;0;https://www.futfanatics.com.br/tenis-fila-renno-vintage-cinza
Tênis Olympikus Only 2 Branco;189.9;0;https://www.futfanatics.com.br/tenis-olympikus-only-2-branco
Tênis Olympikus Only 2 Marinho;189.9;0;https://www.futfanatics.com.br/tenis-olympikus-only-2-marinho
Tênis New Balance 237v1 Marinho e Cinza;499.9;0;https://www.futfanatics.com.br/tenis-new-balance-237v1-marinho-e-cinza
Tênis New Balance More v4 Azul;1249.9;0;https://www.futfanatics.com.br/tenis-new-balance-more-v4-azul
Chinelo Kenner Flamengo Slide Go Vermelho;189.9;0;https://www.futfanatics.com.br/chinelo-kenner-flamengo-slide-go-vermelho
Tênis Olympikus Marte Preto e Dourado;189.9;0;https://www.futfanatics.com.br/tenis-olympikus-marte-preto-e-dourado
Tênis Olympikus Marte Preto e Azul;189.9;0;https://www.futfanatics.com.br/tenis-olympikus-marte-preto-e-azul
Tênis New Balance Hierro V7 Cinza e Amarelo;1049.9;0;https://www.futfanatics.com.br/tenis-new-balance-hierro-v7-cinza-e-amarelo
Tênis Asics Gel-Quantum 90 IV Cinza e Laranja;549.9;0;https://www.futfanatics.com.br/tenis-asics-gel-quantum-90-iv-cinza-e-laranja
Tênis New Balance Hierro V6 Amarelo;1049.9;0;https://www.futfanatics.com.br/tenis-new-balance-hierro-v6-amarelo
Tênis Mizuno Wave Sky 6 Verde e Preto;1099.9;0;https://www.futfanatics.com.br/tenis-mizuno-wave-sky-6-verde-e-preto
Tênis New Balance 1080 V12 London Edition Preto;1249.9;0;https://www.futfanatics.com.br/tenis-new-balance-1080v12-london-edition
Tênis Adidas Multix Branco;549.9;0;https://www.futfanatics.com.br/tenis-adidas-multix-branco
Tênis Adidas Multix Preta;549.9;0;https://www.futfanatics.com.br/tenis-adidas-multix-preta
Tênis Mizuno Wave Rider 26 SSW Laranja e Vermelho;999.9;0;https://www.futfanatics.com.br/tenis-mizuno-wave-rider-26-ssw-laranja-e-vermelho
Tênis Mizuno Wave Invictus 3 Preto e Cinza;999.9;0;https://www.futfanatics.com.br/tenis-mizuno-wave-invictus-3-preto-e-cinza
Bota Caterpillar Leverage Hiker WP Preta;949.9;0;https://www.futfanatics.com.br/bota-caterpillar-leverage-hiker-wp-preta
Tênis Mormaii Urban Series Off White;189.9;0;https://www.futfanatics.com.br/tenis-mormaii-urban-series-off-white
Tênis Fila Float Prime Cinza e Laranja;549.9;0;https://www.futfanatics.com.br/tenis-fila-float-prime-cinza-e-laranja
Tênis Fila Ray Tracer TR Branco Preto e Prata;499.9;0;https://www.futfanatics.com.br/tenis-fila-ray-tracer-tr-branco-preto-e-prata
Tênis New Balance 574v2 Preto;549.9;0;https://www.futfanatics.com.br/tenis-new-balance-574v2-preto
Tênis Olympikus Proof 3 Marinho;199.9;0;https://www.futfanatics.com.br/tenis-olympikus-proof-3-marinho
Tênis New Balance 574v2 Bordô;549.9;0;https://www.futfanatics.com.br/tenis-new-balance-574v2-bordo
Tênis Under Armour Dagger Vermelho;499.9;0;https://www.futfanatics.com.br/tenis-under-armour-dagger-vermelho
Tênis Under Armour Dagger Preto;499.9;0;https://www.futfanatics.com.br/tenis-under-armour-dagger-preto
Tênis Fila Float Prime Preto e Cinza;549.9;0;https://www.futfanatics.com.br/tenis-fila-float-prime-preto-e-cinza
Tênis Adidas Run 60s 3.0 Marinho;499.9;0;https://www.futfanatics.com.br/tenis-adidas-run-60s-3-0-marinho
Tênis Fila Racer Spider Coral e Preto;499.9;0;https://www.futfanatics.com.br/tenis-fila-racer-spider-coral-e-preto
Tênis Adidas Run 60s 3.0 Preto;499.9;0;https://www.futfanatics.com.br/tenis-adidas-run-60s-3-0-preto
Tênis Fila Racer Spider Preto e Cinza;499.9;0;https://www.futfanatics.com.br/tenis-fila-racer-spider-preto-e-cinza
Tênis Fila Float Prime Marinho e Verde;549.9;0;https://www.futfanatics.com.br/tenis-fila-float-prime-marinho-e-verde
Tênis Fila Float Prime Marinho;549.9;0;https://www.futfanatics.com.br/tenis-fila-float-prime-marinho
Tênis Olympikus Urbex Marinho;199.9;0;https://www.futfanatics.com.br/tenis-olympikus-urbex-marinho
Tênis Reserva Classic Knit Re Cinza;569.9;0;https://www.futfanatics.com.br/tenis-reserva-classic-knit-re-cinza
Tênis Under Armour HOVR Sonic 5 Branco;899.9;0;https://www.futfanatics.com.br/tenis-under-armour-hovr-sonic-5-branco
Tênis Fila ACD MID Branco;599.9;0;https://www.futfanatics.com.br/tenis-fila-acd-mid-branco
Tênis New Balance Evoz Amarelo;599.9;0;https://www.futfanatics.com.br/tenis-new-balance-evoz-amarelo
Tênis Olympikus Corre Trilha Preto;599.9;0;https://www.futfanatics.com.br/tenis-olympikus-corre-trilha-preto
Tênis Reserva Neo Flamengo Preto;599.9;0;https://www.futfanatics.com.br/tenis-reserva-neo-flamengo-preto
Tênis Reserva Hero Sport Cinza;699.9;0;https://www.futfanatics.com.br/tenis-reserva-hero-sport-cinza
Tênis Under Armour Project Rock Recruit Preto;699.9;0;https://www.futfanatics.com.br/tenis-under-armour-project-rock-recruit-preto
Tênis Reserva Neo Flamengo Branco;599.9;0;https://www.futfanatics.com.br/tenis-reserva-neo-flamengo-branco
Tênis Reserva Hunter Marrom e Branco;599.9;0;https://www.futfanatics.com.br/tenis-reserva-hunter-marrom-e-branco
Bota Caterpillar Colorado 2.0 Marrom;699.9;0;https://www.futfanatics.com.br/bota-caterpillar-colorado-2-0-marrom
Tênis Fila ACD MID Bege e Preto;599.9;0;https://www.futfanatics.com.br/tenis-fila-acd-mid-bege-e-preto
Tênis Adidas Questar Preto e Laranja;599.9;0;https://www.futfanatics.com.br/tenis-adidas-questar-preto-e-laranja
Tênis Fila KR6 Azul;599.9;0;https://www.futfanatics.com.br/tenis-fila-kr6-azul
Tênis Fila KR6 Vermelho e Preto;599.9;0;https://www.futfanatics.com.br/tenis-fila-kr6-vermelho-e-preto
Tênis Fila KR6 Preto e Branco;599.9;0;https://www.futfanatics.com.br/tenis-fila-kr6-preto-e-branco
Tênis Adidas Ultrabounce Preto e Chumbo;599.9;0;https://www.futfanatics.com.br/tenis-adidas-ultrabounce-preto-e-chumbo
Tênis Adidas Ultrabounce II Preto;599.9;0;https://www.futfanatics.com.br/tenis-adidas-ultrabounce-ii-preto
Tênis Adidas Ultrabounce Branco e Preto;599.9;0;https://www.futfanatics.com.br/tenis-adidas-ultrabounce-branco-e-preto
Tênis Adidas Ultrabounce;599.9;0;https://www.futfanatics.com.br/tenis-adidas-ultrabounce
Tênis Adidas Trainer V Marinho;599.9;0;https://www.futfanatics.com.br/tenis-adidas-trainer-v-marinho
Tênis Reserva Hero Sport Creme;699.9;0;https://www.futfanatics.com.br/tenis-reserva-hero-sport-creme
Tênis Reserva Color Jeans Cinza;619.9;0;https://www.futfanatics.com.br/tenis-reserva-color-jeans-cinza
Tênis Reserva Type R Suede Caramelo;629.9;0;https://www.futfanatics.com.br/tenis-reserva-type-r-suede-caramelo
Chinelo Kenner Kivah Line U2 Preto e Vermelho;159.9;0;https://www.futfanatics.com.br/chinelo-kenner-kivah-line-u2-preto-e-vermelho
Tênis Under Armour Project Rock BSR 2 Preto;699.9;0;https://www.futfanatics.com.br/tenis-under-armour-project-rock-bsr-2-preto
Tênis Mizuno Wave Endeavor Preto e Cinza;699.9;0;https://www.futfanatics.com.br/tenis-mizuno-wave-endeavor-preto-e-cinza
Tênis Mizuno Wave Endeavor Marinho;699.9;0;https://www.futfanatics.com.br/tenis-mizuno-wave-endeavor-marinho
Tênis Reserva Type R RE Branco e Verde;699.9;0;https://www.futfanatics.com.br/tenis-reserva-type-r-re-branco-e-verde
Tênis New Balance Fresh Foam Spt Preto e Branco;659.9;0;https://www.futfanatics.com.br/tenis-new-balance-fresh-foam-spt-preto-e-branco
Tênis New Balance Fresh Foam Spt Marinho;659.9;0;https://www.futfanatics.com.br/tenis-new-balance-fresh-foam-spt-marinho
Tênis New Balance Fresh Foam Spt Branco;659.9;0;https://www.futfanatics.com.br/tenis-new-balance-fresh-foam-spt-branco
Tênis Asics Gel-Hypersonic 3 Preto e Azul;649.9;0;https://www.futfanatics.com.br/tenis-asics-gel-hypersonic-3-preto-e-azul
Tênis Adidas Response Super 3.0 Azul;699.9;0;https://www.futfanatics.com.br/tenis-adidas-response-super-3-0-azul
Tênis Adidas Response Super 3.0 Cinza;699.9;0;https://www.futfanatics.com.br/tenis-adidas-response-super-3-0-cinza
Tênis Reserva Classic Mid Cano Médio Cinza;699.9;0;https://www.futfanatics.com.br/tenis-reserva-classic-mid-cano-medio-cinza
Tênis Reserva Shibori Marrom;649.9;0;https://www.futfanatics.com.br/tenis-reserva-shibori-marrom
Tênis Fila Racer T2 Preto e Branco;649.9;0;https://www.futfanatics.com.br/tenis-fila-racer-t2-preto-e-branco
Tênis Reserva Classic Mid Cano Médio Preto;699.9;0;https://www.futfanatics.com.br/tenis-reserva-classic-mid-cano-medio-preto
Tênis Puma Scuderia Ferrari Drift Cat Decima Vermelho e Branco;649.9;0;https://www.futfanatics.com.br/tenis-puma-scuderia-ferrari-drift-cat-decima-vermelho-e-branco
Chinelo Kenner Kivah Line 2 Preto e Azul;159.9;0;https://www.futfanatics.com.br/chinelo-kenner-kivah-line-2-preto-e-azul
Tênis Adidas Response Cinza;499.9;0;https://www.futfanatics.com.br/tenis-adidas-response-cinza
Tênis Adidas Questar Preto e Branco;599.9;0;https://www.futfanatics.com.br/tenis-adidas-questar-preto-e-branco
Tênis Adidas Questar Branco;599.9;0;https://www.futfanatics.com.br/tenis-adidas-questar-branco
Chinelo Kenner Rakka Marrom;179.9;0;https://www.futfanatics.com.br/chinelo-kenner-rakka-marrom
Tênis Asics Gel-Cumulus 24 SE Preto Verde e Branco;799.9;0;https://www.futfanatics.com.br/tenis-asics-gel-cumulus-24-se-preto-verde-e-branco
Tênis Mizuno Wave Stratos Marinho;799.9;0;https://www.futfanatics.com.br/tenis-mizuno-wave-stratos-marinho
Tênis Reserva Hero RE Cinza;799.9;0;https://www.futfanatics.com.br/tenis-reserva-hero-re-cinza
Tênis Under Armour HOVR Sonic 4 Dotd Preto;699.9;0;https://www.futfanatics.com.br/tenis-under-armour-hovr-sonic-4-dotd-preto
Tênis Reserva Classic Knit RE Branco e Verde;569.9;0;https://www.futfanatics.com.br/tenis-reserva-classic-knit-re-branco-e-verde-
Tênis Reserva Hero RE Caramelo;799.9;0;https://www.futfanatics.com.br/tenis-reserva-hero-re-caramelo
Tênis Reserva Hero RE Branco e Verde;799.9;0;https://www.futfanatics.com.br/tenis-reserva-hero-re-branco-e-verde
Tênis Reserva Hero Re Preto e Verde;799.9;0;https://www.futfanatics.com.br/tenis-reserva-hero-re-preto-e-verde
Tênis Adidas Trae Unlimited Preto;799.9;0;https://www.futfanatics.com.br/tenis-adidas-trae-unlimited-preto
Chinelo Puma Popcat 20 BDP Branco e Azul;179.9;0;https://www.futfanatics.com.br/chinelo-puma-popcat-20-bdp-branco-e-azul
Tênis Adidas Ozelle I Preto;599.9;0;https://www.futfanatics.com.br/tenis-adidas-ozelle-i-preto
Bota Caterpillar Trespass Galosh WP Cinza;799.9;0;https://www.futfanatics.com.br/bota-caterpillar-trespass-galosh-wp-cinza
Bota Caterpillar Intruder Mid Cinza;799.9;0;https://www.futfanatics.com.br/bota-caterpillar-intruder-mid-cinza
Tênis Asics Gel-Spectrum Azul e Verde;549.9;0;https://www.futfanatics.com.br/tenis-asics-gel-spectrum-azul-e-verde
Tênis Mizuno Wave Skyrise 3 Azul;799.9;0;https://www.futfanatics.com.br/tenis-mizuno-wave-skyrise-3-azul
Tênis Asics Gel-Spectrum Preto e Dourado;549.9;0;https://www.futfanatics.com.br/tenis-asics-gel-spectrum-preto-e-dourado
Chinelo Kenner Flamengo NK6 Pro Preto;179.9;0;https://www.futfanatics.com.br/chinelo-kenner-flamengo-nk6-pro-preto
Chinelo Kenner Flamengo NK6 Pro Vermelho e Branco;179.9;0;https://www.futfanatics.com.br/chinelo-kenner-flamengo-nk6-pro-vermelho-e-branco
Tênis Mizuno Wave Frontier 14 Preto e Vermelho;899.9;0;https://www.futfanatics.com.br/tenis-mizuno-wave-frontier-14-preto-e-vermelho
Tênis Mizuno Wave Stratos Preto;799.9;0;https://www.futfanatics.com.br/tenis-mizuno-wave-stratos-preto
Tênis Puma X-Cell Action Preto e Branco;799.9;0;https://www.futfanatics.com.br/tenis-puma-x-cell-action-preto-e-branco
Tênis Reserva Kanagawa Marrom;569.9;0;https://www.futfanatics.com.br/tenis-reserva-kanagawa-marrom
Tênis Reserva Astral Kanagawa Marrom;569.9;0;https://www.futfanatics.com.br/tenis-reserva-astral-kanagawa-marrom
Tênis Fila Float Elite Preto e Cinza;749.9;0;https://www.futfanatics.com.br/tenis-fila-float-elite-preto-e-cinza
Tênis Adidas Fluidflow 2.0 I Branco;599.9;0;https://www.futfanatics.com.br/tenis-adidas-fluidflow-2-0-i-branco
Tênis Adidas Crazychaos 2.0 I Preto;599.9;0;https://www.futfanatics.com.br/tenis-adidas-crazychaos-2-0-i-preto
Tênis Mizuno Wave Legend 2 Preto;599.9;0;https://www.futfanatics.com.br/tenis-mizuno-wave-legend-2-preto
Tênis Fila Float Elite Verde e Marinho;749.9;0;https://www.futfanatics.com.br/tenis-fila-float-elite-verde-e-marinho
Tênis Mormaii Urban Marinho;169.9;0;https://www.futfanatics.com.br/tenis-mormaii-urban-marinho
Tênis Mormaii Urban Free Branco;169.9;0;https://www.futfanatics.com.br/tenis-mormaii-urban-free-branco
Tênis Mizuno Wave Legend 2 Azul;599.9;0;https://www.futfanatics.com.br/tenis-mizuno-wave-legend-2-azul
Tênis Fila Float Elite Branco e Preto;749.9;0;https://www.futfanatics.com.br/tenis-fila-float-elite-branco-e-preto
Tênis Fila Float Elite Branco e Azul;749.9;0;https://www.futfanatics.com.br/tenis-fila-float-elite-branco-e-azul
Tênis Mizuno Wave Nitron 2 Marinho;599.9;0;https://www.futfanatics.com.br/tenis-mizuno-wave-nitron-2-marinho
Tênis Mizuno Wave Fujin Preto e Verde;599.9;0;https://www.futfanatics.com.br/tenis-mizuno-wave-fujin-preto-e-verde
Bota Caterpillar Intruder Galosh WP Preta;749.9;0;https://www.futfanatics.com.br/bota-caterpillar-intruder-galosh-wp-preta
Bota Caterpillar Deplete WP BZ Marrom;749.9;0;https://www.futfanatics.com.br/bota-caterpillar-deplete-wp-bz-marrom
Tênis Reserva Color Jeans Branco e Azul;759.9;0;https://www.futfanatics.com.br/tenis-reserva-color-jeans-branco-e-azul
Tênis Fila Acer Branco e Verde;579.9;0;https://www.futfanatics.com.br/tenis-fila-acer-branco-e-verde
Tênis Fila Acer Marinho e Branco;579.9;0;https://www.futfanatics.com.br/tenis-fila-acer-marinho-e-branco
Tênis Fila Renno Vintage Bege e Preto;499.9;0;https://www.futfanatics.com.br/tenis-fila-renno-vintage-bege-e-preto
Tênis Puma Aviator Light Pro BDP Preto;449.9;0;https://www.futfanatics.com.br/tenis-puma-aviator-light-pro-bdp-preto
Tênis Adidas Racer TR21 Preto e Azul;499.9;0;https://www.futfanatics.com.br/tenis-adidas-racer-tr21-preto-e-azul
Tênis Fila Attech Preto e Branco;379.9;0;https://www.futfanatics.com.br/tenis-fila-attech-preto-e-branco
Tênis Coca Cola Daytona Classic Canvas Cano Médio All Black;259.9;0;https://www.futfanatics.com.br/tenis-coca-cola-daytona-classic-canvas-cano-medio-all-black
Tênis Cavalera Color Line Branco e Azul;259.9;0;https://www.futfanatics.com.br/tenis-cavalera-color-line-branco-e-azul
Tênis Fila Recovery II Preto e Cinza;379.9;0;https://www.futfanatics.com.br/tenis-fila-recovery-ii-preto-e-cinza
Tênis Fila Heating Cinza e Preto;379.9;0;https://www.futfanatics.com.br/tenis-fila-heating-cinza-e-preto
Tênis Fila Lugano 7.0 Marinho e Branco;379.9;0;https://www.futfanatics.com.br/tenis-fila-lugano-7-0-marinho-e-branco
Tênis Under Armour Charged Skyline 3 SE Preto;379.9;0;https://www.futfanatics.com.br/tenis-under-armour-charged-skyline-3-se-preto
Tênis Asics Fuzeblast SE Azul;379.9;0;https://www.futfanatics.com.br/tenis-asics-fuzeblast-se-azul
Tênis Converse All Star Chuck Taylor Cano Alto Verde;269.9;0;https://www.futfanatics.com.br/tenis-converse-all-star-chuck-taylor-cano-alto-verde
Tênis Asics Versablast 2 SE Noosa Preto;379.9;0;https://www.futfanatics.com.br/tenis-asics-versablast-2-se-noosa-preto
Tênis Cavalera Approval Branco e Branco;269.9;0;https://www.futfanatics.com.br/tenis-cavalera-approval-branco-e-branco
Tênis Converse All Star Chuck Taylor Preto e Vermelho;269.9;0;https://www.futfanatics.com.br/tenis-converse-all-star-chuck-taylor-preto-e-vermelho
Tênis Converse All Star Chuck Taylor Monochrome Preto;269.9;0;https://www.futfanatics.com.br/tenis-converse-all-star-chuck-taylor-monochrome-preto
Tênis Converse All Star Chuck Taylor Cano Médio Branco;269.9;0;https://www.futfanatics.com.br/tenis-converse-all-star-chuck-taylor-cano-medio-branco
Tênis Converse All Star Chuck Taylor Cano Médio Preto e Branco;269.9;0;https://www.futfanatics.com.br/tenis-converse-all-star-chuck-taylor-cano-medio-preto-e-branco
Tênis Converse All Star Chuck Taylor Monochrome Branco;269.9;0;https://www.futfanatics.com.br/tenis-converse-all-star-chuck-taylor-monochrome-branco
Tênis Converse All Star Chuck Taylor Monochrome II Branco;369.9;0;https://www.futfanatics.com.br/tenis-converse-all-star-chuck-taylor-monochrome-ii-branco
Tênis Coca Cola Stamp Madisson Marrom;359.9;0;https://www.futfanatics.com.br/tenis-coca-cola-stamp-madisson-marrom
Tênis Coca Cola Stamp Madisson All Black;359.9;0;https://www.futfanatics.com.br/tenis-coca-cola-stamp-madisson-all-black
Tênis Fila Euro Jogger Sport Preto e Bege;359.9;0;https://www.futfanatics.com.br/tenis-fila-euro-jogger-sport-preto-e-bege
Tênis Olympikus Neblina Preto e Cinza;359.9;0;https://www.futfanatics.com.br/tenis-olympikus-neblina-preto-e-cinza
Tênis Olympikus Neblina Marinho;359.9;0;https://www.futfanatics.com.br/tenis-olympikus-neblina-marinho
Tênis Coca Cola Indiana Preto;279.9;0;https://www.futfanatics.com.br/tenis-coca-cola-indiana-preto
Tênis Coca Cola Shadow Preto;279.9;0;https://www.futfanatics.com.br/tenis-coca-cola-shadow-preto
Tênis Coca Cola Shadow Marrom;279.9;0;https://www.futfanatics.com.br/tenis-coca-cola-shadow-marrom
Tênis Adidas Advantage Base Camouflaged Branco e Verde;349.9;0;https://www.futfanatics.com.br/tenis-adidas-advantage-base-camouflaged-branco-e-verde
Tênis Coca Cola Daytona Classic Canvas Cano Médio Preto;259.9;0;https://www.futfanatics.com.br/tenis-coca-cola-daytona-classic-canvas-cano-medio-preto
Tênis Fila Attech Branco e Cinza;379.9;0;https://www.futfanatics.com.br/tenis-fila-attech-branco-e-cinza
Tênis Olympikus Subverse Preto Mescla;349.9;0;https://www.futfanatics.com.br/tenis-olympikus-subverse-preto-mescla
Tênis Olympikus Perfect 3 Marinho;259.9;0;https://www.futfanatics.com.br/tenis-olympikus-perfect-3-marinho
Tênis Redley Originals Marinho e Cinza;249.9;0;https://www.futfanatics.com.br/tenis-redley-originals-marinho-e-cinza
Tênis Adidas Duramo 10 Azul;399.9;0;https://www.futfanatics.com.br/tenis-adidas-duramo-10-azul
Tênis Adidas Galaxy 6 I Azul;399.9;0;https://www.futfanatics.com.br/tenis-adidas-galaxy-6-i-azul
Tênis Reserva Lapa RE Branco;399.9;0;https://www.futfanatics.com.br/tenis-reserva-lapa-re-branco
Tênis Mizuno Wave Way 3 Marinho;399.9;0;https://www.futfanatics.com.br/tenis-mizuno-wave-way-3-marinho
Tênis Mizuno Wave Way 3 Preto e Vermelho;399.9;0;https://www.futfanatics.com.br/tenis-mizuno-wave-way-3-preto-e-vermelho
Tênis Asics Gel Excite 8 Preto e Azul;399.9;0;https://www.futfanatics.com.br/tenis-asics-gel-excite-8-preto-e-azul
Tênis Adidas Grand Court 2.0 Preto e Branco;399.9;0;https://www.futfanatics.com.br/tenis-adidas-grand-court-2-0-preto-e-branco
Tênis Mizuno Wave Vitality 4 Preto;399.9;0;https://www.futfanatics.com.br/tenis-mizuno-wave-vitality-4-preto
Tênis Reserva Cap Toe Marrom;389.9;0;https://www.futfanatics.com.br/tenis-reserva-cap-toe-marrom
Tênis Reserva Cap Toe Preto;389.9;0;https://www.futfanatics.com.br/tenis-reserva-cap-toe-preto
Tênis Everlast Dakar Branco e Dourado;249.9;0;https://www.futfanatics.com.br/tenis-everlast-dakar-branco-e-dourado
Tênis Olympikus Urbano AST Branco;249.9;0;https://www.futfanatics.com.br/tenis-olympikus-urbano-ast-branco
Tênis Olympikus Urbano AST Preto;249.9;0;https://www.futfanatics.com.br/tenis-olympikus-urbano-ast-preto
Tênis Olympikus Rua Branco;249.9;0;https://www.futfanatics.com.br/tenis-olympikus-rua-branco
Tênis Converse All Star Chuck Taylor Branco;249.9;0;https://www.futfanatics.com.br/tenis-converse-all-star-chuck-taylor-branco
Tênis Adidas Show The Way 2.0 Preto;379.9;0;https://www.futfanatics.com.br/tenis-adidas-show-the-way-2-0-preto
