produto,preco,desconto,link,marca
Chuteira Umbro Tocco II Pro FG Campo Preta,519.9,65,https://www.futfanatics.com.br/chuteira-umbro-tocco-ii-pro-fg-campo-preta,Umbro
Chuteira Penalty RX Locker Y-3 Campo Branca,119.9,58,https://www.futfanatics.com.br/chuteira-penalty-rx-locker-y-3-campo-branca,Penalty
Chuteira Puma Tacto II IT BDP Futsal Azul,159.9,54,https://www.futfanatics.com.br/chuteira-puma-tacto-ii-it-bdp-futsal-azul,Puma
Chuteira Umbro Sala V Bump Pro Futsal Vermelha,239.9,52,https://www.futfanatics.com.br/chuteira-umbro-sala-v-bump-pro-futsal-vermelha,Umbro
Chuteira Umbro Stride Futsal Cinza Escuro,99.9,50,https://www.futfanatics.com.br/chuteira-umbro-stride-futsal-cinza-escuro,Umbro
Chuteira Penalty Digital Pro Y-2 Campo Preta e Laranja,139.9,50,https://www.futfanatics.com.br/chuteira-penalty-digital-pro-y-2-campo-preta-e-laranja,Penalty
Chuteira Umbro Play Campo Verde,89.9,50,https://www.futfanatics.com.br/chuteira-umbro-play-campo-verde,Umbro
Chuteira Umbro Stride Futsal Preta e Branca,99.9,50,https://www.futfanatics.com.br/chuteira-umbro-stride-futsal-preta-e-branca,Umbro
Chuteira Umbro Sala V Premier Futsal Branca,199.9,50,https://www.futfanatics.com.br/chuteira-umbro-sala-v-premier-futsal-branca,Umbro
Chuteira Umbro Adamant Pro Campo Coral e Branca,449.9,50,https://www.futfanatics.com.br/chuteira-umbro-adamant-pro-campo-coral-e-branca,Umbro
Chuteira Penalty Brasil 70 Neo Y-2 Campo Azul,149.9,50,https://www.futfanatics.com.br/chuteira-penalty-brasil-70-neo-y-2-campo-azul,Penalty
Chuteira Umbro Stride Futsal Marinho,99.9,50,https://www.futfanatics.com.br/chuteira-umbro-stride-futsal-marinho,Umbro
Chuteira Puma Ultra Match IT BDP Futsal Verde,329.9,49,https://www.futfanatics.com.br/chuteira-puma-ultra-match-it-bdp-futsal-verde,Puma
Chuteira Puma Ultra Match IT BDP Futsal Laranja,329.9,49,https://www.futfanatics.com.br/chuteira-puma-ultra-match-it-bdp-futsal-laranja,Puma
Chuteira Umbro Fifty IV Futsal Preta,119.9,47,https://www.futfanatics.com.br/chuteira-umbro-fifty-iv-futsal-preta,Umbro
Chuteira Umbro Frame Campo Laranja,89.9,47,https://www.futfanatics.com.br/chuteira-umbro-frame-campo-laranja,Umbro
Chuteira Umbro Frame Futsal Laranja,89.9,47,https://www.futfanatics.com.br/chuteira-umbro-frame-futsal-laranja,Umbro
Chuteira Umbro Sala V League Futsal Preta,89.9,47,https://www.futfanatics.com.br/chuteira-umbro-sala-v-league-futsal-preta,Umbro
Chuteira Umbro Adamant Premier Campo Preta e Branca,269.9,46,https://www.futfanatics.com.br/chuteira-umbro-adamant-premier-campo-preta-e-branca,Umbro
Chuteira Umbro Sala V Bump Pro Futsal Verde,269.9,46,https://www.futfanatics.com.br/chuteira-umbro-sala-v-bump-pro-futsal-verde,Umbro
Chuteira Umbro Sala V Premier Futsal Vermelha,219.9,45,https://www.futfanatics.com.br/chuteira-umbro-sala-v-premier-futsal-vermelha,Umbro
Chuteira Umbro Sala V Bump Pro Futsal Branca,279.9,44,https://www.futfanatics.com.br/chuteira-umbro-sala-v-bump-pro-futsal-branca,Umbro
Chuteira Umbro Reflect Campo Laranja e Preta,89.9,43,https://www.futfanatics.com.br/chuteira-umbro-reflect-campo-laranja-e-preta,Umbro
Chuteira Umbro Fifty IV Society Preta,129.9,43,https://www.futfanatics.com.br/chuteira-umbro-fifty-iv-society-preta,Umbro
Chuteira Umbro Fifty IV Futsal Branca,129.9,43,https://www.futfanatics.com.br/chuteira-umbro-fifty-iv-futsal-branca,Umbro
Chuteira Umbro Prisma+ Futsal Marinho,89.9,43,https://www.futfanatics.com.br/chuteira-umbro-prisma-futsal-marinho,Umbro
Chuteira Umbro Prisma Campo Azul,89.9,43,https://www.futfanatics.com.br/chuteira-umbro-prisma-campo-azul,Umbro
Chuteira Umbro Prisma+ Futsal Laranja,89.9,43,https://www.futfanatics.com.br/chuteira-umbro-prisma-futsal-laranja,Umbro
Chuteira Umbro Reflect Campo Prata,89.9,43,https://www.futfanatics.com.br/chuteira-umbro-reflect-campo-prata,Umbro
Chuteira Puma Tacto II IT BDP Futsal Cinza,199.9,42,https://www.futfanatics.com.br/chuteira-puma-tacto-ii-it-bdp-futsal-cinza,Puma
Chuteira Puma Tacto TT II BDP Society Preta e Cinza,199.9,42,https://www.futfanatics.com.br/chuteira-puma-tacto-tt-ii-bdp-society-preta-e-cinza,Puma
Chuteira Umbro Sala V Bump Pro Futsal Preta,289.9,42,https://www.futfanatics.com.br/chuteira-umbro-sala-v-bump-pro-futsal-preta,Umbro
Chuteira Puma Tacto II FG/AG BDP Campo Cinza e Pre,199.9,42,https://www.futfanatics.com.br/chuteira-puma-tacto-ii-fg/ag-bdp-campo-cinza-e-preta,Puma
Chuteira Umbro Astro Club Society Azul,159.9,42,https://www.futfanatics.com.br/chuteira-umbro-astro-club-society-azul,Umbro
Chuteira Umbro Adamant Pro Campo Preta e Branca,529.9,41,https://www.futfanatics.com.br/chuteira-umbro-adamant-pro-campo-preta-e-branca,Umbro
Chuteira Umbro Class Campo Azul e Preta,99.9,41,https://www.futfanatics.com.br/chuteira-umbro-class-campo-azul-e-preta,Umbro
Chuteira Umbro Frame Campo Marinho,99.9,41,https://www.futfanatics.com.br/chuteira-umbro-frame-campo-marinho,Umbro
Chuteira Umbro Sala V League Allure Futsal Azul,99.9,41,https://www.futfanatics.com.br/chuteira-umbro-sala-v-league-allure-futsal-azul,Umbro
Chuteira Umbro Stride Society Cinza,119.9,40,https://www.futfanatics.com.br/chuteira-umbro-stride-society-cinza,Umbro
Chuteira Umbro Stride Society Marinho,119.9,40,https://www.futfanatics.com.br/chuteira-umbro-stride-society-marinho,Umbro
Chuteira Umbro Beat Campo Preta,89.9,40,https://www.futfanatics.com.br/chuteira-umbro-beat-campo-preta,Umbro
Chuteira Puma Ultra Match IT BDP Futsal Branca e Rosa,419.9,40,https://www.futfanatics.com.br/chuteira-puma-ultra-match-it-bdp-futsal-branca-e-rosa,Puma
Chuteira Umbro Velocita Alchemist Club Campo Preta e Cinza,179.9,40,https://www.futfanatics.com.br/chuteira-umbro-velocita-alchemist-club-campo-preta-e-cinza,Umbro
Chuteira Umbro Illusion Futsal Cinza,89.9,40,https://www.futfanatics.com.br/chuteira-umbro-illusion-futsal-cinza,Umbro
Chuteira Umbro Adamant League Society Azul e Branca,119.9,40,https://www.futfanatics.com.br/chuteira-umbro-adamant-league-society-azul-e-branca,Umbro
Chuteira Puma Ultra Match FG/AG BDP Campo Branca e Rosa,419.9,40,https://www.futfanatics.com.br/chuteira-puma-ultra-match-fg/ag-bdp-campo-branca-e-rosa,Puma
Chuteira Umbro Stride Campo Preta e Branca,119.9,40,https://www.futfanatics.com.br/chuteira-umbro-stride-campo-preta-e-branca,Umbro
Chuteira Umbro Adamant League Society Coral e Branca,119.9,40,https://www.futfanatics.com.br/chuteira-umbro-adamant-league-society-coral-e-branca,Umbro
Chuteira Umbro Stride Society Marinho e Azul,119.9,40,https://www.futfanatics.com.br/chuteira-umbro-stride-society-marinho-e-azul,Umbro
Chuteira Umbro Stride Futsal Branca e Preta,119.9,40,https://www.futfanatics.com.br/chuteira-umbro-stride-futsal-branca-e-preta,Umbro
Chuteira Umbro Beat Futsal Prata,89.9,40,https://www.futfanatics.com.br/chuteira-umbro-beat-futsal-prata,Umbro
Chuteira Umbro Astro Club Society Preta,179.9,40,https://www.futfanatics.com.br/chuteira-umbro-astro-club-society-preta,Umbro
Chuteira Penalty Digital Pro Y-2 Futsal Preta e Laranja,169.9,39,https://www.futfanatics.com.br/chuteira-penalty-digital-pro-y-2-futsal-preta-e-laranja,Penalty
Chuteira Umbro Astro Society Preta e Branca,259.9,39,https://www.futfanatics.com.br/chuteira-umbro-astro-society-preta-e-branca,Umbro
Chuteira Penalty Digital Pro Y-2 Futsal Marinho,169.9,39,https://www.futfanatics.com.br/chuteira-penalty-digital-pro-y-2-futsal-marinho,Penalty
Chuteira Umbro Astro Club Society Preta e Laranja,169.9,39,https://www.futfanatics.com.br/chuteira-umbro-astro-club-society-preta-e-laranja,Umbro
Chuteira Umbro Sala V Club Futsal Vermelha,169.9,39,https://www.futfanatics.com.br/chuteira-umbro-sala-v-club-futsal-vermelha,Umbro
Chuteira Adidas Predator Accuracy 23.1 FG Campo Preta e Pink,1099.9,38,https://www.futfanatics.com.br/chuteira-adidas-predator-accuracy-23-1-fg-campo-preta-e-pink,Adidas
Chuteira Penalty RX Locker Y-3 Campo Amarela,179.9,37,https://www.futfanatics.com.br/chuteira-penalty-rx-locker-y-3-campo-amarela,Penalty
Chuteira Penalty RX Locker Y-3 Campo Preta,179.9,37,https://www.futfanatics.com.br/chuteira-penalty-rx-locker-y-3-campo-preta,Penalty
Chuteira Puma Tacto II TT BDP Society Azul,219.9,37,https://www.futfanatics.com.br/chuteira-puma-tacto-ii-tt-bdp-society-azul,Puma
Chuteira Umbro Cosmic Futsal Azul,99.9,37,https://www.futfanatics.com.br/chuteira-umbro-cosmic-futsal-azul,Umbro
Chuteira Umbro Z League Campo Marinho,99.9,37,https://www.futfanatics.com.br/chuteira-umbro-z-league-campo-marinho,Umbro
Chuteira Puma Ultra Play TT BDP Society Verde,299.9,37,https://www.futfanatics.com.br/chuteira-puma-ultra-play-tt-bdp-society-verde,Puma
Chuteira Umbro Astro Society Coral e Preta,249.9,37,https://www.futfanatics.com.br/chuteira-umbro-astro-society-coral-e-preta,Umbro
Chuteira Penalty Viento Y-2 Futsal Branca,149.9,37,https://www.futfanatics.com.br/chuteira-penalty-viento-y-2-futsal-branca,Penalty
Chuteira Penalty S11 Locker Ecoknit XXI Campo Bordô,249.9,37,https://www.futfanatics.com.br/chuteira-penalty-s11-locker-ecoknit-xxi-campo-bordo,Penalty
Chuteira Umbro Z League Futsal Marinho,99.9,37,https://www.futfanatics.com.br/chuteira-umbro-z-league-futsal-marinho,Umbro
Chuteira Penalty Bravo XXII Campo Preta,99.9,37,https://www.futfanatics.com.br/chuteira-penalty-bravo-xxii-campo-preta,Penalty
Chuteira Umbro Reflect Futsal Azul e Verde,99.9,37,https://www.futfanatics.com.br/chuteira-umbro-reflect-futsal-azul-e-verde,Umbro
Chuteira Umbro Cosmic Campo Verde e Azul,99.9,37,https://www.futfanatics.com.br/chuteira-umbro-cosmic-campo-verde-e-azul,Umbro
Chuteira Puma Truco III Futsal Preta,319.9,36,https://www.futfanatics.com.br/chuteira-puma-truco-iii-futsal-preta,Puma
Chuteira Puma King FG BDP Campo Preta,379.9,36,https://www.futfanatics.com.br/chuteira-puma-king-fg-bdp-campo-preta,Puma
Chuteira Puma King TT BDP Society Branca,379.9,36,https://www.futfanatics.com.br/chuteira-puma-king-tt-bdp-society-branca,Puma
Chuteira Penalty Brasil 70 Neo Y-2 Campo Preta,189.9,36,https://www.futfanatics.com.br/chuteira-penalty-brasil-70-neo-y-2-campo-preta,Penalty
Chuteira Penalty Matis Y-2 Campo Marinho,129.9,35,https://www.futfanatics.com.br/chuteira-penalty-matis-y-2-campo-marinho,Penalty
Chuteira Umbro Adamant League Futsal Coral,129.9,35,https://www.futfanatics.com.br/chuteira-umbro-adamant-league-futsal-coral,Umbro
Chuteira Adidas X Crazyfast 23.3 FG/AG Campo Preta,419.9,35,https://www.futfanatics.com.br/chuteira-adidas-x-crazyfast-23-3-fg/ag-campo-preta,Adidas
Chuteira Puma Ultra Match TT BDP Society Branca e Rosa,449.9,35,https://www.futfanatics.com.br/chuteira-puma-ultra-match-tt-bdp-society-branca-e-rosa,Puma
Chuteira Oxn Avanti 2 Campo Preta,89.9,35,https://www.futfanatics.com.br/chuteira-oxn-avanti-2-campo-preta,Oxn
Chuteira Umbro Fast Futsal Vermelha e Coral,89.9,35,https://www.futfanatics.com.br/chuteira-umbro-fast-futsal-vermelha-e-coral,Umbro
Chuteira Umbro Class Futsal Preta e Branca,109.9,35,https://www.futfanatics.com.br/chuteira-umbro-class-futsal-preta-e-branca,Umbro
Chuteira Umbro Neo Striker Futsal Marinho e Dourada,129.9,35,https://www.futfanatics.com.br/chuteira-umbro-neo-striker-futsal-marinho-e-dourada,Umbro
Chuteira Umbro Sala V Club Futsal Branca,179.9,35,https://www.futfanatics.com.br/chuteira-umbro-sala-v-club-futsal-branca,Umbro
Chuteira Umbro Sala V Club Futsal Verde,179.9,35,https://www.futfanatics.com.br/chuteira-umbro-sala-v-club-futsal-verde,Umbro
Chuteira Umbro Neo Striker Society Amarela,129.9,35,https://www.futfanatics.com.br/chuteira-umbro-neo-striker-society-amarela,Umbro
Chuteira Umbro Sala V Club Futsal Preta,179.9,35,https://www.futfanatics.com.br/chuteira-umbro-sala-v-club-futsal-preta,Umbro
Chuteira Penalty Se7e Pro Ecoknit Society Marinho,279.9,34,https://www.futfanatics.com.br/chuteira-penalty-se7e-pro-ecoknit-society-marinho,Penalty
Chuteira Puma Play IT BDP Futsal Verde e Azul,329.9,34,https://www.futfanatics.com.br/chuteira-puma-play-it-bdp-futsal-verde-e-azul,Puma
Chuteira Umbro Fifty IV Society Branca,149.9,34,https://www.futfanatics.com.br/chuteira-umbro-fifty-iv-society-branca,Umbro
Chuteira Puma Tacto II TT BDP Society Amarela,229.9,34,https://www.futfanatics.com.br/chuteira-puma-tacto-ii-tt-bdp-society-amarela,Puma
Chuteira Penalty Brasil 70 Neo Futsal Azul,179.9,33,https://www.futfanatics.com.br/chuteira-penalty-brasil-70-neo-futsal-azul,Penalty
Chuteira Umbro Cosmic Futsal Verde e Azul,99.9,33,https://www.futfanatics.com.br/chuteira-umbro-cosmic-futsal-verde-e-azul,Umbro
Chuteira Umbro Warskin Society Vermelha,119.9,33,https://www.futfanatics.com.br/chuteira-umbro-warskin-society-vermelha,Umbro
Chuteira Umbro Beat Futsal Preta,99.9,33,https://www.futfanatics.com.br/chuteira-umbro-beat-futsal-preta,Umbro
Chuteira Umbro Attak Eternal Campo Azul Marinho,159.9,33,https://www.futfanatics.com.br/chuteira-umbro-attak-eternal-campo-azul-marinho,Umbro
Chuteira Umbro Beat Futsal Coral,99.9,33,https://www.futfanatics.com.br/chuteira-umbro-beat-futsal-coral,Umbro
Chuteira Umbro Techno Society Preta,159.9,33,https://www.futfanatics.com.br/chuteira-umbro-techno-society-preta,Umbro
Chuteira Umbro Techno Society Verde,159.9,33,https://www.futfanatics.com.br/chuteira-umbro-techno-society-verde,Umbro
Chuteira Oxn Velox 4 Futsal Azul,99.9,33,https://www.futfanatics.com.br/chuteira-oxn-velox-4-futsal-azul,Oxn
Chuteira Adidas X Speedportal Messi 22.3 IN Futsal Laranja,399.9,33,https://www.futfanatics.com.br/chuteira-adidas-x-speedportal-messi-22-3-in-futsal-laranja,Adidas
Chuteira Penalty Líder Y-3 Campo Vermelha,119.9,33,https://www.futfanatics.com.br/chuteira-penalty-lider-y-3-campo-vermelha,Penalty
Chuteira Puma King TT BDP Society Preta,399.9,33,https://www.futfanatics.com.br/chuteira-puma-king-tt-bdp-society-preta,Puma
Chuteira Penalty Brasil 70 Neo Y-2 Futsal Azul,199.9,33,https://www.futfanatics.com.br/chuteira-penalty-brasil-70-neo-y-2-futsal-azul,Penalty
Chuteira Umbro Prisma Campo Preta,99.9,33,https://www.futfanatics.com.br/chuteira-umbro-prisma-campo-preta,Umbro
Chuteira Umbro Prisma Futsal Preta,99.9,33,https://www.futfanatics.com.br/chuteira-umbro-prisma-futsal-preta,Umbro
Chuteira Puma Ultra Play FG/AG BDP Campo Azul,299.9,33,https://www.futfanatics.com.br/chuteira-puma-ultra-play-fg/ag-bdp-campo-azul,Puma
Chuteira Penalty RX Locker Y-3 Futsal Amarela,179.9,33,https://www.futfanatics.com.br/chuteira-penalty-rx-locker-y-3-futsal-amarela,Penalty
Chuteira Oxn Velox 4 Campo Laranja,99.9,33,https://www.futfanatics.com.br/chuteira-oxn-velox-4-campo-laranja,Oxn
Chuteira Penalty RX Locker Y-3 Futsal Laranja,179.9,33,https://www.futfanatics.com.br/chuteira-penalty-rx-locker-y-3-futsal-laranja,Penalty
Chuteira Oxn Fusion Grip 3 Neo Society Preta e Ros,99.9,33,https://www.futfanatics.com.br/chuteira-oxn-fusion-grip-3-neo-society-preta-e-rosa,Oxn
Chuteira Penalty RX Locker Y-3 Futsal Azul Claro,179.9,33,https://www.futfanatics.com.br/chuteira-penalty-rx-locker-y-3-futsal-azul-claro,Penalty
Chuteira Umbro Chrome Society Cinza,199.9,33,https://www.futfanatics.com.br/chuteira-umbro-chrome-society-cinza,Umbro
Chuteira Umbro Chrome Society Preta,199.9,33,https://www.futfanatics.com.br/chuteira-umbro-chrome-society-preta,Umbro
Chuteira Oxn Fusion Grip 3 Neo Campo Marinho,99.9,33,https://www.futfanatics.com.br/chuteira-oxn-fusion-grip-3-neo-campo-marinho,Oxn
Chuteira Oxn Spartak 3 Neo Campo Preta e Branca,99.9,33,https://www.futfanatics.com.br/chuteira-oxn-spartak-neo-3-campo-preta-e-branca,Oxn
Chuteira Umbro Chrome Campo Cinza,199.9,33,https://www.futfanatics.com.br/chuteira-umbro-chrome-campo-cinza,Umbro
Chuteira Penalty Brasil 70 Neo Y-2 Society Branca,199.9,33,https://www.futfanatics.com.br/chuteira-penalty-brasil-70-neo-y-2-society-branca,Penalty
Chuteira Penalty Brasil 70 Neo Y-2 Futsal Vermelha,199.9,33,https://www.futfanatics.com.br/chuteira-penalty-brasil-70-neo-y-2-futsal-vermelha,Penalty
Chuteira Umbro Velocita Alchemist Club Campo Azul,199.9,33,https://www.futfanatics.com.br/chuteira-umbro-velocita-alchemist-club-campo-azul,Umbro
Chuteira Oxn Fusion Grip 3 Neo Futsal Preta e Rosa,99.9,33,https://www.futfanatics.com.br/chuteira-oxn-fusion-grip-3-neo-futsal-preta-e-rosa,Oxn
Chuteira Umbro Velocita Alchemist Premier Campo Azul,289.9,32,https://www.futfanatics.com.br/chuteira-umbro-velocita-alchemist-premier-campo-azul,Umbro
Chuteira Umbro Adamant Premier Campo Laranja e Branca,339.9,32,https://www.futfanatics.com.br/chuteira-umbro-adamant-premier-campo-laranja-e-branca,Umbro
Chuteira Umbro Astro Society Preta e Cinza,339.9,32,https://www.futfanatics.com.br/chuteira-umbro-astro-society-preta-e-cinza,Umbro
Chuteira Penalty RX Locker Y-3 Society Azul e Verde,189.9,32,https://www.futfanatics.com.br/chuteira-penalty-rx-locker-y-3-society-azul-e-verde,Penalty
Chuteira Umbro Pro 5 Bump Club Society Laranja,269.9,32,https://www.futfanatics.com.br/chuteira-umbro-pro-5-bump-club-society-laranja,Umbro
Chuteira Puma Ultra Match+ LL TT BDP Society Branca e Rosa,539.9,32,https://www.futfanatics.com.br/chuteira-puma-ultra-match-ll-tt-bdp-society-branca-e-rosa,Puma
Chuteira Penalty RX Locker XXI Futsal Preta,169.9,32,https://www.futfanatics.com.br/chuteira-penalty-rx-locker-xxi-futsal-preta,Penalty
Chuteira Umbro Orbit Campo Preta,109.9,31,https://www.futfanatics.com.br/chuteira-umbro-orbit-campo-preta,Umbro
Chuteira Umbro Orbit Campo Verde,109.9,31,https://www.futfanatics.com.br/chuteira-umbro-orbit-campo-verde,Umbro
Chuteira Umbro Cosmic Society Cinza,109.9,31,https://www.futfanatics.com.br/chuteira-umbro-cosmic-society-cinza,Umbro
Chuteira Umbro Cosmic Futsal Cinza,109.9,31,https://www.futfanatics.com.br/chuteira-umbro-cosmic-futsal-cinza,Umbro
Chuteira Oxn Velox 4 Neo Campo Azul,109.9,31,https://www.futfanatics.com.br/chuteira-oxn-velox-4-neo-campo-azul,Oxn
Chuteira Puma Ultra Match TT BDP Society Azul,479.9,31,https://www.futfanatics.com.br/chuteira-puma-ultra-match-tt-bdp-society-azul,Puma
Chuteira Penalty Bravo XXII Campo Verde,109.9,31,https://www.futfanatics.com.br/chuteira-penalty-bravo-xxii-campo-verde,Penalty
Chuteira Umbro Orbit Campo Branca,109.9,31,https://www.futfanatics.com.br/chuteira-umbro-orbit-campo-branca,Umbro
Chuteira Umbro Acid II Society Preta,109.9,31,https://www.futfanatics.com.br/chuteira-umbro-acid-ii-society-preta,Umbro
Chuteira Umbro Acid II Futsal Preta,109.9,31,https://www.futfanatics.com.br/chuteira-umbro-acid-ii-futsal-preta,Umbro
Chuteira Oxn Velox 4 Neo Campo Marinho e Rosa,109.9,31,https://www.futfanatics.com.br/chuteira-oxn-velox-4-neo-campo-marinho-e-rosa,Oxn
Chuteira Oxn Velox 4 Neo Society Preta e Azul,109.9,31,https://www.futfanatics.com.br/chuteira-oxn-velox-4-neo-society-preta-e-azul,Oxn
Chuteira Umbro Fifty V Society Preta,179.9,30,https://www.futfanatics.com.br/chuteira-umbro-fifty-v-society-preta,Umbro
Chuteira Puma Ultra Match FG/AG BDP Campo Verde,449.9,30,https://www.futfanatics.com.br/chuteira-puma-ultra-match-fg/ag-bdp-campo-verde,Puma
Chuteira Umbro Fifty V Society Azul,179.9,30,https://www.futfanatics.com.br/chuteira-umbro-fifty-v-society-azul,Umbro
Chuteira Puma Truco III Futsal Branca,349.9,30,https://www.futfanatics.com.br/chuteira-puma-truco-iii-futsal-branca,Puma
Chuteira Umbro Fifty IV Futsal Rosa e Branca,159.9,30,https://www.futfanatics.com.br/chuteira-umbro-fifty-iv-futsal-rosa-e-branca,Umbro
Chuteira Umbro Fifty V Campo Preta,179.9,30,https://www.futfanatics.com.br/chuteira-umbro-fifty-v-campo-preta,Umbro
Chuteira Umbro Fifty V Campo Azul,179.9,30,https://www.futfanatics.com.br/chuteira-umbro-fifty-v-campo-azul,Umbro
Chuteira Puma King FG BDP Campo Branca,419.9,30,https://www.futfanatics.com.br/chuteira-puma-king-fg-bdp-campo-branca,Puma
Chuteira Umbro Fifty IV Society Rosa Claro,159.9,30,https://www.futfanatics.com.br/chuteira-umbro-fifty-iv-society-rosa-claro,Umbro
Chuteira Umbro Neo Striker Futsal Preta e Branca,139.9,30,https://www.futfanatics.com.br/chuteira-umbro-neo-striker-futsal-preta-e-branca,Umbro
Chuteira Penalty Se7e Pro Ecoknit Society Branca,299.9,30,https://www.futfanatics.com.br/chuteira-penalty-se7e-pro-ecoknit-society-branca,Penalty
Chuteira Umbro Chrome Campo Azul,209.9,30,https://www.futfanatics.com.br/chuteira-umbro-chrome-campo-azul,Umbro
Chuteira Penalty Se7e Pro Ecoknit Society Azul,299.9,30,https://www.futfanatics.com.br/chuteira-penalty-se7e-pro-ecoknit-society-azul,Penalty
Chuteira Umbro Adamant League Campo Azul e Branca,139.9,30,https://www.futfanatics.com.br/chuteira-umbro-adamant-league-campo-azul-e-branca,Umbro
Chuteira Umbro Attak Eternal Futsal Azul,139.9,30,https://www.futfanatics.com.br/chuteira-umbro-attak-eternal-futsal-azul,Umbro
Chuteira Umbro Chrome Campo Preta,209.9,30,https://www.futfanatics.com.br/chuteira-umbro-chrome-campo-preta,Umbro
Chuteira Umbro Attak Eternal Campo All Black,169.9,29,https://www.futfanatics.com.br/chuteira-umbro-attak-eternal-campo-all-black,Umbro
Chuteira Penalty RX Locker XXI Futsal Amarela,169.9,29,https://www.futfanatics.com.br/chuteira-penalty-rx-locker-xxi-futsal-amarela,Penalty
Chuteira Umbro Class Campo All Black,119.9,29,https://www.futfanatics.com.br/chuteira-umbro-class-campo-all-black,Umbro
Chuteira Umbro Class Campo Preta,119.9,29,https://www.futfanatics.com.br/chuteira-umbro-class-campo-preta,Umbro
Chuteira Umbro Adamant Premier Polar Magma Campo Branca e Laranja,389.9,29,https://www.futfanatics.com.br/chuteira-umbro-adamant-premier-polar-magma-campo-branca-e-laranja,Umbro
Chuteira Umbro Frame Society Marinho,119.9,29,https://www.futfanatics.com.br/chuteira-umbro-frame-society-marinho,Umbro
Chuteira Umbro Sala V League Futsal Vermelha,119.9,29,https://www.futfanatics.com.br/chuteira-umbro-sala-v-league-futsal-vermelha,Umbro
Chuteira Penalty Garra Futsal Azul Escuro,119.9,29,https://www.futfanatics.com.br/chuteira-penalty-garra-futsal-azul-escuro,Penalty
Chuteira Umbro Class Futsal Azul,119.9,29,https://www.futfanatics.com.br/chuteira-umbro-class-futsal-azul,Umbro
Chuteira Umbro Frame Futsal Marinho,119.9,29,https://www.futfanatics.com.br/chuteira-umbro-frame-futsal-marinho,Umbro
Chuteira Puma King Match TT Society Preta e Branca,469.9,29,https://www.futfanatics.com.br/chuteira-puma-king-match-tt-society-preta-e-branca,Puma
Chuteira Puma King Ultimate FG/AG Campo Preta,989.9,29,https://www.futfanatics.com.br/chuteira-puma-king-ultimate-fg/ag-campo-preta,Puma
Chuteira Puma Attacanto FG/AG BDP Campo Branca,269.9,28,https://www.futfanatics.com.br/chuteira-puma-attacanto-fg/ag-bdp-campo-branca,Puma
Chuteira Puma Attacanto IT BDP Futsal Preta e Branca,249.9,28,https://www.futfanatics.com.br/chuteira-puma-attacanto-it-bdp-futsal-preta-e-branca,Puma
Chuteira Oxn Gênio 3 Campo Black,99.9,28,https://www.futfanatics.com.br/chuteira-oxn-genio-3-campo-black,Oxn
Chuteira Umbro Adamant Club Campo Preta,249.9,28,https://www.futfanatics.com.br/chuteira-umbro-adamant-club-campo-preta,Umbro
Chuteira Puma Ultra Match FG/AG BDP Campo Azul,499.9,28,https://www.futfanatics.com.br/chuteira-puma-ultra-match-fg/ag-bdp-campo-azul,Puma
Chuteira Oxn Fusion Grip 3 Campo Rosa,99.9,28,https://www.futfanatics.com.br/chuteira-oxn-fusion-grip-3-campo-rosa,Oxn
Chuteira Umbro Pro 5 Bump Club Brfutsal Society Preta e Verde,319.9,28,https://www.futfanatics.com.br/chuteira-umbro-pro-5-bump-club-brfutsal-society-preta-e-verde,Umbro
Chuteira Oxn Fusion Grip 3 Futsal Preta e Rosa,99.9,28,https://www.futfanatics.com.br/chuteira-oxn-fusion-grip-3-futsal-preta-e-rosa,Oxn
Chuteira Oxn Vision Campo Preta,99.9,28,https://www.futfanatics.com.br/chuteira-oxn-vision-campo-preta,Oxn
Chuteira Umbro Speciali Classic Society Preta,199.9,28,https://www.futfanatics.com.br/chuteira-umbro-speciali-classic-society-preta,Umbro
Chuteira Penalty Digital Pro Y-2 Society Marinho,199.9,28,https://www.futfanatics.com.br/chuteira-penalty-digital-pro-y-2-society-marinho,Penalty
Chuteira Penalty Digital Pro Y-2 Futsal Bordô,199.9,28,https://www.futfanatics.com.br/chuteira-penalty-digital-pro-y-2-futsal-bordo,Penalty
Chuteira Oxn Vision Futsal Grafite e Preto,99.9,28,https://www.futfanatics.com.br/chuteira-oxn-vision-futsal-grafite-e-preto,Oxn
Chuteira Puma Attacanto FG/AG BDP Campo Preta e Cinza,269.9,28,https://www.futfanatics.com.br/chuteira-puma-attacanto-fg/ag-bdp-campo-preta-e-cinza,Puma
Chuteira Oxn Gênio 3 Campo Preta,99.9,28,https://www.futfanatics.com.br/chuteira-oxn-genio-3-campo-preta-futfanatics,Oxn
Chuteira Penalty RX Locker Y-3 Society Amarela,199.9,28,https://www.futfanatics.com.br/chuteira-penalty-rx-locker-y-3-society-amarela,Penalty
Chuteira Oxn Gênio 3 Society Rosa e Preta,99.9,28,https://www.futfanatics.com.br/chuteira-oxn-genio-3-society-rosa-e-preta,Oxn
Chuteira Umbro Fast Futsal Azul e Verde,99.9,28,https://www.futfanatics.com.br/chuteira-umbro-fast-futsal-azul-e-verde,Umbro
Chuteira Penalty Max 500 Ecoknit XXI Futsal Verde Limão,279.9,28,https://www.futfanatics.com.br/chuteira-penalty-max-500-ecoknit-xxi-futsal-verde-limao,Penalty
Chuteira Puma Future Match Neymar NJr FG/AG BDP Campo Branca,539.9,28,https://www.futfanatics.com.br/chuteira-puma-future-match-neymar-njr-fg/ag-bdp-campo-branca,Puma
Chuteira Oxn Speed 4 Futsal Cinza,99.9,28,https://www.futfanatics.com.br/chuteira-oxn-speed-4-futsal-cinza,Oxn
Chuteira Umbro Adamant Premier Society Prata e Branca,399.9,27,https://www.futfanatics.com.br/chuteira-umbro-adamant-premier-society-prata-e-branca,Umbro
Chuteira Umbro Tocco II Club Society Coral e Preta,159.9,27,https://www.futfanatics.com.br/chuteira-umbro-tocco-ii-club-society-coral-e-preta,Umbro
Chuteira Adidas Predator Accuracy 23.4 FxG Campo Azul,289.9,27,https://www.futfanatics.com.br/chuteira-adidas-predator-accuracy-23-4-fxg-campo-azul,Adidas
Chuteira Umbro Adamant Premier Society Preta,399.9,27,https://www.futfanatics.com.br/chuteira-umbro-adamant-premier-society-preta,Umbro
Chuteira Umbro Velocita Elixir Club Campo Preta e Verde,239.9,27,https://www.futfanatics.com.br/chuteira-umbro-velocita-elixir-club-campo-preta-e-verde,Umbro
Chuteira Umbro Attak Eternal Society Preta e Doura,159.9,27,https://www.futfanatics.com.br/chuteira-umbro-attak-eternal-society-preta-e-dourada,Umbro
